15:25:31.807838 IP Comp3134.ssh > cpe1033bf982cdf-cm1033bf982cdd.cpe.net.cable.rogers.com.65054: Flags [P.], seq 523416:523612, ack 253, win 501, length 196
15:25:31.807875 IP Comp3134.ssh > cpe1033bf982cdf-cm1033bf982cdd.cpe.net.cable.rogers.com.65054: Flags [P.], seq 523612:523808, ack 253, win 501, length 196
15:25:31.807910 IP Comp3134.ssh > cpe1033bf982cdf-cm1033bf982cdd.cpe.net.cable.rogers.com.65054: Flags [P.], seq 523808:524004, ack 253, win 501, length 196
15:25:31.807946 IP Comp3134.ssh > cpe1033bf982cdf-cm1033bf982cdd.cpe.net.cable.rogers.com.65054: Flags [P.], seq 524004:524200, ack 253, win 501, length 196
15:25:31.807989 IP Comp3134.ssh > cpe1033bf982cdf-cm1033bf982cdd.cpe.net.cable.rogers.com.65054: Flags [P.], seq 524200:524396, ack 253, win 501, length 196
15:25:31.808027 IP Comp3134.ssh > cpe1033bf982cdf-cm1033bf982cdd.cpe.net.cable.rogers.com.65054: Flags [P.], seq 524396:524592, ack 253, win 501, length 196
15:25:31.808065 IP Comp3134.ssh > cpe1033bf982cdf-cm1033bf982cdd.cpe.net.cable.rogers.com.65054: Flags [P.], seq 524592:524788, ack 253, win 501, length 196
15:25:31.808103 IP Comp3134.ssh > cpe1033bf982cdf-cm1033bf982cdd.cpe.net.cable.rogers.com.65054: Flags [P.], seq 524788:524984, ack 253, win 501, length 196
15:25:31.808149 IP Comp3134.ssh > cpe1033bf982cdf-cm1033bf982cdd.cpe.net.cable.rogers.com.65054: Flags [P.], seq 524984:525180, ack 253, win 501, length 196
15:25:31.808202 IP Comp3134.ssh > cpe1033bf982cdf-cm1033bf982cdd.cpe.net.cable.rogers.com.65054: Flags [P.], seq 525180:525376, ack 253, win 501, length 196
15:25:31.808245 IP Comp3134.ssh > cpe1033bf982cdf-cm1033bf982cdd.cpe.net.cable.rogers.com.65054: Flags [P.], seq 525376:525572, ack 253, win 501, length 196
15:25:31.808296 IP Comp3134.ssh > cpe1033bf982cdf-cm1033bf982cdd.cpe.net.cable.rogers.com.65054: Flags [P.], seq 525572:525768, ack 253, win 501, length 196
15:25:31.808336 IP Comp3134.ssh > cpe1033bf982cdf-cm1033bf982cdd.cpe.net.cable.rogers.com.65054: Flags [P.], seq 525768:525964, ack 253, win 501, length 196
15:25:31.808376 IP Comp3134.ssh > cpe1033bf982cdf-cm1033bf982cdd.cpe.net.cable.rogers.com.65054: Flags [P.], seq 525964:526160, ack 253, win 501, length 196
15:25:31.808416 IP Comp3134.ssh > cpe1033bf982cdf-cm1033bf982cdd.cpe.net.cable.rogers.com.65054: Flags [P.], seq 526160:526356, ack 253, win 501, length 196
15:25:31.808452 IP Comp3134.ssh > cpe1033bf982cdf-cm1033bf982cdd.cpe.net.cable.rogers.com.65054: Flags [P.], seq 526356:526552, ack 253, win 501, length 196
15:25:31.808487 IP Comp3134.ssh > cpe1033bf982cdf-cm1033bf982cdd.cpe.net.cable.rogers.com.65054: Flags [P.], seq 526552:526748, ack 253, win 501, length 196
15:25:31.808523 IP Comp3134.ssh > cpe1033bf982cdf-cm1033bf982cdd.cpe.net.cable.rogers.com.65054: Flags [P.], seq 526748:526944, ack 253, win 501, length 196
15:25:31.808561 IP Comp3134.ssh > cpe1033bf982cdf-cm1033bf982cdd.cpe.net.cable.rogers.com.65054: Flags [P.], seq 526944:527140, ack 253, win 501, length 196
15:25:31.808599 IP Comp3134.ssh > cpe1033bf982cdf-cm1033bf982cdd.cpe.net.cable.rogers.com.65054: Flags [P.], seq 527140:527336, ack 253, win 501, length 196
15:25:31.808641 IP Comp3134.ssh > cpe1033bf982cdf-cm1033bf982cdd.cpe.net.cable.rogers.com.65054: Flags [P.], seq 527336:527532, ack 253, win 501, length 196
15:25:31.808683 IP Comp3134.ssh > cpe1033bf982cdf-cm1033bf982cdd.cpe.net.cable.rogers.com.65054: Flags [P.], seq 527532:527728, ack 253, win 501, length 196
15:25:31.808720 IP Comp3134.ssh > cpe1033bf982cdf-cm1033bf982cdd.cpe.net.cable.rogers.com.65054: Flags [P.], seq 527728:527924, ack 253, win 501, length 196
15:25:31.808758 IP Comp3134.ssh > cpe1033bf982cdf-cm1033bf982cdd.cpe.net.cable.rogers.com.65054: Flags [P.], seq 527924:528120, ack 253, win 501, length 196
15:25:31.808792 IP Comp3134.ssh > cpe1033bf982cdf-cm1033bf982cdd.cpe.net.cable.rogers.com.65054: Flags [P.], seq 528120:528316, ack 253, win 501, length 196
15:25:31.808827 IP Comp3134.ssh > cpe1033bf982cdf-cm1033bf982cdd.cpe.net.cable.rogers.com.65054: Flags [P.], seq 528316:528512, ack 253, win 501, length 196
15:25:31.808862 IP Comp3134.ssh > cpe1033bf982cdf-cm1033bf982cdd.cpe.net.cable.rogers.com.65054: Flags [P.], seq 528512:528708, ack 253, win 501, length 196
15:25:31.808900 IP Comp3134.ssh > cpe1033bf982cdf-cm1033bf982cdd.cpe.net.cable.rogers.com.65054: Flags [P.], seq 528708:528904, ack 253, win 501, length 196
15:25:31.808936 IP Comp3134.ssh > cpe1033bf982cdf-cm1033bf982cdd.cpe.net.cable.rogers.com.65054: Flags [P.], seq 528904:529100, ack 253, win 501, length 196
15:25:31.808976 IP Comp3134.ssh > cpe1033bf982cdf-cm1033bf982cdd.cpe.net.cable.rogers.com.65054: Flags [P.], seq 529100:529296, ack 253, win 501, length 196
15:25:31.809015 IP Comp3134.ssh > cpe1033bf982cdf-cm1033bf982cdd.cpe.net.cable.rogers.com.65054: Flags [P.], seq 529296:529492, ack 253, win 501, length 196
15:25:31.809050 IP Comp3134.ssh > cpe1033bf982cdf-cm1033bf982cdd.cpe.net.cable.rogers.com.65054: Flags [P.], seq 529492:529688, ack 253, win 501, length 196
15:25:31.809084 IP Comp3134.ssh > cpe1033bf982cdf-cm1033bf982cdd.cpe.net.cable.rogers.com.65054: Flags [P.], seq 529688:529884, ack 253, win 501, length 196
15:25:31.809122 IP Comp3134.ssh > cpe1033bf982cdf-cm1033bf982cdd.cpe.net.cable.rogers.com.65054: Flags [P.], seq 529884:530080, ack 253, win 501, length 196
15:25:31.809158 IP Comp3134.ssh > cpe1033bf982cdf-cm1033bf982cdd.cpe.net.cable.rogers.com.65054: Flags [P.], seq 530080:530276, ack 253, win 501, length 196
15:25:31.809195 IP Comp3134.ssh > cpe1033bf982cdf-cm1033bf982cdd.cpe.net.cable.rogers.com.65054: Flags [P.], seq 530276:530472, ack 253, win 501, length 196
15:25:31.809231 IP Comp3134.ssh > cpe1033bf982cdf-cm1033bf982cdd.cpe.net.cable.rogers.com.65054: Flags [P.], seq 530472:530668, ack 253, win 501, length 196
15:25:31.809270 IP Comp3134.ssh > cpe1033bf982cdf-cm1033bf982cdd.cpe.net.cable.rogers.com.65054: Flags [P.], seq 530668:530864, ack 253, win 501, length 196
15:25:31.809310 IP Comp3134.ssh > cpe1033bf982cdf-cm1033bf982cdd.cpe.net.cable.rogers.com.65054: Flags [P.], seq 530864:531060, ack 253, win 501, length 196
15:25:31.809346 IP Comp3134.ssh > cpe1033bf982cdf-cm1033bf982cdd.cpe.net.cable.rogers.com.65054: Flags [P.], seq 531060:531256, ack 253, win 501, length 196
15:25:31.809382 IP Comp3134.ssh > cpe1033bf982cdf-cm1033bf982cdd.cpe.net.cable.rogers.com.65054: Flags [P.], seq 531256:531452, ack 253, win 501, length 196
15:25:31.809418 IP Comp3134.ssh > cpe1033bf982cdf-cm1033bf982cdd.cpe.net.cable.rogers.com.65054: Flags [P.], seq 531452:531648, ack 253, win 501, length 196
15:25:31.809452 IP Comp3134.ssh > cpe1033bf982cdf-cm1033bf982cdd.cpe.net.cable.rogers.com.65054: Flags [P.], seq 531648:531844, ack 253, win 501, length 196
15:25:31.809490 IP Comp3134.ssh > cpe1033bf982cdf-cm1033bf982cdd.cpe.net.cable.rogers.com.65054: Flags [P.], seq 531844:532040, ack 253, win 501, length 196
15:25:31.809525 IP Comp3134.ssh > cpe1033bf982cdf-cm1033bf982cdd.cpe.net.cable.rogers.com.65054: Flags [P.], seq 532040:532236, ack 253, win 501, length 196
15:25:31.809564 IP Comp3134.ssh > cpe1033bf982cdf-cm1033bf982cdd.cpe.net.cable.rogers.com.65054: Flags [P.], seq 532236:532432, ack 253, win 501, length 196
15:25:31.809601 IP Comp3134.ssh > cpe1033bf982cdf-cm1033bf982cdd.cpe.net.cable.rogers.com.65054: Flags [P.], seq 532432:532628, ack 253, win 501, length 196
15:25:31.809637 IP Comp3134.ssh > cpe1033bf982cdf-cm1033bf982cdd.cpe.net.cable.rogers.com.65054: Flags [P.], seq 532628:532824, ack 253, win 501, length 196
15:25:31.809675 IP Comp3134.ssh > cpe1033bf982cdf-cm1033bf982cdd.cpe.net.cable.rogers.com.65054: Flags [P.], seq 532824:533020, ack 253, win 501, length 196
15:25:31.809711 IP Comp3134.ssh > cpe1033bf982cdf-cm1033bf982cdd.cpe.net.cable.rogers.com.65054: Flags [P.], seq 533020:533216, ack 253, win 501, length 196
15:25:31.809745 IP Comp3134.ssh > cpe1033bf982cdf-cm1033bf982cdd.cpe.net.cable.rogers.com.65054: Flags [P.], seq 533216:533412, ack 253, win 501, length 196
15:25:31.809795 IP Comp3134.ssh > cpe1033bf982cdf-cm1033bf982cdd.cpe.net.cable.rogers.com.65054: Flags [P.], seq 533412:533608, ack 253, win 501, length 196
15:25:31.809832 IP Comp3134.ssh > cpe1033bf982cdf-cm1033bf982cdd.cpe.net.cable.rogers.com.65054: Flags [P.], seq 533608:533804, ack 253, win 501, length 196
15:25:31.809868 IP Comp3134.ssh > cpe1033bf982cdf-cm1033bf982cdd.cpe.net.cable.rogers.com.65054: Flags [P.], seq 533804:534000, ack 253, win 501, length 196
15:25:31.809908 IP Comp3134.ssh > cpe1033bf982cdf-cm1033bf982cdd.cpe.net.cable.rogers.com.65054: Flags [P.], seq 534000:534196, ack 253, win 501, length 196
15:25:31.809944 IP Comp3134.ssh > cpe1033bf982cdf-cm1033bf982cdd.cpe.net.cable.rogers.com.65054: Flags [P.], seq 534196:534392, ack 253, win 501, length 196
15:25:31.809981 IP Comp3134.ssh > cpe1033bf982cdf-cm1033bf982cdd.cpe.net.cable.rogers.com.65054: Flags [P.], seq 534392:534588, ack 253, win 501, length 196
15:25:31.810017 IP Comp3134.ssh > cpe1033bf982cdf-cm1033bf982cdd.cpe.net.cable.rogers.com.65054: Flags [P.], seq 534588:534784, ack 253, win 501, length 196
15:25:31.810051 IP Comp3134.ssh > cpe1033bf982cdf-cm1033bf982cdd.cpe.net.cable.rogers.com.65054: Flags [P.], seq 534784:534980, ack 253, win 501, length 196
15:25:31.810087 IP Comp3134.ssh > cpe1033bf982cdf-cm1033bf982cdd.cpe.net.cable.rogers.com.65054: Flags [P.], seq 534980:535176, ack 253, win 501, length 196
15:25:31.810124 IP Comp3134.ssh > cpe1033bf982cdf-cm1033bf982cdd.cpe.net.cable.rogers.com.65054: Flags [P.], seq 535176:535372, ack 253, win 501, length 196
15:25:31.810160 IP Comp3134.ssh > cpe1033bf982cdf-cm1033bf982cdd.cpe.net.cable.rogers.com.65054: Flags [P.], seq 535372:535568, ack 253, win 501, length 196
15:25:31.815794 IP cpe1033bf982cdf-cm1033bf982cdd.cpe.net.cable.rogers.com.65054 > Comp3134.ssh: Flags [.], ack 474812, win 16504, length 0
15:25:31.815820 IP Comp3134.ssh > cpe1033bf982cdf-cm1033bf982cdd.cpe.net.cable.rogers.com.65054: Flags [P.], seq 535568:535764, ack 253, win 501, length 196
15:25:31.815913 IP Comp3134.ssh > cpe1033bf982cdf-cm1033bf982cdd.cpe.net.cable.rogers.com.65054: Flags [P.], seq 535764:536104, ack 253, win 501, length 340
15:25:31.815955 IP Comp3134.ssh > cpe1033bf982cdf-cm1033bf982cdd.cpe.net.cable.rogers.com.65054: Flags [P.], seq 536104:536300, ack 253, win 501, length 196
15:25:31.815994 IP Comp3134.ssh > cpe1033bf982cdf-cm1033bf982cdd.cpe.net.cable.rogers.com.65054: Flags [P.], seq 536300:536496, ack 253, win 501, length 196
15:25:31.816034 IP Comp3134.ssh > cpe1033bf982cdf-cm1033bf982cdd.cpe.net.cable.rogers.com.65054: Flags [P.], seq 536496:536692, ack 253, win 501, length 196
15:25:31.816072 IP Comp3134.ssh > cpe1033bf982cdf-cm1033bf982cdd.cpe.net.cable.rogers.com.65054: Flags [P.], seq 536692:536888, ack 253, win 501, length 196
15:25:31.816109 IP Comp3134.ssh > cpe1033bf982cdf-cm1033bf982cdd.cpe.net.cable.rogers.com.65054: Flags [P.], seq 536888:537084, ack 253, win 501, length 196
15:25:31.816147 IP Comp3134.ssh > cpe1033bf982cdf-cm1033bf982cdd.cpe.net.cable.rogers.com.65054: Flags [P.], seq 537084:537280, ack 253, win 501, length 196
15:25:31.816185 IP Comp3134.ssh > cpe1033bf982cdf-cm1033bf982cdd.cpe.net.cable.rogers.com.65054: Flags [P.], seq 537280:537476, ack 253, win 501, length 196
15:25:31.816222 IP Comp3134.ssh > cpe1033bf982cdf-cm1033bf982cdd.cpe.net.cable.rogers.com.65054: Flags [P.], seq 537476:537672, ack 253, win 501, length 196
15:25:31.816258 IP Comp3134.ssh > cpe1033bf982cdf-cm1033bf982cdd.cpe.net.cable.rogers.com.65054: Flags [P.], seq 537672:537868, ack 253, win 501, length 196
15:25:31.823116 IP cpe1033bf982cdf-cm1033bf982cdd.cpe.net.cable.rogers.com.65054 > Comp3134.ssh: Flags [.], ack 479268, win 16501, length 0
15:25:31.823151 IP Comp3134.ssh > cpe1033bf982cdf-cm1033bf982cdd.cpe.net.cable.rogers.com.65054: Flags [P.], seq 537868:538064, ack 253, win 501, length 196
15:25:31.823251 IP Comp3134.ssh > cpe1033bf982cdf-cm1033bf982cdd.cpe.net.cable.rogers.com.65054: Flags [P.], seq 538064:538404, ack 253, win 501, length 340
15:25:31.823295 IP Comp3134.ssh > cpe1033bf982cdf-cm1033bf982cdd.cpe.net.cable.rogers.com.65054: Flags [P.], seq 538404:538600, ack 253, win 501, length 196
15:25:31.823333 IP Comp3134.ssh > cpe1033bf982cdf-cm1033bf982cdd.cpe.net.cable.rogers.com.65054: Flags [P.], seq 538600:538796, ack 253, win 501, length 196
15:25:31.823373 IP Comp3134.ssh > cpe1033bf982cdf-cm1033bf982cdd.cpe.net.cable.rogers.com.65054: Flags [P.], seq 538796:538992, ack 253, win 501, length 196
15:25:31.823410 IP Comp3134.ssh > cpe1033bf982cdf-cm1033bf982cdd.cpe.net.cable.rogers.com.65054: Flags [P.], seq 538992:539188, ack 253, win 501, length 196
15:25:31.823449 IP Comp3134.ssh > cpe1033bf982cdf-cm1033bf982cdd.cpe.net.cable.rogers.com.65054: Flags [P.], seq 539188:539384, ack 253, win 501, length 196
15:25:31.823491 IP Comp3134.ssh > cpe1033bf982cdf-cm1033bf982cdd.cpe.net.cable.rogers.com.65054: Flags [P.], seq 539384:539580, ack 253, win 501, length 196
15:25:31.823533 IP Comp3134.ssh > cpe1033bf982cdf-cm1033bf982cdd.cpe.net.cable.rogers.com.65054: Flags [P.], seq 539580:539776, ack 253, win 501, length 196
15:25:31.823571 IP Comp3134.ssh > cpe1033bf982cdf-cm1033bf982cdd.cpe.net.cable.rogers.com.65054: Flags [P.], seq 539776:539972, ack 253, win 501, length 196
15:25:31.823608 IP Comp3134.ssh > cpe1033bf982cdf-cm1033bf982cdd.cpe.net.cable.rogers.com.65054: Flags [P.], seq 539972:540168, ack 253, win 501, length 196
15:25:31.823646 IP Comp3134.ssh > cpe1033bf982cdf-cm1033bf982cdd.cpe.net.cable.rogers.com.65054: Flags [P.], seq 540168:540364, ack 253, win 501, length 196
15:25:31.823683 IP Comp3134.ssh > cpe1033bf982cdf-cm1033bf982cdd.cpe.net.cable.rogers.com.65054: Flags [P.], seq 540364:540560, ack 253, win 501, length 196
15:25:31.823724 IP Comp3134.ssh > cpe1033bf982cdf-cm1033bf982cdd.cpe.net.cable.rogers.com.65054: Flags [P.], seq 540560:540756, ack 253, win 501, length 196
15:25:31.823761 IP Comp3134.ssh > cpe1033bf982cdf-cm1033bf982cdd.cpe.net.cable.rogers.com.65054: Flags [P.], seq 540756:540952, ack 253, win 501, length 196
15:25:31.823800 IP Comp3134.ssh > cpe1033bf982cdf-cm1033bf982cdd.cpe.net.cable.rogers.com.65054: Flags [P.], seq 540952:541148, ack 253, win 501, length 196
15:25:31.823837 IP Comp3134.ssh > cpe1033bf982cdf-cm1033bf982cdd.cpe.net.cable.rogers.com.65054: Flags [P.], seq 541148:541344, ack 253, win 501, length 196
15:25:31.823875 IP Comp3134.ssh > cpe1033bf982cdf-cm1033bf982cdd.cpe.net.cable.rogers.com.65054: Flags [P.], seq 541344:541540, ack 253, win 501, length 196
15:25:31.823915 IP Comp3134.ssh > cpe1033bf982cdf-cm1033bf982cdd.cpe.net.cable.rogers.com.65054: Flags [P.], seq 541540:541736, ack 253, win 501, length 196
15:25:31.823953 IP Comp3134.ssh > cpe1033bf982cdf-cm1033bf982cdd.cpe.net.cable.rogers.com.65054: Flags [P.], seq 541736:541932, ack 253, win 501, length 196
15:25:31.823989 IP Comp3134.ssh > cpe1033bf982cdf-cm1033bf982cdd.cpe.net.cable.rogers.com.65054: Flags [P.], seq 541932:542128, ack 253, win 501, length 196
15:25:31.824027 IP Comp3134.ssh > cpe1033bf982cdf-cm1033bf982cdd.cpe.net.cable.rogers.com.65054: Flags [P.], seq 542128:542324, ack 253, win 501, length 196
15:25:31.829876 IP cpe1033bf982cdf-cm1033bf982cdd.cpe.net.cable.rogers.com.65054 > Comp3134.ssh: Flags [.], ack 504012, win 16504, length 0
15:25:31.829876 IP cpe1033bf982cdf-cm1033bf982cdd.cpe.net.cable.rogers.com.65054 > Comp3134.ssh: Flags [.], ack 535176, win 16504, length 0
15:25:31.829940 IP Comp3134.ssh > cpe1033bf982cdf-cm1033bf982cdd.cpe.net.cable.rogers.com.65054: Flags [P.], seq 542324:542520, ack 253, win 501, length 196
15:25:31.830069 IP Comp3134.ssh > cpe1033bf982cdf-cm1033bf982cdd.cpe.net.cable.rogers.com.65054: Flags [P.], seq 542520:542996, ack 253, win 501, length 476
15:25:31.830109 IP Comp3134.ssh > cpe1033bf982cdf-cm1033bf982cdd.cpe.net.cable.rogers.com.65054: Flags [P.], seq 542996:543192, ack 253, win 501, length 196
15:25:31.830164 IP Comp3134.ssh > cpe1033bf982cdf-cm1033bf982cdd.cpe.net.cable.rogers.com.65054: Flags [P.], seq 543192:543388, ack 253, win 501, length 196
15:25:31.830199 IP Comp3134.ssh > cpe1033bf982cdf-cm1033bf982cdd.cpe.net.cable.rogers.com.65054: Flags [P.], seq 543388:543584, ack 253, win 501, length 196
15:25:31.830234 IP Comp3134.ssh > cpe1033bf982cdf-cm1033bf982cdd.cpe.net.cable.rogers.com.65054: Flags [P.], seq 543584:543780, ack 253, win 501, length 196
15:25:31.830269 IP Comp3134.ssh > cpe1033bf982cdf-cm1033bf982cdd.cpe.net.cable.rogers.com.65054: Flags [P.], seq 543780:543976, ack 253, win 501, length 196
15:25:31.830304 IP Comp3134.ssh > cpe1033bf982cdf-cm1033bf982cdd.cpe.net.cable.rogers.com.65054: Flags [P.], seq 543976:544172, ack 253, win 501, length 196
15:25:31.830342 IP Comp3134.ssh > cpe1033bf982cdf-cm1033bf982cdd.cpe.net.cable.rogers.com.65054: Flags [P.], seq 544172:544368, ack 253, win 501, length 196
15:25:31.830378 IP Comp3134.ssh > cpe1033bf982cdf-cm1033bf982cdd.cpe.net.cable.rogers.com.65054: Flags [P.], seq 544368:544564, ack 253, win 501, length 196
15:25:31.830416 IP Comp3134.ssh > cpe1033bf982cdf-cm1033bf982cdd.cpe.net.cable.rogers.com.65054: Flags [P.], seq 544564:544760, ack 253, win 501, length 196
15:25:31.830451 IP Comp3134.ssh > cpe1033bf982cdf-cm1033bf982cdd.cpe.net.cable.rogers.com.65054: Flags [P.], seq 544760:544956, ack 253, win 501, length 196
15:25:31.830485 IP Comp3134.ssh > cpe1033bf982cdf-cm1033bf982cdd.cpe.net.cable.rogers.com.65054: Flags [P.], seq 544956:545152, ack 253, win 501, length 196
15:25:31.830523 IP Comp3134.ssh > cpe1033bf982cdf-cm1033bf982cdd.cpe.net.cable.rogers.com.65054: Flags [P.], seq 545152:545348, ack 253, win 501, length 196
15:25:31.830558 IP Comp3134.ssh > cpe1033bf982cdf-cm1033bf982cdd.cpe.net.cable.rogers.com.65054: Flags [P.], seq 545348:545544, ack 253, win 501, length 196
15:25:31.830596 IP Comp3134.ssh > cpe1033bf982cdf-cm1033bf982cdd.cpe.net.cable.rogers.com.65054: Flags [P.], seq 545544:545740, ack 253, win 501, length 196
15:25:31.830631 IP Comp3134.ssh > cpe1033bf982cdf-cm1033bf982cdd.cpe.net.cable.rogers.com.65054: Flags [P.], seq 545740:545936, ack 253, win 501, length 196
15:25:31.830668 IP Comp3134.ssh > cpe1033bf982cdf-cm1033bf982cdd.cpe.net.cable.rogers.com.65054: Flags [P.], seq 545936:546132, ack 253, win 501, length 196
15:25:31.830703 IP Comp3134.ssh > cpe1033bf982cdf-cm1033bf982cdd.cpe.net.cable.rogers.com.65054: Flags [P.], seq 546132:546328, ack 253, win 501, length 196
15:25:31.830738 IP Comp3134.ssh > cpe1033bf982cdf-cm1033bf982cdd.cpe.net.cable.rogers.com.65054: Flags [P.], seq 546328:546524, ack 253, win 501, length 196
15:25:31.830776 IP Comp3134.ssh > cpe1033bf982cdf-cm1033bf982cdd.cpe.net.cable.rogers.com.65054: Flags [P.], seq 546524:546720, ack 253, win 501, length 196
15:25:31.830810 IP Comp3134.ssh > cpe1033bf982cdf-cm1033bf982cdd.cpe.net.cable.rogers.com.65054: Flags [P.], seq 546720:546916, ack 253, win 501, length 196
15:25:31.830848 IP Comp3134.ssh > cpe1033bf982cdf-cm1033bf982cdd.cpe.net.cable.rogers.com.65054: Flags [P.], seq 546916:547112, ack 253, win 501, length 196
15:25:31.830882 IP Comp3134.ssh > cpe1033bf982cdf-cm1033bf982cdd.cpe.net.cable.rogers.com.65054: Flags [P.], seq 547112:547308, ack 253, win 501, length 196
15:25:31.830920 IP Comp3134.ssh > cpe1033bf982cdf-cm1033bf982cdd.cpe.net.cable.rogers.com.65054: Flags [P.], seq 547308:547504, ack 253, win 501, length 196
15:25:31.830955 IP Comp3134.ssh > cpe1033bf982cdf-cm1033bf982cdd.cpe.net.cable.rogers.com.65054: Flags [P.], seq 547504:547700, ack 253, win 501, length 196
15:25:31.830989 IP Comp3134.ssh > cpe1033bf982cdf-cm1033bf982cdd.cpe.net.cable.rogers.com.65054: Flags [P.], seq 547700:547896, ack 253, win 501, length 196
15:25:31.831027 IP Comp3134.ssh > cpe1033bf982cdf-cm1033bf982cdd.cpe.net.cable.rogers.com.65054: Flags [P.], seq 547896:548092, ack 253, win 501, length 196
15:25:31.831063 IP Comp3134.ssh > cpe1033bf982cdf-cm1033bf982cdd.cpe.net.cable.rogers.com.65054: Flags [P.], seq 548092:548288, ack 253, win 501, length 196
15:25:31.831105 IP Comp3134.ssh > cpe1033bf982cdf-cm1033bf982cdd.cpe.net.cable.rogers.com.65054: Flags [P.], seq 548288:548484, ack 253, win 501, length 196
15:25:31.831142 IP Comp3134.ssh > cpe1033bf982cdf-cm1033bf982cdd.cpe.net.cable.rogers.com.65054: Flags [P.], seq 548484:548680, ack 253, win 501, length 196
15:25:31.831180 IP Comp3134.ssh > cpe1033bf982cdf-cm1033bf982cdd.cpe.net.cable.rogers.com.65054: Flags [P.], seq 548680:548876, ack 253, win 501, length 196
15:25:31.831215 IP Comp3134.ssh > cpe1033bf982cdf-cm1033bf982cdd.cpe.net.cable.rogers.com.65054: Flags [P.], seq 548876:549072, ack 253, win 501, length 196
15:25:31.831252 IP Comp3134.ssh > cpe1033bf982cdf-cm1033bf982cdd.cpe.net.cable.rogers.com.65054: Flags [P.], seq 549072:549268, ack 253, win 501, length 196
15:25:31.831287 IP Comp3134.ssh > cpe1033bf982cdf-cm1033bf982cdd.cpe.net.cable.rogers.com.65054: Flags [P.], seq 549268:549464, ack 253, win 501, length 196
15:25:31.831324 IP Comp3134.ssh > cpe1033bf982cdf-cm1033bf982cdd.cpe.net.cable.rogers.com.65054: Flags [P.], seq 549464:549660, ack 253, win 501, length 196
15:25:31.831362 IP Comp3134.ssh > cpe1033bf982cdf-cm1033bf982cdd.cpe.net.cable.rogers.com.65054: Flags [P.], seq 549660:549856, ack 253, win 501, length 196
15:25:31.831399 IP Comp3134.ssh > cpe1033bf982cdf-cm1033bf982cdd.cpe.net.cable.rogers.com.65054: Flags [P.], seq 549856:550052, ack 253, win 501, length 196
15:25:31.831434 IP Comp3134.ssh > cpe1033bf982cdf-cm1033bf982cdd.cpe.net.cable.rogers.com.65054: Flags [P.], seq 550052:550248, ack 253, win 501, length 196
15:25:31.831472 IP Comp3134.ssh > cpe1033bf982cdf-cm1033bf982cdd.cpe.net.cable.rogers.com.65054: Flags [P.], seq 550248:550444, ack 253, win 501, length 196
15:25:31.831519 IP Comp3134.ssh > cpe1033bf982cdf-cm1033bf982cdd.cpe.net.cable.rogers.com.65054: Flags [P.], seq 550444:550640, ack 253, win 501, length 196
15:25:31.831552 IP Comp3134.ssh > cpe1033bf982cdf-cm1033bf982cdd.cpe.net.cable.rogers.com.65054: Flags [P.], seq 550640:550836, ack 253, win 501, length 196
15:25:31.831587 IP Comp3134.ssh > cpe1033bf982cdf-cm1033bf982cdd.cpe.net.cable.rogers.com.65054: Flags [P.], seq 550836:551032, ack 253, win 501, length 196
15:25:31.831622 IP Comp3134.ssh > cpe1033bf982cdf-cm1033bf982cdd.cpe.net.cable.rogers.com.65054: Flags [P.], seq 551032:551228, ack 253, win 501, length 196
15:25:31.831658 IP Comp3134.ssh > cpe1033bf982cdf-cm1033bf982cdd.cpe.net.cable.rogers.com.65054: Flags [P.], seq 551228:551424, ack 253, win 501, length 196
15:25:31.831692 IP Comp3134.ssh > cpe1033bf982cdf-cm1033bf982cdd.cpe.net.cable.rogers.com.65054: Flags [P.], seq 551424:551620, ack 253, win 501, length 196
15:25:31.831728 IP Comp3134.ssh > cpe1033bf982cdf-cm1033bf982cdd.cpe.net.cable.rogers.com.65054: Flags [P.], seq 551620:551816, ack 253, win 501, length 196
15:25:31.831761 IP Comp3134.ssh > cpe1033bf982cdf-cm1033bf982cdd.cpe.net.cable.rogers.com.65054: Flags [P.], seq 551816:552012, ack 253, win 501, length 196
15:25:31.831815 IP Comp3134.ssh > cpe1033bf982cdf-cm1033bf982cdd.cpe.net.cable.rogers.com.65054: Flags [P.], seq 552012:552208, ack 253, win 501, length 196
15:25:31.831850 IP Comp3134.ssh > cpe1033bf982cdf-cm1033bf982cdd.cpe.net.cable.rogers.com.65054: Flags [P.], seq 552208:552404, ack 253, win 501, length 196
15:25:31.831885 IP Comp3134.ssh > cpe1033bf982cdf-cm1033bf982cdd.cpe.net.cable.rogers.com.65054: Flags [P.], seq 552404:552600, ack 253, win 501, length 196
15:25:31.831920 IP Comp3134.ssh > cpe1033bf982cdf-cm1033bf982cdd.cpe.net.cable.rogers.com.65054: Flags [P.], seq 552600:552796, ack 253, win 501, length 196
15:25:31.831954 IP Comp3134.ssh > cpe1033bf982cdf-cm1033bf982cdd.cpe.net.cable.rogers.com.65054: Flags [P.], seq 552796:552992, ack 253, win 501, length 196
15:25:31.831990 IP Comp3134.ssh > cpe1033bf982cdf-cm1033bf982cdd.cpe.net.cable.rogers.com.65054: Flags [P.], seq 552992:553188, ack 253, win 501, length 196
15:25:31.832027 IP Comp3134.ssh > cpe1033bf982cdf-cm1033bf982cdd.cpe.net.cable.rogers.com.65054: Flags [P.], seq 553188:553384, ack 253, win 501, length 196
15:25:31.832062 IP Comp3134.ssh > cpe1033bf982cdf-cm1033bf982cdd.cpe.net.cable.rogers.com.65054: Flags [P.], seq 553384:553580, ack 253, win 501, length 196
15:25:31.832099 IP Comp3134.ssh > cpe1033bf982cdf-cm1033bf982cdd.cpe.net.cable.rogers.com.65054: Flags [P.], seq 553580:553776, ack 253, win 501, length 196
15:25:31.832134 IP Comp3134.ssh > cpe1033bf982cdf-cm1033bf982cdd.cpe.net.cable.rogers.com.65054: Flags [P.], seq 553776:553972, ack 253, win 501, length 196
15:25:31.832172 IP Comp3134.ssh > cpe1033bf982cdf-cm1033bf982cdd.cpe.net.cable.rogers.com.65054: Flags [P.], seq 553972:554168, ack 253, win 501, length 196
15:25:31.832208 IP Comp3134.ssh > cpe1033bf982cdf-cm1033bf982cdd.cpe.net.cable.rogers.com.65054: Flags [P.], seq 554168:554364, ack 253, win 501, length 196
15:25:31.832245 IP Comp3134.ssh > cpe1033bf982cdf-cm1033bf982cdd.cpe.net.cable.rogers.com.65054: Flags [P.], seq 554364:554560, ack 253, win 501, length 196
15:25:31.832280 IP Comp3134.ssh > cpe1033bf982cdf-cm1033bf982cdd.cpe.net.cable.rogers.com.65054: Flags [P.], seq 554560:554756, ack 253, win 501, length 196
15:25:31.832318 IP Comp3134.ssh > cpe1033bf982cdf-cm1033bf982cdd.cpe.net.cable.rogers.com.65054: Flags [P.], seq 554756:554952, ack 253, win 501, length 196
15:25:31.832353 IP Comp3134.ssh > cpe1033bf982cdf-cm1033bf982cdd.cpe.net.cable.rogers.com.65054: Flags [P.], seq 554952:555148, ack 253, win 501, length 196
15:25:31.832391 IP Comp3134.ssh > cpe1033bf982cdf-cm1033bf982cdd.cpe.net.cable.rogers.com.65054: Flags [P.], seq 555148:555344, ack 253, win 501, length 196
15:25:31.832425 IP Comp3134.ssh > cpe1033bf982cdf-cm1033bf982cdd.cpe.net.cable.rogers.com.65054: Flags [P.], seq 555344:555540, ack 253, win 501, length 196
15:25:31.832460 IP Comp3134.ssh > cpe1033bf982cdf-cm1033bf982cdd.cpe.net.cable.rogers.com.65054: Flags [P.], seq 555540:555736, ack 253, win 501, length 196
15:25:31.832497 IP Comp3134.ssh > cpe1033bf982cdf-cm1033bf982cdd.cpe.net.cable.rogers.com.65054: Flags [P.], seq 555736:555932, ack 253, win 501, length 196
15:25:31.832532 IP Comp3134.ssh > cpe1033bf982cdf-cm1033bf982cdd.cpe.net.cable.rogers.com.65054: Flags [P.], seq 555932:556128, ack 253, win 501, length 196
15:25:31.832569 IP Comp3134.ssh > cpe1033bf982cdf-cm1033bf982cdd.cpe.net.cable.rogers.com.65054: Flags [P.], seq 556128:556324, ack 253, win 501, length 196
15:25:31.832616 IP Comp3134.ssh > cpe1033bf982cdf-cm1033bf982cdd.cpe.net.cable.rogers.com.65054: Flags [P.], seq 556324:556520, ack 253, win 501, length 196
15:25:31.832653 IP Comp3134.ssh > cpe1033bf982cdf-cm1033bf982cdd.cpe.net.cable.rogers.com.65054: Flags [P.], seq 556520:556716, ack 253, win 501, length 196
15:25:31.832688 IP Comp3134.ssh > cpe1033bf982cdf-cm1033bf982cdd.cpe.net.cable.rogers.com.65054: Flags [P.], seq 556716:556912, ack 253, win 501, length 196
15:25:31.832734 IP Comp3134.ssh > cpe1033bf982cdf-cm1033bf982cdd.cpe.net.cable.rogers.com.65054: Flags [P.], seq 556912:557108, ack 253, win 501, length 196
15:25:31.832771 IP Comp3134.ssh > cpe1033bf982cdf-cm1033bf982cdd.cpe.net.cable.rogers.com.65054: Flags [P.], seq 557108:557304, ack 253, win 501, length 196
15:25:31.832808 IP Comp3134.ssh > cpe1033bf982cdf-cm1033bf982cdd.cpe.net.cable.rogers.com.65054: Flags [P.], seq 557304:557500, ack 253, win 501, length 196
15:25:31.832844 IP Comp3134.ssh > cpe1033bf982cdf-cm1033bf982cdd.cpe.net.cable.rogers.com.65054: Flags [P.], seq 557500:557696, ack 253, win 501, length 196
15:25:31.832881 IP Comp3134.ssh > cpe1033bf982cdf-cm1033bf982cdd.cpe.net.cable.rogers.com.65054: Flags [P.], seq 557696:557892, ack 253, win 501, length 196
15:25:31.832919 IP Comp3134.ssh > cpe1033bf982cdf-cm1033bf982cdd.cpe.net.cable.rogers.com.65054: Flags [P.], seq 557892:558088, ack 253, win 501, length 196
15:25:31.832955 IP Comp3134.ssh > cpe1033bf982cdf-cm1033bf982cdd.cpe.net.cable.rogers.com.65054: Flags [P.], seq 558088:558284, ack 253, win 501, length 196
15:25:31.832989 IP Comp3134.ssh > cpe1033bf982cdf-cm1033bf982cdd.cpe.net.cable.rogers.com.65054: Flags [P.], seq 558284:558480, ack 253, win 501, length 196
15:25:31.833038 IP Comp3134.ssh > cpe1033bf982cdf-cm1033bf982cdd.cpe.net.cable.rogers.com.65054: Flags [P.], seq 558480:558676, ack 253, win 501, length 196
15:25:31.833074 IP Comp3134.ssh > cpe1033bf982cdf-cm1033bf982cdd.cpe.net.cable.rogers.com.65054: Flags [P.], seq 558676:558872, ack 253, win 501, length 196
15:25:31.833109 IP Comp3134.ssh > cpe1033bf982cdf-cm1033bf982cdd.cpe.net.cable.rogers.com.65054: Flags [P.], seq 558872:559068, ack 253, win 501, length 196
15:25:31.833146 IP Comp3134.ssh > cpe1033bf982cdf-cm1033bf982cdd.cpe.net.cable.rogers.com.65054: Flags [P.], seq 559068:559264, ack 253, win 501, length 196
15:25:31.833180 IP Comp3134.ssh > cpe1033bf982cdf-cm1033bf982cdd.cpe.net.cable.rogers.com.65054: Flags [P.], seq 559264:559460, ack 253, win 501, length 196
15:25:31.833216 IP Comp3134.ssh > cpe1033bf982cdf-cm1033bf982cdd.cpe.net.cable.rogers.com.65054: Flags [P.], seq 559460:559656, ack 253, win 501, length 196
15:25:31.833250 IP Comp3134.ssh > cpe1033bf982cdf-cm1033bf982cdd.cpe.net.cable.rogers.com.65054: Flags [P.], seq 559656:559852, ack 253, win 501, length 196
15:25:31.833287 IP Comp3134.ssh > cpe1033bf982cdf-cm1033bf982cdd.cpe.net.cable.rogers.com.65054: Flags [P.], seq 559852:560048, ack 253, win 501, length 196
15:25:31.833321 IP Comp3134.ssh > cpe1033bf982cdf-cm1033bf982cdd.cpe.net.cable.rogers.com.65054: Flags [P.], seq 560048:560244, ack 253, win 501, length 196
15:25:31.833358 IP Comp3134.ssh > cpe1033bf982cdf-cm1033bf982cdd.cpe.net.cable.rogers.com.65054: Flags [P.], seq 560244:560440, ack 253, win 501, length 196
15:25:31.833392 IP Comp3134.ssh > cpe1033bf982cdf-cm1033bf982cdd.cpe.net.cable.rogers.com.65054: Flags [P.], seq 560440:560636, ack 253, win 501, length 196
15:25:31.833429 IP Comp3134.ssh > cpe1033bf982cdf-cm1033bf982cdd.cpe.net.cable.rogers.com.65054: Flags [P.], seq 560636:560832, ack 253, win 501, length 196
15:25:31.833463 IP Comp3134.ssh > cpe1033bf982cdf-cm1033bf982cdd.cpe.net.cable.rogers.com.65054: Flags [P.], seq 560832:561028, ack 253, win 501, length 196
15:25:31.833499 IP Comp3134.ssh > cpe1033bf982cdf-cm1033bf982cdd.cpe.net.cable.rogers.com.65054: Flags [P.], seq 561028:561224, ack 253, win 501, length 196
15:25:31.833535 IP Comp3134.ssh > cpe1033bf982cdf-cm1033bf982cdd.cpe.net.cable.rogers.com.65054: Flags [P.], seq 561224:561420, ack 253, win 501, length 196
15:25:31.833571 IP Comp3134.ssh > cpe1033bf982cdf-cm1033bf982cdd.cpe.net.cable.rogers.com.65054: Flags [P.], seq 561420:561616, ack 253, win 501, length 196
15:25:31.833605 IP Comp3134.ssh > cpe1033bf982cdf-cm1033bf982cdd.cpe.net.cable.rogers.com.65054: Flags [P.], seq 561616:561812, ack 253, win 501, length 196
15:25:31.833660 IP Comp3134.ssh > cpe1033bf982cdf-cm1033bf982cdd.cpe.net.cable.rogers.com.65054: Flags [P.], seq 561812:562008, ack 253, win 501, length 196
15:25:31.833695 IP Comp3134.ssh > cpe1033bf982cdf-cm1033bf982cdd.cpe.net.cable.rogers.com.65054: Flags [P.], seq 562008:562204, ack 253, win 501, length 196
15:25:31.833739 IP Comp3134.ssh > cpe1033bf982cdf-cm1033bf982cdd.cpe.net.cable.rogers.com.65054: Flags [P.], seq 562204:562400, ack 253, win 501, length 196
15:25:31.833804 IP Comp3134.ssh > cpe1033bf982cdf-cm1033bf982cdd.cpe.net.cable.rogers.com.65054: Flags [P.], seq 562400:562596, ack 253, win 501, length 196
15:25:31.833843 IP Comp3134.ssh > cpe1033bf982cdf-cm1033bf982cdd.cpe.net.cable.rogers.com.65054: Flags [P.], seq 562596:562792, ack 253, win 501, length 196
15:25:31.833881 IP Comp3134.ssh > cpe1033bf982cdf-cm1033bf982cdd.cpe.net.cable.rogers.com.65054: Flags [P.], seq 562792:562988, ack 253, win 501, length 196
15:25:31.833918 IP Comp3134.ssh > cpe1033bf982cdf-cm1033bf982cdd.cpe.net.cable.rogers.com.65054: Flags [P.], seq 562988:563184, ack 253, win 501, length 196
15:25:31.833955 IP Comp3134.ssh > cpe1033bf982cdf-cm1033bf982cdd.cpe.net.cable.rogers.com.65054: Flags [P.], seq 563184:563380, ack 253, win 501, length 196
15:25:31.833996 IP Comp3134.ssh > cpe1033bf982cdf-cm1033bf982cdd.cpe.net.cable.rogers.com.65054: Flags [P.], seq 563380:563576, ack 253, win 501, length 196
15:25:31.834031 IP Comp3134.ssh > cpe1033bf982cdf-cm1033bf982cdd.cpe.net.cable.rogers.com.65054: Flags [P.], seq 563576:563772, ack 253, win 501, length 196
15:25:31.834068 IP Comp3134.ssh > cpe1033bf982cdf-cm1033bf982cdd.cpe.net.cable.rogers.com.65054: Flags [P.], seq 563772:563968, ack 253, win 501, length 196
15:25:31.834107 IP Comp3134.ssh > cpe1033bf982cdf-cm1033bf982cdd.cpe.net.cable.rogers.com.65054: Flags [P.], seq 563968:564164, ack 253, win 501, length 196
15:25:31.834147 IP Comp3134.ssh > cpe1033bf982cdf-cm1033bf982cdd.cpe.net.cable.rogers.com.65054: Flags [P.], seq 564164:564360, ack 253, win 501, length 196
15:25:31.834194 IP Comp3134.ssh > cpe1033bf982cdf-cm1033bf982cdd.cpe.net.cable.rogers.com.65054: Flags [P.], seq 564360:564556, ack 253, win 501, length 196
15:25:31.834230 IP Comp3134.ssh > cpe1033bf982cdf-cm1033bf982cdd.cpe.net.cable.rogers.com.65054: Flags [P.], seq 564556:564752, ack 253, win 501, length 196
15:25:31.834269 IP Comp3134.ssh > cpe1033bf982cdf-cm1033bf982cdd.cpe.net.cable.rogers.com.65054: Flags [P.], seq 564752:564948, ack 253, win 501, length 196
15:25:31.834307 IP Comp3134.ssh > cpe1033bf982cdf-cm1033bf982cdd.cpe.net.cable.rogers.com.65054: Flags [P.], seq 564948:565144, ack 253, win 501, length 196
15:25:31.834342 IP Comp3134.ssh > cpe1033bf982cdf-cm1033bf982cdd.cpe.net.cable.rogers.com.65054: Flags [P.], seq 565144:565340, ack 253, win 501, length 196
15:25:31.834380 IP Comp3134.ssh > cpe1033bf982cdf-cm1033bf982cdd.cpe.net.cable.rogers.com.65054: Flags [P.], seq 565340:565536, ack 253, win 501, length 196
15:25:31.834415 IP Comp3134.ssh > cpe1033bf982cdf-cm1033bf982cdd.cpe.net.cable.rogers.com.65054: Flags [P.], seq 565536:565732, ack 253, win 501, length 196
15:25:31.834453 IP Comp3134.ssh > cpe1033bf982cdf-cm1033bf982cdd.cpe.net.cable.rogers.com.65054: Flags [P.], seq 565732:565928, ack 253, win 501, length 196
15:25:31.834490 IP Comp3134.ssh > cpe1033bf982cdf-cm1033bf982cdd.cpe.net.cable.rogers.com.65054: Flags [P.], seq 565928:566124, ack 253, win 501, length 196
15:25:31.834526 IP Comp3134.ssh > cpe1033bf982cdf-cm1033bf982cdd.cpe.net.cable.rogers.com.65054: Flags [P.], seq 566124:566320, ack 253, win 501, length 196
15:25:31.834571 IP Comp3134.ssh > cpe1033bf982cdf-cm1033bf982cdd.cpe.net.cable.rogers.com.65054: Flags [P.], seq 566320:566516, ack 253, win 501, length 196
15:25:31.834610 IP Comp3134.ssh > cpe1033bf982cdf-cm1033bf982cdd.cpe.net.cable.rogers.com.65054: Flags [P.], seq 566516:566712, ack 253, win 501, length 196
15:25:31.834645 IP Comp3134.ssh > cpe1033bf982cdf-cm1033bf982cdd.cpe.net.cable.rogers.com.65054: Flags [P.], seq 566712:566908, ack 253, win 501, length 196
15:25:31.834683 IP Comp3134.ssh > cpe1033bf982cdf-cm1033bf982cdd.cpe.net.cable.rogers.com.65054: Flags [P.], seq 566908:567104, ack 253, win 501, length 196
15:25:31.834717 IP Comp3134.ssh > cpe1033bf982cdf-cm1033bf982cdd.cpe.net.cable.rogers.com.65054: Flags [P.], seq 567104:567300, ack 253, win 501, length 196
15:25:31.834754 IP Comp3134.ssh > cpe1033bf982cdf-cm1033bf982cdd.cpe.net.cable.rogers.com.65054: Flags [P.], seq 567300:567496, ack 253, win 501, length 196
15:25:31.834791 IP Comp3134.ssh > cpe1033bf982cdf-cm1033bf982cdd.cpe.net.cable.rogers.com.65054: Flags [P.], seq 567496:567692, ack 253, win 501, length 196
15:25:31.834826 IP Comp3134.ssh > cpe1033bf982cdf-cm1033bf982cdd.cpe.net.cable.rogers.com.65054: Flags [P.], seq 567692:567888, ack 253, win 501, length 196
15:25:31.834864 IP Comp3134.ssh > cpe1033bf982cdf-cm1033bf982cdd.cpe.net.cable.rogers.com.65054: Flags [P.], seq 567888:568084, ack 253, win 501, length 196
15:25:31.834901 IP Comp3134.ssh > cpe1033bf982cdf-cm1033bf982cdd.cpe.net.cable.rogers.com.65054: Flags [P.], seq 568084:568280, ack 253, win 501, length 196
15:25:31.834938 IP Comp3134.ssh > cpe1033bf982cdf-cm1033bf982cdd.cpe.net.cable.rogers.com.65054: Flags [P.], seq 568280:568476, ack 253, win 501, length 196
15:25:31.834975 IP Comp3134.ssh > cpe1033bf982cdf-cm1033bf982cdd.cpe.net.cable.rogers.com.65054: Flags [P.], seq 568476:568672, ack 253, win 501, length 196
15:25:31.835012 IP Comp3134.ssh > cpe1033bf982cdf-cm1033bf982cdd.cpe.net.cable.rogers.com.65054: Flags [P.], seq 568672:568868, ack 253, win 501, length 196
15:25:31.835047 IP Comp3134.ssh > cpe1033bf982cdf-cm1033bf982cdd.cpe.net.cable.rogers.com.65054: Flags [P.], seq 568868:569064, ack 253, win 501, length 196
15:25:31.835081 IP Comp3134.ssh > cpe1033bf982cdf-cm1033bf982cdd.cpe.net.cable.rogers.com.65054: Flags [P.], seq 569064:569260, ack 253, win 501, length 196
15:25:31.835119 IP Comp3134.ssh > cpe1033bf982cdf-cm1033bf982cdd.cpe.net.cable.rogers.com.65054: Flags [P.], seq 569260:569456, ack 253, win 501, length 196
15:25:31.835154 IP Comp3134.ssh > cpe1033bf982cdf-cm1033bf982cdd.cpe.net.cable.rogers.com.65054: Flags [P.], seq 569456:569652, ack 253, win 501, length 196
15:25:31.835194 IP Comp3134.ssh > cpe1033bf982cdf-cm1033bf982cdd.cpe.net.cable.rogers.com.65054: Flags [P.], seq 569652:569848, ack 253, win 501, length 196
15:25:31.835229 IP Comp3134.ssh > cpe1033bf982cdf-cm1033bf982cdd.cpe.net.cable.rogers.com.65054: Flags [P.], seq 569848:570044, ack 253, win 501, length 196
15:25:31.835267 IP Comp3134.ssh > cpe1033bf982cdf-cm1033bf982cdd.cpe.net.cable.rogers.com.65054: Flags [P.], seq 570044:570240, ack 253, win 501, length 196
15:25:31.835303 IP Comp3134.ssh > cpe1033bf982cdf-cm1033bf982cdd.cpe.net.cable.rogers.com.65054: Flags [P.], seq 570240:570436, ack 253, win 501, length 196
15:25:31.835340 IP Comp3134.ssh > cpe1033bf982cdf-cm1033bf982cdd.cpe.net.cable.rogers.com.65054: Flags [P.], seq 570436:570632, ack 253, win 501, length 196
15:25:31.835377 IP Comp3134.ssh > cpe1033bf982cdf-cm1033bf982cdd.cpe.net.cable.rogers.com.65054: Flags [P.], seq 570632:570828, ack 253, win 501, length 196
15:25:31.835412 IP Comp3134.ssh > cpe1033bf982cdf-cm1033bf982cdd.cpe.net.cable.rogers.com.65054: Flags [P.], seq 570828:571024, ack 253, win 501, length 196
15:25:31.835449 IP Comp3134.ssh > cpe1033bf982cdf-cm1033bf982cdd.cpe.net.cable.rogers.com.65054: Flags [P.], seq 571024:571220, ack 253, win 501, length 196
15:25:31.835488 IP Comp3134.ssh > cpe1033bf982cdf-cm1033bf982cdd.cpe.net.cable.rogers.com.65054: Flags [P.], seq 571220:571416, ack 253, win 501, length 196
15:25:31.835524 IP Comp3134.ssh > cpe1033bf982cdf-cm1033bf982cdd.cpe.net.cable.rogers.com.65054: Flags [P.], seq 571416:571612, ack 253, win 501, length 196
15:25:31.835560 IP Comp3134.ssh > cpe1033bf982cdf-cm1033bf982cdd.cpe.net.cable.rogers.com.65054: Flags [P.], seq 571612:571808, ack 253, win 501, length 196
15:25:31.835596 IP Comp3134.ssh > cpe1033bf982cdf-cm1033bf982cdd.cpe.net.cable.rogers.com.65054: Flags [P.], seq 571808:572004, ack 253, win 501, length 196
15:25:31.835633 IP Comp3134.ssh > cpe1033bf982cdf-cm1033bf982cdd.cpe.net.cable.rogers.com.65054: Flags [P.], seq 572004:572200, ack 253, win 501, length 196
15:25:31.835669 IP Comp3134.ssh > cpe1033bf982cdf-cm1033bf982cdd.cpe.net.cable.rogers.com.65054: Flags [P.], seq 572200:572396, ack 253, win 501, length 196
15:25:31.835706 IP Comp3134.ssh > cpe1033bf982cdf-cm1033bf982cdd.cpe.net.cable.rogers.com.65054: Flags [P.], seq 572396:572592, ack 253, win 501, length 196
15:25:31.835743 IP Comp3134.ssh > cpe1033bf982cdf-cm1033bf982cdd.cpe.net.cable.rogers.com.65054: Flags [P.], seq 572592:572788, ack 253, win 501, length 196
15:25:31.835781 IP Comp3134.ssh > cpe1033bf982cdf-cm1033bf982cdd.cpe.net.cable.rogers.com.65054: Flags [P.], seq 572788:572984, ack 253, win 501, length 196
15:25:31.835819 IP Comp3134.ssh > cpe1033bf982cdf-cm1033bf982cdd.cpe.net.cable.rogers.com.65054: Flags [P.], seq 572984:573180, ack 253, win 501, length 196
