15:25:04.896964 IP cpe1033bf982cdf-cm1033bf982cdd.cpe.net.cable.rogers.com.65054 > Comp3134.ssh: Flags [.], ack 1599660, win 13817, options [nop,nop,sack 1 {1619496:1652612}], length 0
15:25:04.896964 IP cpe1033bf982cdf-cm1033bf982cdd.cpe.net.cable.rogers.com.65054 > Comp3134.ssh: Flags [.], ack 1601120, win 13812, options [nop,nop,sack 1 {1619496:1652612}], length 0
15:25:04.897015 IP Comp3134.ssh > cpe1033bf982cdf-cm1033bf982cdd.cpe.net.cable.rogers.com.65054: Flags [P.], seq 1710648:1710844, ack 469, win 501, length 196
15:25:04.897071 IP cpe1033bf982cdf-cm1033bf982cdd.cpe.net.cable.rogers.com.65054 > Comp3134.ssh: Flags [.], ack 1602580, win 13806, options [nop,nop,sack 1 {1619496:1652612}], length 0
15:25:04.897071 IP cpe1033bf982cdf-cm1033bf982cdd.cpe.net.cable.rogers.com.65054 > Comp3134.ssh: Flags [.], ack 1604040, win 13800, options [nop,nop,sack 1 {1619496:1652612}], length 0
15:25:04.897071 IP cpe1033bf982cdf-cm1033bf982cdd.cpe.net.cable.rogers.com.65054 > Comp3134.ssh: Flags [.], ack 1605500, win 13794, options [nop,nop,sack 1 {1619496:1652612}], length 0
15:25:04.897071 IP cpe1033bf982cdf-cm1033bf982cdd.cpe.net.cable.rogers.com.65054 > Comp3134.ssh: Flags [.], ack 1606960, win 13789, options [nop,nop,sack 1 {1619496:1652612}], length 0
15:25:04.897071 IP cpe1033bf982cdf-cm1033bf982cdd.cpe.net.cable.rogers.com.65054 > Comp3134.ssh: Flags [.], ack 1608420, win 13783, options [nop,nop,sack 1 {1619496:1652612}], length 0
15:25:04.897071 IP cpe1033bf982cdf-cm1033bf982cdd.cpe.net.cable.rogers.com.65054 > Comp3134.ssh: Flags [.], ack 1609880, win 13777, options [nop,nop,sack 1 {1619496:1652612}], length 0
15:25:04.897071 IP cpe1033bf982cdf-cm1033bf982cdd.cpe.net.cable.rogers.com.65054 > Comp3134.ssh: Flags [.], ack 1610388, win 13775, options [nop,nop,sack 1 {1619496:1652612}], length 0
15:25:04.897360 IP Comp3134.ssh > cpe1033bf982cdf-cm1033bf982cdd.cpe.net.cable.rogers.com.65054: Flags [P.], seq 1710844:1713832, ack 469, win 501, length 2988
15:25:04.897409 IP Comp3134.ssh > cpe1033bf982cdf-cm1033bf982cdd.cpe.net.cable.rogers.com.65054: Flags [P.], seq 1713832:1714028, ack 469, win 501, length 196
15:25:04.897449 IP Comp3134.ssh > cpe1033bf982cdf-cm1033bf982cdd.cpe.net.cable.rogers.com.65054: Flags [P.], seq 1714028:1714224, ack 469, win 501, length 196
15:25:04.897542 IP Comp3134.ssh > cpe1033bf982cdf-cm1033bf982cdd.cpe.net.cable.rogers.com.65054: Flags [P.], seq 1714224:1714420, ack 469, win 501, length 196
15:25:04.897584 IP Comp3134.ssh > cpe1033bf982cdf-cm1033bf982cdd.cpe.net.cable.rogers.com.65054: Flags [P.], seq 1714420:1714616, ack 469, win 501, length 196
15:25:04.897623 IP Comp3134.ssh > cpe1033bf982cdf-cm1033bf982cdd.cpe.net.cable.rogers.com.65054: Flags [P.], seq 1714616:1714812, ack 469, win 501, length 196
15:25:04.897663 IP Comp3134.ssh > cpe1033bf982cdf-cm1033bf982cdd.cpe.net.cable.rogers.com.65054: Flags [P.], seq 1714812:1715008, ack 469, win 501, length 196
15:25:04.897702 IP Comp3134.ssh > cpe1033bf982cdf-cm1033bf982cdd.cpe.net.cable.rogers.com.65054: Flags [P.], seq 1715008:1715204, ack 469, win 501, length 196
15:25:04.897739 IP Comp3134.ssh > cpe1033bf982cdf-cm1033bf982cdd.cpe.net.cable.rogers.com.65054: Flags [P.], seq 1715204:1715400, ack 469, win 501, length 196
15:25:04.897788 IP Comp3134.ssh > cpe1033bf982cdf-cm1033bf982cdd.cpe.net.cable.rogers.com.65054: Flags [P.], seq 1715400:1715596, ack 469, win 501, length 196
15:25:04.905157 IP cpe1033bf982cdf-cm1033bf982cdd.cpe.net.cable.rogers.com.65054 > Comp3134.ssh: Flags [.], ack 1611848, win 16499, options [nop,nop,sack 1 {1619496:1652612}], length 0
15:25:04.905157 IP cpe1033bf982cdf-cm1033bf982cdd.cpe.net.cable.rogers.com.65054 > Comp3134.ssh: Flags [.], ack 1610388, win 16504, options [nop,nop,sack 1 {1619496:1652612}], length 0
15:25:04.905157 IP cpe1033bf982cdf-cm1033bf982cdd.cpe.net.cable.rogers.com.65054 > Comp3134.ssh: Flags [.], ack 1613308, win 16493, options [nop,nop,sack 1 {1619496:1652612}], length 0
15:25:04.905157 IP cpe1033bf982cdf-cm1033bf982cdd.cpe.net.cable.rogers.com.65054 > Comp3134.ssh: Flags [.], ack 1614768, win 16487, options [nop,nop,sack 1 {1619496:1652612}], length 0
15:25:04.905158 IP cpe1033bf982cdf-cm1033bf982cdd.cpe.net.cable.rogers.com.65054 > Comp3134.ssh: Flags [.], ack 1615248, win 16485, options [nop,nop,sack 1 {1619496:1652612}], length 0
15:25:04.905158 IP cpe1033bf982cdf-cm1033bf982cdd.cpe.net.cable.rogers.com.65054 > Comp3134.ssh: Flags [.], ack 1616708, win 16480, options [nop,nop,sack 1 {1619496:1652612}], length 0
15:25:04.905158 IP cpe1033bf982cdf-cm1033bf982cdd.cpe.net.cable.rogers.com.65054 > Comp3134.ssh: Flags [.], ack 1618168, win 16474, options [nop,nop,sack 1 {1619496:1652612}], length 0
15:25:04.905158 IP cpe1033bf982cdf-cm1033bf982cdd.cpe.net.cable.rogers.com.65054 > Comp3134.ssh: Flags [.], ack 1685844, win 16210, length 0
15:25:04.905207 IP Comp3134.ssh > cpe1033bf982cdf-cm1033bf982cdd.cpe.net.cable.rogers.com.65054: Flags [P.], seq 1715596:1715792, ack 469, win 501, length 196
15:25:04.905319 IP cpe1033bf982cdf-cm1033bf982cdd.cpe.net.cable.rogers.com.65054 > Comp3134.ssh: Flags [.], ack 1710648, win 16113, length 0
15:25:04.905559 IP Comp3134.ssh > cpe1033bf982cdf-cm1033bf982cdd.cpe.net.cable.rogers.com.65054: Flags [P.], seq 1715792:1717572, ack 469, win 501, length 1780
15:25:04.905623 IP Comp3134.ssh > cpe1033bf982cdf-cm1033bf982cdd.cpe.net.cable.rogers.com.65054: Flags [P.], seq 1717572:1717768, ack 469, win 501, length 196
15:25:04.905681 IP Comp3134.ssh > cpe1033bf982cdf-cm1033bf982cdd.cpe.net.cable.rogers.com.65054: Flags [P.], seq 1717768:1717964, ack 469, win 501, length 196
15:25:04.905731 IP Comp3134.ssh > cpe1033bf982cdf-cm1033bf982cdd.cpe.net.cable.rogers.com.65054: Flags [P.], seq 1717964:1718160, ack 469, win 501, length 196
15:25:04.905807 IP Comp3134.ssh > cpe1033bf982cdf-cm1033bf982cdd.cpe.net.cable.rogers.com.65054: Flags [P.], seq 1718160:1718356, ack 469, win 501, length 196
15:25:04.905850 IP Comp3134.ssh > cpe1033bf982cdf-cm1033bf982cdd.cpe.net.cable.rogers.com.65054: Flags [P.], seq 1718356:1718552, ack 469, win 501, length 196
15:25:04.905905 IP Comp3134.ssh > cpe1033bf982cdf-cm1033bf982cdd.cpe.net.cable.rogers.com.65054: Flags [P.], seq 1718552:1718748, ack 469, win 501, length 196
15:25:04.905953 IP Comp3134.ssh > cpe1033bf982cdf-cm1033bf982cdd.cpe.net.cable.rogers.com.65054: Flags [P.], seq 1718748:1718944, ack 469, win 501, length 196
15:25:04.906004 IP Comp3134.ssh > cpe1033bf982cdf-cm1033bf982cdd.cpe.net.cable.rogers.com.65054: Flags [P.], seq 1718944:1719140, ack 469, win 501, length 196
15:25:04.906063 IP Comp3134.ssh > cpe1033bf982cdf-cm1033bf982cdd.cpe.net.cable.rogers.com.65054: Flags [P.], seq 1719140:1719336, ack 469, win 501, length 196
15:25:04.906105 IP Comp3134.ssh > cpe1033bf982cdf-cm1033bf982cdd.cpe.net.cable.rogers.com.65054: Flags [P.], seq 1719336:1719532, ack 469, win 501, length 196
15:25:04.906144 IP Comp3134.ssh > cpe1033bf982cdf-cm1033bf982cdd.cpe.net.cable.rogers.com.65054: Flags [P.], seq 1719532:1719728, ack 469, win 501, length 196
15:25:04.906182 IP Comp3134.ssh > cpe1033bf982cdf-cm1033bf982cdd.cpe.net.cable.rogers.com.65054: Flags [P.], seq 1719728:1719924, ack 469, win 501, length 196
15:25:04.906222 IP Comp3134.ssh > cpe1033bf982cdf-cm1033bf982cdd.cpe.net.cable.rogers.com.65054: Flags [P.], seq 1719924:1720120, ack 469, win 501, length 196
15:25:04.906262 IP Comp3134.ssh > cpe1033bf982cdf-cm1033bf982cdd.cpe.net.cable.rogers.com.65054: Flags [P.], seq 1720120:1720316, ack 469, win 501, length 196
15:25:04.906299 IP Comp3134.ssh > cpe1033bf982cdf-cm1033bf982cdd.cpe.net.cable.rogers.com.65054: Flags [P.], seq 1720316:1720512, ack 469, win 501, length 196
15:25:04.906337 IP Comp3134.ssh > cpe1033bf982cdf-cm1033bf982cdd.cpe.net.cable.rogers.com.65054: Flags [P.], seq 1720512:1720708, ack 469, win 501, length 196
15:25:04.906374 IP Comp3134.ssh > cpe1033bf982cdf-cm1033bf982cdd.cpe.net.cable.rogers.com.65054: Flags [P.], seq 1720708:1720904, ack 469, win 501, length 196
15:25:04.906412 IP Comp3134.ssh > cpe1033bf982cdf-cm1033bf982cdd.cpe.net.cable.rogers.com.65054: Flags [P.], seq 1720904:1721100, ack 469, win 501, length 196
15:25:04.906459 IP Comp3134.ssh > cpe1033bf982cdf-cm1033bf982cdd.cpe.net.cable.rogers.com.65054: Flags [P.], seq 1721100:1721296, ack 469, win 501, length 196
15:25:04.906500 IP Comp3134.ssh > cpe1033bf982cdf-cm1033bf982cdd.cpe.net.cable.rogers.com.65054: Flags [P.], seq 1721296:1721492, ack 469, win 501, length 196
15:25:04.906543 IP Comp3134.ssh > cpe1033bf982cdf-cm1033bf982cdd.cpe.net.cable.rogers.com.65054: Flags [P.], seq 1721492:1721688, ack 469, win 501, length 196
15:25:04.906589 IP Comp3134.ssh > cpe1033bf982cdf-cm1033bf982cdd.cpe.net.cable.rogers.com.65054: Flags [P.], seq 1721688:1721884, ack 469, win 501, length 196
15:25:04.906628 IP Comp3134.ssh > cpe1033bf982cdf-cm1033bf982cdd.cpe.net.cable.rogers.com.65054: Flags [P.], seq 1721884:1722080, ack 469, win 501, length 196
15:25:04.906665 IP Comp3134.ssh > cpe1033bf982cdf-cm1033bf982cdd.cpe.net.cable.rogers.com.65054: Flags [P.], seq 1722080:1722276, ack 469, win 501, length 196
15:25:04.906703 IP Comp3134.ssh > cpe1033bf982cdf-cm1033bf982cdd.cpe.net.cable.rogers.com.65054: Flags [P.], seq 1722276:1722472, ack 469, win 501, length 196
15:25:04.906743 IP Comp3134.ssh > cpe1033bf982cdf-cm1033bf982cdd.cpe.net.cable.rogers.com.65054: Flags [P.], seq 1722472:1722668, ack 469, win 501, length 196
15:25:04.906793 IP Comp3134.ssh > cpe1033bf982cdf-cm1033bf982cdd.cpe.net.cable.rogers.com.65054: Flags [P.], seq 1722668:1722864, ack 469, win 501, length 196
15:25:04.906833 IP Comp3134.ssh > cpe1033bf982cdf-cm1033bf982cdd.cpe.net.cable.rogers.com.65054: Flags [P.], seq 1722864:1723060, ack 469, win 501, length 196
15:25:04.906871 IP Comp3134.ssh > cpe1033bf982cdf-cm1033bf982cdd.cpe.net.cable.rogers.com.65054: Flags [P.], seq 1723060:1723256, ack 469, win 501, length 196
15:25:04.906909 IP Comp3134.ssh > cpe1033bf982cdf-cm1033bf982cdd.cpe.net.cable.rogers.com.65054: Flags [P.], seq 1723256:1723452, ack 469, win 501, length 196
15:25:04.906947 IP Comp3134.ssh > cpe1033bf982cdf-cm1033bf982cdd.cpe.net.cable.rogers.com.65054: Flags [P.], seq 1723452:1723648, ack 469, win 501, length 196
15:25:04.906991 IP Comp3134.ssh > cpe1033bf982cdf-cm1033bf982cdd.cpe.net.cable.rogers.com.65054: Flags [P.], seq 1723648:1723844, ack 469, win 501, length 196
15:25:04.907056 IP Comp3134.ssh > cpe1033bf982cdf-cm1033bf982cdd.cpe.net.cable.rogers.com.65054: Flags [P.], seq 1723844:1724040, ack 469, win 501, length 196
15:25:04.907108 IP Comp3134.ssh > cpe1033bf982cdf-cm1033bf982cdd.cpe.net.cable.rogers.com.65054: Flags [P.], seq 1724040:1724236, ack 469, win 501, length 196
15:25:04.907153 IP Comp3134.ssh > cpe1033bf982cdf-cm1033bf982cdd.cpe.net.cable.rogers.com.65054: Flags [P.], seq 1724236:1724432, ack 469, win 501, length 196
15:25:04.907207 IP Comp3134.ssh > cpe1033bf982cdf-cm1033bf982cdd.cpe.net.cable.rogers.com.65054: Flags [P.], seq 1724432:1724628, ack 469, win 501, length 196
15:25:04.907248 IP Comp3134.ssh > cpe1033bf982cdf-cm1033bf982cdd.cpe.net.cable.rogers.com.65054: Flags [P.], seq 1724628:1724824, ack 469, win 501, length 196
15:25:04.907302 IP Comp3134.ssh > cpe1033bf982cdf-cm1033bf982cdd.cpe.net.cable.rogers.com.65054: Flags [P.], seq 1724824:1725020, ack 469, win 501, length 196
15:25:04.907341 IP Comp3134.ssh > cpe1033bf982cdf-cm1033bf982cdd.cpe.net.cable.rogers.com.65054: Flags [P.], seq 1725020:1725216, ack 469, win 501, length 196
15:25:04.907378 IP Comp3134.ssh > cpe1033bf982cdf-cm1033bf982cdd.cpe.net.cable.rogers.com.65054: Flags [P.], seq 1725216:1725412, ack 469, win 501, length 196
15:25:04.907416 IP Comp3134.ssh > cpe1033bf982cdf-cm1033bf982cdd.cpe.net.cable.rogers.com.65054: Flags [P.], seq 1725412:1725608, ack 469, win 501, length 196
15:25:04.907452 IP Comp3134.ssh > cpe1033bf982cdf-cm1033bf982cdd.cpe.net.cable.rogers.com.65054: Flags [P.], seq 1725608:1725804, ack 469, win 501, length 196
15:25:04.907569 IP Comp3134.ssh > cpe1033bf982cdf-cm1033bf982cdd.cpe.net.cable.rogers.com.65054: Flags [P.], seq 1725804:1726000, ack 469, win 501, length 196
15:25:04.907678 IP Comp3134.ssh > cpe1033bf982cdf-cm1033bf982cdd.cpe.net.cable.rogers.com.65054: Flags [P.], seq 1726000:1726196, ack 469, win 501, length 196
15:25:04.907723 IP Comp3134.ssh > cpe1033bf982cdf-cm1033bf982cdd.cpe.net.cable.rogers.com.65054: Flags [P.], seq 1726196:1726392, ack 469, win 501, length 196
15:25:04.907762 IP Comp3134.ssh > cpe1033bf982cdf-cm1033bf982cdd.cpe.net.cable.rogers.com.65054: Flags [P.], seq 1726392:1726588, ack 469, win 501, length 196
15:25:04.907800 IP Comp3134.ssh > cpe1033bf982cdf-cm1033bf982cdd.cpe.net.cable.rogers.com.65054: Flags [P.], seq 1726588:1726784, ack 469, win 501, length 196
15:25:04.907838 IP Comp3134.ssh > cpe1033bf982cdf-cm1033bf982cdd.cpe.net.cable.rogers.com.65054: Flags [P.], seq 1726784:1726980, ack 469, win 501, length 196
15:25:04.907894 IP Comp3134.ssh > cpe1033bf982cdf-cm1033bf982cdd.cpe.net.cable.rogers.com.65054: Flags [P.], seq 1726980:1727176, ack 469, win 501, length 196
15:25:04.907948 IP Comp3134.ssh > cpe1033bf982cdf-cm1033bf982cdd.cpe.net.cable.rogers.com.65054: Flags [P.], seq 1727176:1727372, ack 469, win 501, length 196
15:25:04.907986 IP Comp3134.ssh > cpe1033bf982cdf-cm1033bf982cdd.cpe.net.cable.rogers.com.65054: Flags [P.], seq 1727372:1727568, ack 469, win 501, length 196
15:25:04.908025 IP Comp3134.ssh > cpe1033bf982cdf-cm1033bf982cdd.cpe.net.cable.rogers.com.65054: Flags [P.], seq 1727568:1727764, ack 469, win 501, length 196
15:25:04.908085 IP Comp3134.ssh > cpe1033bf982cdf-cm1033bf982cdd.cpe.net.cable.rogers.com.65054: Flags [P.], seq 1727764:1727960, ack 469, win 501, length 196
15:25:04.908140 IP Comp3134.ssh > cpe1033bf982cdf-cm1033bf982cdd.cpe.net.cable.rogers.com.65054: Flags [P.], seq 1727960:1728156, ack 469, win 501, length 196
15:25:04.908179 IP Comp3134.ssh > cpe1033bf982cdf-cm1033bf982cdd.cpe.net.cable.rogers.com.65054: Flags [P.], seq 1728156:1728352, ack 469, win 501, length 196
15:25:04.908216 IP Comp3134.ssh > cpe1033bf982cdf-cm1033bf982cdd.cpe.net.cable.rogers.com.65054: Flags [P.], seq 1728352:1728548, ack 469, win 501, length 196
15:25:04.908268 IP Comp3134.ssh > cpe1033bf982cdf-cm1033bf982cdd.cpe.net.cable.rogers.com.65054: Flags [P.], seq 1728548:1728744, ack 469, win 501, length 196
15:25:04.908309 IP Comp3134.ssh > cpe1033bf982cdf-cm1033bf982cdd.cpe.net.cable.rogers.com.65054: Flags [P.], seq 1728744:1728940, ack 469, win 501, length 196
15:25:04.908350 IP Comp3134.ssh > cpe1033bf982cdf-cm1033bf982cdd.cpe.net.cable.rogers.com.65054: Flags [P.], seq 1728940:1729136, ack 469, win 501, length 196
15:25:04.908386 IP Comp3134.ssh > cpe1033bf982cdf-cm1033bf982cdd.cpe.net.cable.rogers.com.65054: Flags [P.], seq 1729136:1729332, ack 469, win 501, length 196
15:25:04.908424 IP Comp3134.ssh > cpe1033bf982cdf-cm1033bf982cdd.cpe.net.cable.rogers.com.65054: Flags [P.], seq 1729332:1729528, ack 469, win 501, length 196
15:25:04.908464 IP Comp3134.ssh > cpe1033bf982cdf-cm1033bf982cdd.cpe.net.cable.rogers.com.65054: Flags [P.], seq 1729528:1729724, ack 469, win 501, length 196
15:25:04.908505 IP Comp3134.ssh > cpe1033bf982cdf-cm1033bf982cdd.cpe.net.cable.rogers.com.65054: Flags [P.], seq 1729724:1729920, ack 469, win 501, length 196
15:25:04.908540 IP Comp3134.ssh > cpe1033bf982cdf-cm1033bf982cdd.cpe.net.cable.rogers.com.65054: Flags [P.], seq 1729920:1730116, ack 469, win 501, length 196
15:25:04.908576 IP Comp3134.ssh > cpe1033bf982cdf-cm1033bf982cdd.cpe.net.cable.rogers.com.65054: Flags [P.], seq 1730116:1730312, ack 469, win 501, length 196
15:25:04.908630 IP Comp3134.ssh > cpe1033bf982cdf-cm1033bf982cdd.cpe.net.cable.rogers.com.65054: Flags [P.], seq 1730312:1730508, ack 469, win 501, length 196
15:25:04.908667 IP Comp3134.ssh > cpe1033bf982cdf-cm1033bf982cdd.cpe.net.cable.rogers.com.65054: Flags [P.], seq 1730508:1730704, ack 469, win 501, length 196
15:25:04.908707 IP Comp3134.ssh > cpe1033bf982cdf-cm1033bf982cdd.cpe.net.cable.rogers.com.65054: Flags [P.], seq 1730704:1730900, ack 469, win 501, length 196
15:25:04.908743 IP Comp3134.ssh > cpe1033bf982cdf-cm1033bf982cdd.cpe.net.cable.rogers.com.65054: Flags [P.], seq 1730900:1731096, ack 469, win 501, length 196
15:25:04.908780 IP Comp3134.ssh > cpe1033bf982cdf-cm1033bf982cdd.cpe.net.cable.rogers.com.65054: Flags [P.], seq 1731096:1731292, ack 469, win 501, length 196
15:25:04.908815 IP Comp3134.ssh > cpe1033bf982cdf-cm1033bf982cdd.cpe.net.cable.rogers.com.65054: Flags [P.], seq 1731292:1731488, ack 469, win 501, length 196
15:25:04.908853 IP Comp3134.ssh > cpe1033bf982cdf-cm1033bf982cdd.cpe.net.cable.rogers.com.65054: Flags [P.], seq 1731488:1731684, ack 469, win 501, length 196
15:25:04.908889 IP Comp3134.ssh > cpe1033bf982cdf-cm1033bf982cdd.cpe.net.cable.rogers.com.65054: Flags [P.], seq 1731684:1731880, ack 469, win 501, length 196
15:25:04.908927 IP Comp3134.ssh > cpe1033bf982cdf-cm1033bf982cdd.cpe.net.cable.rogers.com.65054: Flags [P.], seq 1731880:1732076, ack 469, win 501, length 196
15:25:04.908962 IP Comp3134.ssh > cpe1033bf982cdf-cm1033bf982cdd.cpe.net.cable.rogers.com.65054: Flags [P.], seq 1732076:1732272, ack 469, win 501, length 196
15:25:04.909019 IP Comp3134.ssh > cpe1033bf982cdf-cm1033bf982cdd.cpe.net.cable.rogers.com.65054: Flags [P.], seq 1732272:1732468, ack 469, win 501, length 196
15:25:04.909065 IP Comp3134.ssh > cpe1033bf982cdf-cm1033bf982cdd.cpe.net.cable.rogers.com.65054: Flags [P.], seq 1732468:1732664, ack 469, win 501, length 196
15:25:04.909103 IP Comp3134.ssh > cpe1033bf982cdf-cm1033bf982cdd.cpe.net.cable.rogers.com.65054: Flags [P.], seq 1732664:1732860, ack 469, win 501, length 196
15:25:04.916765 IP cpe1033bf982cdf-cm1033bf982cdd.cpe.net.cable.rogers.com.65054 > Comp3134.ssh: Flags [.], ack 1715596, win 16093, length 0
15:25:04.916809 IP Comp3134.ssh > cpe1033bf982cdf-cm1033bf982cdd.cpe.net.cable.rogers.com.65054: Flags [P.], seq 1732860:1733056, ack 469, win 501, length 196
15:25:04.916938 IP Comp3134.ssh > cpe1033bf982cdf-cm1033bf982cdd.cpe.net.cable.rogers.com.65054: Flags [P.], seq 1733056:1733396, ack 469, win 501, length 340
15:25:04.916981 IP Comp3134.ssh > cpe1033bf982cdf-cm1033bf982cdd.cpe.net.cable.rogers.com.65054: Flags [P.], seq 1733396:1733592, ack 469, win 501, length 196
15:25:04.917020 IP Comp3134.ssh > cpe1033bf982cdf-cm1033bf982cdd.cpe.net.cable.rogers.com.65054: Flags [P.], seq 1733592:1733788, ack 469, win 501, length 196
15:25:04.917059 IP Comp3134.ssh > cpe1033bf982cdf-cm1033bf982cdd.cpe.net.cable.rogers.com.65054: Flags [P.], seq 1733788:1733984, ack 469, win 501, length 196
15:25:04.917097 IP Comp3134.ssh > cpe1033bf982cdf-cm1033bf982cdd.cpe.net.cable.rogers.com.65054: Flags [P.], seq 1733984:1734180, ack 469, win 501, length 196
15:25:04.917145 IP Comp3134.ssh > cpe1033bf982cdf-cm1033bf982cdd.cpe.net.cable.rogers.com.65054: Flags [P.], seq 1734180:1734376, ack 469, win 501, length 196
15:25:04.917205 IP Comp3134.ssh > cpe1033bf982cdf-cm1033bf982cdd.cpe.net.cable.rogers.com.65054: Flags [P.], seq 1734376:1734572, ack 469, win 501, length 196
15:25:04.917265 IP Comp3134.ssh > cpe1033bf982cdf-cm1033bf982cdd.cpe.net.cable.rogers.com.65054: Flags [P.], seq 1734572:1734768, ack 469, win 501, length 196
15:25:04.917318 IP Comp3134.ssh > cpe1033bf982cdf-cm1033bf982cdd.cpe.net.cable.rogers.com.65054: Flags [P.], seq 1734768:1734964, ack 469, win 501, length 196
15:25:04.917359 IP Comp3134.ssh > cpe1033bf982cdf-cm1033bf982cdd.cpe.net.cable.rogers.com.65054: Flags [P.], seq 1734964:1735160, ack 469, win 501, length 196
15:25:04.917398 IP Comp3134.ssh > cpe1033bf982cdf-cm1033bf982cdd.cpe.net.cable.rogers.com.65054: Flags [P.], seq 1735160:1735356, ack 469, win 501, length 196
15:25:04.917437 IP Comp3134.ssh > cpe1033bf982cdf-cm1033bf982cdd.cpe.net.cable.rogers.com.65054: Flags [P.], seq 1735356:1735552, ack 469, win 501, length 196
15:25:04.917475 IP Comp3134.ssh > cpe1033bf982cdf-cm1033bf982cdd.cpe.net.cable.rogers.com.65054: Flags [P.], seq 1735552:1735748, ack 469, win 501, length 196
15:25:04.917514 IP Comp3134.ssh > cpe1033bf982cdf-cm1033bf982cdd.cpe.net.cable.rogers.com.65054: Flags [P.], seq 1735748:1735944, ack 469, win 501, length 196
15:25:04.917549 IP Comp3134.ssh > cpe1033bf982cdf-cm1033bf982cdd.cpe.net.cable.rogers.com.65054: Flags [P.], seq 1735944:1736140, ack 469, win 501, length 196
15:25:04.917585 IP Comp3134.ssh > cpe1033bf982cdf-cm1033bf982cdd.cpe.net.cable.rogers.com.65054: Flags [P.], seq 1736140:1736336, ack 469, win 501, length 196
15:25:04.917648 IP Comp3134.ssh > cpe1033bf982cdf-cm1033bf982cdd.cpe.net.cable.rogers.com.65054: Flags [P.], seq 1736336:1736532, ack 469, win 501, length 196
15:25:04.917699 IP Comp3134.ssh > cpe1033bf982cdf-cm1033bf982cdd.cpe.net.cable.rogers.com.65054: Flags [P.], seq 1736532:1736728, ack 469, win 501, length 196
15:25:04.917734 IP Comp3134.ssh > cpe1033bf982cdf-cm1033bf982cdd.cpe.net.cable.rogers.com.65054: Flags [P.], seq 1736728:1736924, ack 469, win 501, length 196
15:25:04.917781 IP Comp3134.ssh > cpe1033bf982cdf-cm1033bf982cdd.cpe.net.cable.rogers.com.65054: Flags [P.], seq 1736924:1737120, ack 469, win 501, length 196
15:25:04.917818 IP Comp3134.ssh > cpe1033bf982cdf-cm1033bf982cdd.cpe.net.cable.rogers.com.65054: Flags [P.], seq 1737120:1737316, ack 469, win 501, length 196
15:25:04.917854 IP Comp3134.ssh > cpe1033bf982cdf-cm1033bf982cdd.cpe.net.cable.rogers.com.65054: Flags [P.], seq 1737316:1737512, ack 469, win 501, length 196
15:25:04.917889 IP Comp3134.ssh > cpe1033bf982cdf-cm1033bf982cdd.cpe.net.cable.rogers.com.65054: Flags [P.], seq 1737512:1737708, ack 469, win 501, length 196
15:25:04.917937 IP Comp3134.ssh > cpe1033bf982cdf-cm1033bf982cdd.cpe.net.cable.rogers.com.65054: Flags [P.], seq 1737708:1737904, ack 469, win 501, length 196
15:25:04.918002 IP Comp3134.ssh > cpe1033bf982cdf-cm1033bf982cdd.cpe.net.cable.rogers.com.65054: Flags [P.], seq 1737904:1738100, ack 469, win 501, length 196
15:25:04.918056 IP Comp3134.ssh > cpe1033bf982cdf-cm1033bf982cdd.cpe.net.cable.rogers.com.65054: Flags [P.], seq 1738100:1738296, ack 469, win 501, length 196
15:25:04.918095 IP Comp3134.ssh > cpe1033bf982cdf-cm1033bf982cdd.cpe.net.cable.rogers.com.65054: Flags [P.], seq 1738296:1738492, ack 469, win 501, length 196
15:25:04.918130 IP Comp3134.ssh > cpe1033bf982cdf-cm1033bf982cdd.cpe.net.cable.rogers.com.65054: Flags [P.], seq 1738492:1738688, ack 469, win 501, length 196
15:25:04.918168 IP Comp3134.ssh > cpe1033bf982cdf-cm1033bf982cdd.cpe.net.cable.rogers.com.65054: Flags [P.], seq 1738688:1738884, ack 469, win 501, length 196
15:25:04.918205 IP Comp3134.ssh > cpe1033bf982cdf-cm1033bf982cdd.cpe.net.cable.rogers.com.65054: Flags [P.], seq 1738884:1739080, ack 469, win 501, length 196
15:25:04.918241 IP Comp3134.ssh > cpe1033bf982cdf-cm1033bf982cdd.cpe.net.cable.rogers.com.65054: Flags [P.], seq 1739080:1739276, ack 469, win 501, length 196
15:25:04.918278 IP Comp3134.ssh > cpe1033bf982cdf-cm1033bf982cdd.cpe.net.cable.rogers.com.65054: Flags [P.], seq 1739276:1739472, ack 469, win 501, length 196
15:25:04.918327 IP Comp3134.ssh > cpe1033bf982cdf-cm1033bf982cdd.cpe.net.cable.rogers.com.65054: Flags [P.], seq 1739472:1739668, ack 469, win 501, length 196
15:25:04.918384 IP Comp3134.ssh > cpe1033bf982cdf-cm1033bf982cdd.cpe.net.cable.rogers.com.65054: Flags [P.], seq 1739668:1739864, ack 469, win 501, length 196
15:25:04.918427 IP Comp3134.ssh > cpe1033bf982cdf-cm1033bf982cdd.cpe.net.cable.rogers.com.65054: Flags [P.], seq 1739864:1740060, ack 469, win 501, length 196
15:25:04.918466 IP Comp3134.ssh > cpe1033bf982cdf-cm1033bf982cdd.cpe.net.cable.rogers.com.65054: Flags [P.], seq 1740060:1740256, ack 469, win 501, length 196
15:25:04.918502 IP Comp3134.ssh > cpe1033bf982cdf-cm1033bf982cdd.cpe.net.cable.rogers.com.65054: Flags [P.], seq 1740256:1740452, ack 469, win 501, length 196
15:25:04.918568 IP Comp3134.ssh > cpe1033bf982cdf-cm1033bf982cdd.cpe.net.cable.rogers.com.65054: Flags [P.], seq 1740452:1740648, ack 469, win 501, length 196
15:25:04.918626 IP Comp3134.ssh > cpe1033bf982cdf-cm1033bf982cdd.cpe.net.cable.rogers.com.65054: Flags [P.], seq 1740648:1740844, ack 469, win 501, length 196
15:25:04.918683 IP Comp3134.ssh > cpe1033bf982cdf-cm1033bf982cdd.cpe.net.cable.rogers.com.65054: Flags [P.], seq 1740844:1741040, ack 469, win 501, length 196
15:25:04.918724 IP Comp3134.ssh > cpe1033bf982cdf-cm1033bf982cdd.cpe.net.cable.rogers.com.65054: Flags [P.], seq 1741040:1741236, ack 469, win 501, length 196
15:25:04.918762 IP Comp3134.ssh > cpe1033bf982cdf-cm1033bf982cdd.cpe.net.cable.rogers.com.65054: Flags [P.], seq 1741236:1741432, ack 469, win 501, length 196
15:25:04.918800 IP Comp3134.ssh > cpe1033bf982cdf-cm1033bf982cdd.cpe.net.cable.rogers.com.65054: Flags [P.], seq 1741432:1741628, ack 469, win 501, length 196
15:25:04.918836 IP Comp3134.ssh > cpe1033bf982cdf-cm1033bf982cdd.cpe.net.cable.rogers.com.65054: Flags [P.], seq 1741628:1741824, ack 469, win 501, length 196
15:25:04.918874 IP Comp3134.ssh > cpe1033bf982cdf-cm1033bf982cdd.cpe.net.cable.rogers.com.65054: Flags [P.], seq 1741824:1742020, ack 469, win 501, length 196
15:25:04.918911 IP Comp3134.ssh > cpe1033bf982cdf-cm1033bf982cdd.cpe.net.cable.rogers.com.65054: Flags [P.], seq 1742020:1742216, ack 469, win 501, length 196
15:25:04.918947 IP Comp3134.ssh > cpe1033bf982cdf-cm1033bf982cdd.cpe.net.cable.rogers.com.65054: Flags [P.], seq 1742216:1742412, ack 469, win 501, length 196
15:25:04.918984 IP Comp3134.ssh > cpe1033bf982cdf-cm1033bf982cdd.cpe.net.cable.rogers.com.65054: Flags [P.], seq 1742412:1742608, ack 469, win 501, length 196
15:25:04.919021 IP Comp3134.ssh > cpe1033bf982cdf-cm1033bf982cdd.cpe.net.cable.rogers.com.65054: Flags [P.], seq 1742608:1742804, ack 469, win 501, length 196
15:25:04.919058 IP Comp3134.ssh > cpe1033bf982cdf-cm1033bf982cdd.cpe.net.cable.rogers.com.65054: Flags [P.], seq 1742804:1743000, ack 469, win 501, length 196
15:25:04.919093 IP Comp3134.ssh > cpe1033bf982cdf-cm1033bf982cdd.cpe.net.cable.rogers.com.65054: Flags [P.], seq 1743000:1743196, ack 469, win 501, length 196
15:25:04.919131 IP Comp3134.ssh > cpe1033bf982cdf-cm1033bf982cdd.cpe.net.cable.rogers.com.65054: Flags [P.], seq 1743196:1743392, ack 469, win 501, length 196
15:25:04.919168 IP Comp3134.ssh > cpe1033bf982cdf-cm1033bf982cdd.cpe.net.cable.rogers.com.65054: Flags [P.], seq 1743392:1743588, ack 469, win 501, length 196
15:25:04.919207 IP Comp3134.ssh > cpe1033bf982cdf-cm1033bf982cdd.cpe.net.cable.rogers.com.65054: Flags [P.], seq 1743588:1743784, ack 469, win 501, length 196
15:25:04.919245 IP Comp3134.ssh > cpe1033bf982cdf-cm1033bf982cdd.cpe.net.cable.rogers.com.65054: Flags [P.], seq 1743784:1743980, ack 469, win 501, length 196
15:25:04.919279 IP Comp3134.ssh > cpe1033bf982cdf-cm1033bf982cdd.cpe.net.cable.rogers.com.65054: Flags [P.], seq 1743980:1744176, ack 469, win 501, length 196
15:25:04.919316 IP Comp3134.ssh > cpe1033bf982cdf-cm1033bf982cdd.cpe.net.cable.rogers.com.65054: Flags [P.], seq 1744176:1744372, ack 469, win 501, length 196
15:25:04.919353 IP Comp3134.ssh > cpe1033bf982cdf-cm1033bf982cdd.cpe.net.cable.rogers.com.65054: Flags [P.], seq 1744372:1744568, ack 469, win 501, length 196
15:25:04.919402 IP Comp3134.ssh > cpe1033bf982cdf-cm1033bf982cdd.cpe.net.cable.rogers.com.65054: Flags [P.], seq 1744568:1744764, ack 469, win 501, length 196
15:25:04.919465 IP Comp3134.ssh > cpe1033bf982cdf-cm1033bf982cdd.cpe.net.cable.rogers.com.65054: Flags [P.], seq 1744764:1744960, ack 469, win 501, length 196
15:25:04.919521 IP Comp3134.ssh > cpe1033bf982cdf-cm1033bf982cdd.cpe.net.cable.rogers.com.65054: Flags [P.], seq 1744960:1745156, ack 469, win 501, length 196
15:25:04.919563 IP Comp3134.ssh > cpe1033bf982cdf-cm1033bf982cdd.cpe.net.cable.rogers.com.65054: Flags [P.], seq 1745156:1745352, ack 469, win 501, length 196
15:25:04.919613 IP Comp3134.ssh > cpe1033bf982cdf-cm1033bf982cdd.cpe.net.cable.rogers.com.65054: Flags [P.], seq 1745352:1745548, ack 469, win 501, length 196
15:25:04.919666 IP Comp3134.ssh > cpe1033bf982cdf-cm1033bf982cdd.cpe.net.cable.rogers.com.65054: Flags [P.], seq 1745548:1745744, ack 469, win 501, length 196
15:25:04.919718 IP Comp3134.ssh > cpe1033bf982cdf-cm1033bf982cdd.cpe.net.cable.rogers.com.65054: Flags [P.], seq 1745744:1745940, ack 469, win 501, length 196
15:25:04.919767 IP Comp3134.ssh > cpe1033bf982cdf-cm1033bf982cdd.cpe.net.cable.rogers.com.65054: Flags [P.], seq 1745940:1746136, ack 469, win 501, length 196
15:25:04.919822 IP Comp3134.ssh > cpe1033bf982cdf-cm1033bf982cdd.cpe.net.cable.rogers.com.65054: Flags [P.], seq 1746136:1746332, ack 469, win 501, length 196
15:25:04.919864 IP Comp3134.ssh > cpe1033bf982cdf-cm1033bf982cdd.cpe.net.cable.rogers.com.65054: Flags [P.], seq 1746332:1746528, ack 469, win 501, length 196
15:25:04.919901 IP Comp3134.ssh > cpe1033bf982cdf-cm1033bf982cdd.cpe.net.cable.rogers.com.65054: Flags [P.], seq 1746528:1746724, ack 469, win 501, length 196
15:25:04.919942 IP Comp3134.ssh > cpe1033bf982cdf-cm1033bf982cdd.cpe.net.cable.rogers.com.65054: Flags [P.], seq 1746724:1746920, ack 469, win 501, length 196
15:25:04.919978 IP Comp3134.ssh > cpe1033bf982cdf-cm1033bf982cdd.cpe.net.cable.rogers.com.65054: Flags [P.], seq 1746920:1747116, ack 469, win 501, length 196
15:25:04.920013 IP Comp3134.ssh > cpe1033bf982cdf-cm1033bf982cdd.cpe.net.cable.rogers.com.65054: Flags [P.], seq 1747116:1747312, ack 469, win 501, length 196
15:25:04.920051 IP Comp3134.ssh > cpe1033bf982cdf-cm1033bf982cdd.cpe.net.cable.rogers.com.65054: Flags [P.], seq 1747312:1747508, ack 469, win 501, length 196
15:25:04.920086 IP Comp3134.ssh > cpe1033bf982cdf-cm1033bf982cdd.cpe.net.cable.rogers.com.65054: Flags [P.], seq 1747508:1747704, ack 469, win 501, length 196
15:25:04.920124 IP Comp3134.ssh > cpe1033bf982cdf-cm1033bf982cdd.cpe.net.cable.rogers.com.65054: Flags [P.], seq 1747704:1747900, ack 469, win 501, length 196
15:25:04.920159 IP Comp3134.ssh > cpe1033bf982cdf-cm1033bf982cdd.cpe.net.cable.rogers.com.65054: Flags [P.], seq 1747900:1748096, ack 469, win 501, length 196
15:25:04.920198 IP Comp3134.ssh > cpe1033bf982cdf-cm1033bf982cdd.cpe.net.cable.rogers.com.65054: Flags [P.], seq 1748096:1748292, ack 469, win 501, length 196
15:25:04.920234 IP Comp3134.ssh > cpe1033bf982cdf-cm1033bf982cdd.cpe.net.cable.rogers.com.65054: Flags [P.], seq 1748292:1748488, ack 469, win 501, length 196
15:25:04.920275 IP Comp3134.ssh > cpe1033bf982cdf-cm1033bf982cdd.cpe.net.cable.rogers.com.65054: Flags [P.], seq 1748488:1748684, ack 469, win 501, length 196
15:25:04.920310 IP Comp3134.ssh > cpe1033bf982cdf-cm1033bf982cdd.cpe.net.cable.rogers.com.65054: Flags [P.], seq 1748684:1748880, ack 469, win 501, length 196
15:25:04.920356 IP Comp3134.ssh > cpe1033bf982cdf-cm1033bf982cdd.cpe.net.cable.rogers.com.65054: Flags [P.], seq 1748880:1749076, ack 469, win 501, length 196
15:25:04.920410 IP Comp3134.ssh > cpe1033bf982cdf-cm1033bf982cdd.cpe.net.cable.rogers.com.65054: Flags [P.], seq 1749076:1749272, ack 469, win 501, length 196
15:25:04.920456 IP Comp3134.ssh > cpe1033bf982cdf-cm1033bf982cdd.cpe.net.cable.rogers.com.65054: Flags [P.], seq 1749272:1749468, ack 469, win 501, length 196
15:25:04.920506 IP Comp3134.ssh > cpe1033bf982cdf-cm1033bf982cdd.cpe.net.cable.rogers.com.65054: Flags [P.], seq 1749468:1749664, ack 469, win 501, length 196
15:25:04.920547 IP Comp3134.ssh > cpe1033bf982cdf-cm1033bf982cdd.cpe.net.cable.rogers.com.65054: Flags [P.], seq 1749664:1749860, ack 469, win 501, length 196
15:25:04.920585 IP Comp3134.ssh > cpe1033bf982cdf-cm1033bf982cdd.cpe.net.cable.rogers.com.65054: Flags [P.], seq 1749860:1750056, ack 469, win 501, length 196
15:25:04.920644 IP Comp3134.ssh > cpe1033bf982cdf-cm1033bf982cdd.cpe.net.cable.rogers.com.65054: Flags [P.], seq 1750056:1750252, ack 469, win 501, length 196
15:25:04.920681 IP Comp3134.ssh > cpe1033bf982cdf-cm1033bf982cdd.cpe.net.cable.rogers.com.65054: Flags [P.], seq 1750252:1750448, ack 469, win 501, length 196
15:25:04.920717 IP Comp3134.ssh > cpe1033bf982cdf-cm1033bf982cdd.cpe.net.cable.rogers.com.65054: Flags [P.], seq 1750448:1750644, ack 469, win 501, length 196
15:25:04.920754 IP Comp3134.ssh > cpe1033bf982cdf-cm1033bf982cdd.cpe.net.cable.rogers.com.65054: Flags [P.], seq 1750644:1750840, ack 469, win 501, length 196
15:25:04.920790 IP Comp3134.ssh > cpe1033bf982cdf-cm1033bf982cdd.cpe.net.cable.rogers.com.65054: Flags [P.], seq 1750840:1751036, ack 469, win 501, length 196
15:25:04.920823 IP Comp3134.ssh > cpe1033bf982cdf-cm1033bf982cdd.cpe.net.cable.rogers.com.65054: Flags [P.], seq 1751036:1751232, ack 469, win 501, length 196
15:25:04.920861 IP Comp3134.ssh > cpe1033bf982cdf-cm1033bf982cdd.cpe.net.cable.rogers.com.65054: Flags [P.], seq 1751232:1751428, ack 469, win 501, length 196
15:25:04.920924 IP Comp3134.ssh > cpe1033bf982cdf-cm1033bf982cdd.cpe.net.cable.rogers.com.65054: Flags [P.], seq 1751428:1751624, ack 469, win 501, length 196
15:25:04.920982 IP Comp3134.ssh > cpe1033bf982cdf-cm1033bf982cdd.cpe.net.cable.rogers.com.65054: Flags [P.], seq 1751624:1751820, ack 469, win 501, length 196
15:25:04.921037 IP Comp3134.ssh > cpe1033bf982cdf-cm1033bf982cdd.cpe.net.cable.rogers.com.65054: Flags [P.], seq 1751820:1752016, ack 469, win 501, length 196
15:25:04.921091 IP Comp3134.ssh > cpe1033bf982cdf-cm1033bf982cdd.cpe.net.cable.rogers.com.65054: Flags [P.], seq 1752016:1752212, ack 469, win 501, length 196
15:25:04.921155 IP Comp3134.ssh > cpe1033bf982cdf-cm1033bf982cdd.cpe.net.cable.rogers.com.65054: Flags [P.], seq 1752212:1752408, ack 469, win 501, length 196
15:25:04.921206 IP Comp3134.ssh > cpe1033bf982cdf-cm1033bf982cdd.cpe.net.cable.rogers.com.65054: Flags [P.], seq 1752408:1752604, ack 469, win 501, length 196
15:25:04.921259 IP Comp3134.ssh > cpe1033bf982cdf-cm1033bf982cdd.cpe.net.cable.rogers.com.65054: Flags [P.], seq 1752604:1752800, ack 469, win 501, length 196
15:25:04.921304 IP Comp3134.ssh > cpe1033bf982cdf-cm1033bf982cdd.cpe.net.cable.rogers.com.65054: Flags [P.], seq 1752800:1752996, ack 469, win 501, length 196
15:25:04.921360 IP Comp3134.ssh > cpe1033bf982cdf-cm1033bf982cdd.cpe.net.cable.rogers.com.65054: Flags [P.], seq 1752996:1753192, ack 469, win 501, length 196
15:25:04.921416 IP Comp3134.ssh > cpe1033bf982cdf-cm1033bf982cdd.cpe.net.cable.rogers.com.65054: Flags [P.], seq 1753192:1753388, ack 469, win 501, length 196
15:25:04.921470 IP Comp3134.ssh > cpe1033bf982cdf-cm1033bf982cdd.cpe.net.cable.rogers.com.65054: Flags [P.], seq 1753388:1753584, ack 469, win 501, length 196
15:25:04.921524 IP Comp3134.ssh > cpe1033bf982cdf-cm1033bf982cdd.cpe.net.cable.rogers.com.65054: Flags [P.], seq 1753584:1753780, ack 469, win 501, length 196
15:25:04.921580 IP Comp3134.ssh > cpe1033bf982cdf-cm1033bf982cdd.cpe.net.cable.rogers.com.65054: Flags [P.], seq 1753780:1753976, ack 469, win 501, length 196
15:25:04.921638 IP Comp3134.ssh > cpe1033bf982cdf-cm1033bf982cdd.cpe.net.cable.rogers.com.65054: Flags [P.], seq 1753976:1754172, ack 469, win 501, length 196
15:25:04.921699 IP Comp3134.ssh > cpe1033bf982cdf-cm1033bf982cdd.cpe.net.cable.rogers.com.65054: Flags [P.], seq 1754172:1754368, ack 469, win 501, length 196
15:25:04.921760 IP Comp3134.ssh > cpe1033bf982cdf-cm1033bf982cdd.cpe.net.cable.rogers.com.65054: Flags [P.], seq 1754368:1754564, ack 469, win 501, length 196
15:25:04.921837 IP Comp3134.ssh > cpe1033bf982cdf-cm1033bf982cdd.cpe.net.cable.rogers.com.65054: Flags [P.], seq 1754564:1754760, ack 469, win 501, length 196
15:25:04.921906 IP Comp3134.ssh > cpe1033bf982cdf-cm1033bf982cdd.cpe.net.cable.rogers.com.65054: Flags [P.], seq 1754760:1754956, ack 469, win 501, length 196
15:25:04.921949 IP Comp3134.ssh > cpe1033bf982cdf-cm1033bf982cdd.cpe.net.cable.rogers.com.65054: Flags [P.], seq 1754956:1755152, ack 469, win 501, length 196
15:25:04.921989 IP Comp3134.ssh > cpe1033bf982cdf-cm1033bf982cdd.cpe.net.cable.rogers.com.65054: Flags [P.], seq 1755152:1755348, ack 469, win 501, length 196
15:25:04.922024 IP Comp3134.ssh > cpe1033bf982cdf-cm1033bf982cdd.cpe.net.cable.rogers.com.65054: Flags [P.], seq 1755348:1755544, ack 469, win 501, length 196
15:25:04.922060 IP Comp3134.ssh > cpe1033bf982cdf-cm1033bf982cdd.cpe.net.cable.rogers.com.65054: Flags [P.], seq 1755544:1755740, ack 469, win 501, length 196
15:25:04.922097 IP Comp3134.ssh > cpe1033bf982cdf-cm1033bf982cdd.cpe.net.cable.rogers.com.65054: Flags [P.], seq 1755740:1755936, ack 469, win 501, length 196
15:25:04.922132 IP Comp3134.ssh > cpe1033bf982cdf-cm1033bf982cdd.cpe.net.cable.rogers.com.65054: Flags [P.], seq 1755936:1756132, ack 469, win 501, length 196
15:25:04.922169 IP Comp3134.ssh > cpe1033bf982cdf-cm1033bf982cdd.cpe.net.cable.rogers.com.65054: Flags [P.], seq 1756132:1756328, ack 469, win 501, length 196
15:25:04.922208 IP Comp3134.ssh > cpe1033bf982cdf-cm1033bf982cdd.cpe.net.cable.rogers.com.65054: Flags [P.], seq 1756328:1756524, ack 469, win 501, length 196
15:25:04.922243 IP Comp3134.ssh > cpe1033bf982cdf-cm1033bf982cdd.cpe.net.cable.rogers.com.65054: Flags [P.], seq 1756524:1756720, ack 469, win 501, length 196
15:25:04.922281 IP Comp3134.ssh > cpe1033bf982cdf-cm1033bf982cdd.cpe.net.cable.rogers.com.65054: Flags [P.], seq 1756720:1756916, ack 469, win 501, length 196
15:25:04.922316 IP Comp3134.ssh > cpe1033bf982cdf-cm1033bf982cdd.cpe.net.cable.rogers.com.65054: Flags [P.], seq 1756916:1757112, ack 469, win 501, length 196
15:25:04.922351 IP Comp3134.ssh > cpe1033bf982cdf-cm1033bf982cdd.cpe.net.cable.rogers.com.65054: Flags [P.], seq 1757112:1757308, ack 469, win 501, length 196
15:25:04.922388 IP Comp3134.ssh > cpe1033bf982cdf-cm1033bf982cdd.cpe.net.cable.rogers.com.65054: Flags [P.], seq 1757308:1757504, ack 469, win 501, length 196
15:25:04.922423 IP Comp3134.ssh > cpe1033bf982cdf-cm1033bf982cdd.cpe.net.cable.rogers.com.65054: Flags [P.], seq 1757504:1757700, ack 469, win 501, length 196
15:25:04.922462 IP Comp3134.ssh > cpe1033bf982cdf-cm1033bf982cdd.cpe.net.cable.rogers.com.65054: Flags [P.], seq 1757700:1757896, ack 469, win 501, length 196
15:25:04.922499 IP Comp3134.ssh > cpe1033bf982cdf-cm1033bf982cdd.cpe.net.cable.rogers.com.65054: Flags [P.], seq 1757896:1758092, ack 469, win 501, length 196
15:25:04.922537 IP Comp3134.ssh > cpe1033bf982cdf-cm1033bf982cdd.cpe.net.cable.rogers.com.65054: Flags [P.], seq 1758092:1758288, ack 469, win 501, length 196
15:25:04.922572 IP Comp3134.ssh > cpe1033bf982cdf-cm1033bf982cdd.cpe.net.cable.rogers.com.65054: Flags [P.], seq 1758288:1758484, ack 469, win 501, length 196
15:25:04.922609 IP Comp3134.ssh > cpe1033bf982cdf-cm1033bf982cdd.cpe.net.cable.rogers.com.65054: Flags [P.], seq 1758484:1758680, ack 469, win 501, length 196
15:25:04.922644 IP Comp3134.ssh > cpe1033bf982cdf-cm1033bf982cdd.cpe.net.cable.rogers.com.65054: Flags [P.], seq 1758680:1758876, ack 469, win 501, length 196
15:25:04.922679 IP Comp3134.ssh > cpe1033bf982cdf-cm1033bf982cdd.cpe.net.cable.rogers.com.65054: Flags [P.], seq 1758876:1759072, ack 469, win 501, length 196
15:25:04.922717 IP Comp3134.ssh > cpe1033bf982cdf-cm1033bf982cdd.cpe.net.cable.rogers.com.65054: Flags [P.], seq 1759072:1759268, ack 469, win 501, length 196
15:25:04.922772 IP Comp3134.ssh > cpe1033bf982cdf-cm1033bf982cdd.cpe.net.cable.rogers.com.65054: Flags [P.], seq 1759268:1759464, ack 469, win 501, length 196
15:25:04.922817 IP Comp3134.ssh > cpe1033bf982cdf-cm1033bf982cdd.cpe.net.cable.rogers.com.65054: Flags [P.], seq 1759464:1759660, ack 469, win 501, length 196
15:25:04.922871 IP Comp3134.ssh > cpe1033bf982cdf-cm1033bf982cdd.cpe.net.cable.rogers.com.65054: Flags [P.], seq 1759660:1759856, ack 469, win 501, length 196
15:25:04.922911 IP Comp3134.ssh > cpe1033bf982cdf-cm1033bf982cdd.cpe.net.cable.rogers.com.65054: Flags [P.], seq 1759856:1760052, ack 469, win 501, length 196
15:25:04.922961 IP Comp3134.ssh > cpe1033bf982cdf-cm1033bf982cdd.cpe.net.cable.rogers.com.65054: Flags [P.], seq 1760052:1760248, ack 469, win 501, length 196
