root@Comp3134:~# tcpdump -i eth0
tcpdump: verbose output suppressed, use -v or -vv for full protocol decode
listening on eth0, link-type EN10MB (Ethernet), capture size 262144 bytes
15:18:47.442137 IP Comp3134.ssh > cpe1033bf982cdf-cm1033bf982cdd.cpe.net.cable.rogers.com.63513: Flags [P.], seq 2921406870:2921406906, ack 638198524, win 501, length 36
15:18:47.443039 IP Comp3134.ssh > cpe1033bf982cdf-cm1033bf982cdd.cpe.net.cable.rogers.com.63513: Flags [P.], seq 36:144, ack 1, win 501, length 108
15:18:47.443079 IP Comp3134.ssh > cpe1033bf982cdf-cm1033bf982cdd.cpe.net.cable.rogers.com.63513: Flags [P.], seq 144:180, ack 1, win 501, length 36
15:18:47.443111 IP Comp3134.ssh > cpe1033bf982cdf-cm1033bf982cdd.cpe.net.cable.rogers.com.63513: Flags [P.], seq 180:288, ack 1, win 501, length 108
15:18:47.443138 IP Comp3134.ssh > cpe1033bf982cdf-cm1033bf982cdd.cpe.net.cable.rogers.com.63513: Flags [P.], seq 288:324, ack 1, win 501, length 36
15:18:47.443609 IP Comp3134.57441 > 67.207.67.2.domain: 47131+ [1au] PTR? 180.88.228.99.in-addr.arpa. (55)
15:18:47.443897 IP Comp3134.44140 > 67.207.67.2.domain: 253+ [1au] PTR? 40.216.110.143.in-addr.arpa. (56)
15:18:47.443944 IP Comp3134.52618 > 67.207.67.2.domain: 30226+ [1au] PTR? 40.216.110.143.in-addr.arpa. (56)
15:18:47.444354 IP 67.207.67.2.domain > Comp3134.57441: 47131 1/0/1 PTR cpe1033bf982cdf-cm1033bf982cdd.cpe.net.cable.rogers.com. (124)
15:18:47.444370 IP Comp3134 > 67.207.67.2: ICMP Comp3134 udp port 57441 unreachable, length 160
15:18:47.444454 IP 67.207.67.2.domain > Comp3134.44140: 253 NXDomain 0/1/1 (123)
15:18:47.444468 IP 67.207.67.2.domain > Comp3134.52618: 30226 NXDomain 0/1/1 (123)
15:18:47.444541 IP Comp3134.44140 > 67.207.67.2.domain: 253+ PTR? 40.216.110.143.in-addr.arpa. (45)
15:18:47.444584 IP Comp3134.52618 > 67.207.67.2.domain: 30226+ PTR? 40.216.110.143.in-addr.arpa. (45)
15:18:47.444694 IP 67.207.67.2.domain > Comp3134.44140: 253 NXDomain 0/1/0 (112)
15:18:47.444729 IP 67.207.67.2.domain > Comp3134.52618: 30226 NXDomain 0/1/0 (112)
15:18:47.445526 IP Comp3134.ssh > cpe1033bf982cdf-cm1033bf982cdd.cpe.net.cable.rogers.com.63513: Flags [P.], seq 324:528, ack 1, win 501, length 204
15:18:47.445562 IP Comp3134.ssh > cpe1033bf982cdf-cm1033bf982cdd.cpe.net.cable.rogers.com.63513: Flags [P.], seq 528:564, ack 1, win 501, length 36
15:18:47.445601 IP Comp3134.ssh > cpe1033bf982cdf-cm1033bf982cdd.cpe.net.cable.rogers.com.63513: Flags [P.], seq 564:752, ack 1, win 501, length 188
15:18:47.445629 IP Comp3134.ssh > cpe1033bf982cdf-cm1033bf982cdd.cpe.net.cable.rogers.com.63513: Flags [P.], seq 752:788, ack 1, win 501, length 36
15:18:47.445657 IP Comp3134.ssh > cpe1033bf982cdf-cm1033bf982cdd.cpe.net.cable.rogers.com.63513: Flags [P.], seq 788:976, ack 1, win 501, length 188
15:18:47.445944 IP Comp3134.32984 > 67.207.67.2.domain: 58028+ [1au] PTR? 2.67.207.67.in-addr.arpa. (53)
15:18:47.445991 IP Comp3134.55605 > 67.207.67.2.domain: 60637+ [1au] PTR? 2.67.207.67.in-addr.arpa. (53)
15:18:47.446205 IP 67.207.67.2.domain > Comp3134.32984: 58028 NXDomain 0/1/1 (120)
15:18:47.446205 IP 67.207.67.2.domain > Comp3134.55605: 60637 NXDomain 0/1/1 (120)
15:18:47.446258 IP Comp3134.32984 > 67.207.67.2.domain: 58028+ PTR? 2.67.207.67.in-addr.arpa. (42)
15:18:47.446298 IP Comp3134.55605 > 67.207.67.2.domain: 60637+ PTR? 2.67.207.67.in-addr.arpa. (42)
15:18:47.446379 IP 67.207.67.2.domain > Comp3134.32984: 58028 NXDomain 0/1/0 (109)
15:18:47.446410 IP 67.207.67.2.domain > Comp3134.55605: 60637 NXDomain 0/1/0 (109)
15:18:47.459982 IP cpe1033bf982cdf-cm1033bf982cdd.cpe.net.cable.rogers.com.63513 > Comp3134.ssh: Flags [.], ack 288, win 509, length 0
15:18:47.460013 IP Comp3134.ssh > cpe1033bf982cdf-cm1033bf982cdd.cpe.net.cable.rogers.com.63513: Flags [P.], seq 976:3896, ack 1, win 501, length 2920
15:18:47.460024 IP Comp3134.ssh > cpe1033bf982cdf-cm1033bf982cdd.cpe.net.cable.rogers.com.63513: Flags [P.], seq 3896:5748, ack 1, win 501, length 1852
15:18:47.460164 IP Comp3134.ssh > cpe1033bf982cdf-cm1033bf982cdd.cpe.net.cable.rogers.com.63513: Flags [P.], seq 5748:5920, ack 1, win 501, length 172
15:18:47.460210 IP Comp3134.ssh > cpe1033bf982cdf-cm1033bf982cdd.cpe.net.cable.rogers.com.63513: Flags [P.], seq 5920:5956, ack 1, win 501, length 36
15:18:47.460249 IP Comp3134.ssh > cpe1033bf982cdf-cm1033bf982cdd.cpe.net.cable.rogers.com.63513: Flags [P.], seq 5956:6144, ack 1, win 501, length 188
15:18:47.460297 IP Comp3134.ssh > cpe1033bf982cdf-cm1033bf982cdd.cpe.net.cable.rogers.com.63513: Flags [P.], seq 6144:6180, ack 1, win 501, length 36
15:18:47.469680 IP cpe1033bf982cdf-cm1033bf982cdd.cpe.net.cable.rogers.com.63513 > Comp3134.ssh: Flags [.], ack 976, win 512, length 0
15:18:47.469704 IP Comp3134.ssh > cpe1033bf982cdf-cm1033bf982cdd.cpe.net.cable.rogers.com.63513: Flags [P.], seq 6180:7300, ack 1, win 501, length 1120
15:18:47.469801 IP Comp3134.ssh > cpe1033bf982cdf-cm1033bf982cdd.cpe.net.cable.rogers.com.63513: Flags [P.], seq 7300:7472, ack 1, win 501, length 172
15:18:47.469833 IP Comp3134.ssh > cpe1033bf982cdf-cm1033bf982cdd.cpe.net.cable.rogers.com.63513: Flags [P.], seq 7472:7508, ack 1, win 501, length 36
15:18:47.469880 IP Comp3134.ssh > cpe1033bf982cdf-cm1033bf982cdd.cpe.net.cable.rogers.com.63513: Flags [P.], seq 7508:7696, ack 1, win 501, length 188
15:18:47.469910 IP Comp3134.ssh > cpe1033bf982cdf-cm1033bf982cdd.cpe.net.cable.rogers.com.63513: Flags [P.], seq 7696:7732, ack 1, win 501, length 36
15:18:47.469943 IP Comp3134.ssh > cpe1033bf982cdf-cm1033bf982cdd.cpe.net.cable.rogers.com.63513: Flags [P.], seq 7732:7920, ack 1, win 501, length 188
15:18:47.469971 IP Comp3134.ssh > cpe1033bf982cdf-cm1033bf982cdd.cpe.net.cable.rogers.com.63513: Flags [P.], seq 7920:7956, ack 1, win 501, length 36
15:18:47.470003 IP Comp3134.ssh > cpe1033bf982cdf-cm1033bf982cdd.cpe.net.cable.rogers.com.63513: Flags [P.], seq 7956:8144, ack 1, win 501, length 188
15:18:47.470031 IP Comp3134.ssh > cpe1033bf982cdf-cm1033bf982cdd.cpe.net.cable.rogers.com.63513: Flags [P.], seq 8144:8180, ack 1, win 501, length 36
15:18:47.470062 IP Comp3134.ssh > cpe1033bf982cdf-cm1033bf982cdd.cpe.net.cable.rogers.com.63513: Flags [P.], seq 8180:8368, ack 1, win 501, length 188
15:18:47.470092 IP Comp3134.ssh > cpe1033bf982cdf-cm1033bf982cdd.cpe.net.cable.rogers.com.63513: Flags [P.], seq 8368:8404, ack 1, win 501, length 36
15:18:47.470123 IP Comp3134.ssh > cpe1033bf982cdf-cm1033bf982cdd.cpe.net.cable.rogers.com.63513: Flags [P.], seq 8404:8592, ack 1, win 501, length 188
15:18:47.478682 IP cpe1033bf982cdf-cm1033bf982cdd.cpe.net.cable.rogers.com.63513 > Comp3134.ssh: Flags [.], ack 6180, win 511, length 0
15:18:47.478704 IP Comp3134.ssh > cpe1033bf982cdf-cm1033bf982cdd.cpe.net.cable.rogers.com.63513: Flags [P.], seq 8592:10196, ack 1, win 501, length 1604
15:18:47.478808 IP Comp3134.ssh > cpe1033bf982cdf-cm1033bf982cdd.cpe.net.cable.rogers.com.63513: Flags [P.], seq 10196:10368, ack 1, win 501, length 172
15:18:47.478841 IP Comp3134.ssh > cpe1033bf982cdf-cm1033bf982cdd.cpe.net.cable.rogers.com.63513: Flags [P.], seq 10368:10404, ack 1, win 501, length 36
15:18:47.478875 IP Comp3134.ssh > cpe1033bf982cdf-cm1033bf982cdd.cpe.net.cable.rogers.com.63513: Flags [P.], seq 10404:10592, ack 1, win 501, length 188
15:18:47.478902 IP Comp3134.ssh > cpe1033bf982cdf-cm1033bf982cdd.cpe.net.cable.rogers.com.63513: Flags [P.], seq 10592:10628, ack 1, win 501, length 36
15:18:47.478935 IP Comp3134.ssh > cpe1033bf982cdf-cm1033bf982cdd.cpe.net.cable.rogers.com.63513: Flags [P.], seq 10628:10816, ack 1, win 501, length 188
15:18:47.478960 IP Comp3134.ssh > cpe1033bf982cdf-cm1033bf982cdd.cpe.net.cable.rogers.com.63513: Flags [P.], seq 10816:10852, ack 1, win 501, length 36
15:18:47.478992 IP Comp3134.ssh > cpe1033bf982cdf-cm1033bf982cdd.cpe.net.cable.rogers.com.63513: Flags [P.], seq 10852:11040, ack 1, win 501, length 188
15:18:47.479019 IP Comp3134.ssh > cpe1033bf982cdf-cm1033bf982cdd.cpe.net.cable.rogers.com.63513: Flags [P.], seq 11040:11076, ack 1, win 501, length 36
15:18:47.479053 IP Comp3134.ssh > cpe1033bf982cdf-cm1033bf982cdd.cpe.net.cable.rogers.com.63513: Flags [P.], seq 11076:11264, ack 1, win 501, length 188
15:18:47.479079 IP Comp3134.ssh > cpe1033bf982cdf-cm1033bf982cdd.cpe.net.cable.rogers.com.63513: Flags [P.], seq 11264:11300, ack 1, win 501, length 36
15:18:47.479111 IP Comp3134.ssh > cpe1033bf982cdf-cm1033bf982cdd.cpe.net.cable.rogers.com.63513: Flags [P.], seq 11300:11488, ack 1, win 501, length 188
15:18:47.479138 IP Comp3134.ssh > cpe1033bf982cdf-cm1033bf982cdd.cpe.net.cable.rogers.com.63513: Flags [P.], seq 11488:11524, ack 1, win 501, length 36
15:18:47.479171 IP Comp3134.ssh > cpe1033bf982cdf-cm1033bf982cdd.cpe.net.cable.rogers.com.63513: Flags [P.], seq 11524:11712, ack 1, win 501, length 188
15:18:47.479199 IP Comp3134.ssh > cpe1033bf982cdf-cm1033bf982cdd.cpe.net.cable.rogers.com.63513: Flags [P.], seq 11712:11748, ack 1, win 501, length 36
15:18:47.486164 IP cpe1033bf982cdf-cm1033bf982cdd.cpe.net.cable.rogers.com.63513 > Comp3134.ssh: Flags [.], ack 8368, win 510, length 0
15:18:47.486203 IP Comp3134.ssh > cpe1033bf982cdf-cm1033bf982cdd.cpe.net.cable.rogers.com.63513: Flags [P.], seq 11748:13764, ack 1, win 501, length 2016
15:18:47.486326 IP Comp3134.ssh > cpe1033bf982cdf-cm1033bf982cdd.cpe.net.cable.rogers.com.63513: Flags [P.], seq 13764:13936, ack 1, win 501, length 172
15:18:47.486381 IP Comp3134.ssh > cpe1033bf982cdf-cm1033bf982cdd.cpe.net.cable.rogers.com.63513: Flags [P.], seq 13936:13972, ack 1, win 501, length 36
15:18:47.486415 IP Comp3134.ssh > cpe1033bf982cdf-cm1033bf982cdd.cpe.net.cable.rogers.com.63513: Flags [P.], seq 13972:14160, ack 1, win 501, length 188
15:18:47.486453 IP Comp3134.ssh > cpe1033bf982cdf-cm1033bf982cdd.cpe.net.cable.rogers.com.63513: Flags [P.], seq 14160:14196, ack 1, win 501, length 36
15:18:47.486478 IP Comp3134.ssh > cpe1033bf982cdf-cm1033bf982cdd.cpe.net.cable.rogers.com.63513: Flags [P.], seq 14196:14384, ack 1, win 501, length 188
15:18:47.486502 IP Comp3134.ssh > cpe1033bf982cdf-cm1033bf982cdd.cpe.net.cable.rogers.com.63513: Flags [P.], seq 14384:14420, ack 1, win 501, length 36
15:18:47.486546 IP Comp3134.ssh > cpe1033bf982cdf-cm1033bf982cdd.cpe.net.cable.rogers.com.63513: Flags [P.], seq 14420:14608, ack 1, win 501, length 188
15:18:47.486591 IP Comp3134.ssh > cpe1033bf982cdf-cm1033bf982cdd.cpe.net.cable.rogers.com.63513: Flags [P.], seq 14608:14644, ack 1, win 501, length 36
15:18:47.486624 IP Comp3134.ssh > cpe1033bf982cdf-cm1033bf982cdd.cpe.net.cable.rogers.com.63513: Flags [P.], seq 14644:14832, ack 1, win 501, length 188
15:18:47.486652 IP Comp3134.ssh > cpe1033bf982cdf-cm1033bf982cdd.cpe.net.cable.rogers.com.63513: Flags [P.], seq 14832:14868, ack 1, win 501, length 36
15:18:47.486685 IP Comp3134.ssh > cpe1033bf982cdf-cm1033bf982cdd.cpe.net.cable.rogers.com.63513: Flags [P.], seq 14868:15056, ack 1, win 501, length 188
15:18:47.486710 IP Comp3134.ssh > cpe1033bf982cdf-cm1033bf982cdd.cpe.net.cable.rogers.com.63513: Flags [P.], seq 15056:15092, ack 1, win 501, length 36
15:18:47.486743 IP Comp3134.ssh > cpe1033bf982cdf-cm1033bf982cdd.cpe.net.cable.rogers.com.63513: Flags [P.], seq 15092:15280, ack 1, win 501, length 188
15:18:47.486770 IP Comp3134.ssh > cpe1033bf982cdf-cm1033bf982cdd.cpe.net.cable.rogers.com.63513: Flags [P.], seq 15280:15316, ack 1, win 501, length 36
15:18:47.486803 IP Comp3134.ssh > cpe1033bf982cdf-cm1033bf982cdd.cpe.net.cable.rogers.com.63513: Flags [P.], seq 15316:15504, ack 1, win 501, length 188
15:18:47.486828 IP Comp3134.ssh > cpe1033bf982cdf-cm1033bf982cdd.cpe.net.cable.rogers.com.63513: Flags [P.], seq 15504:15540, ack 1, win 501, length 36
15:18:47.486860 IP Comp3134.ssh > cpe1033bf982cdf-cm1033bf982cdd.cpe.net.cable.rogers.com.63513: Flags [P.], seq 15540:15728, ack 1, win 501, length 188
15:18:47.486887 IP Comp3134.ssh > cpe1033bf982cdf-cm1033bf982cdd.cpe.net.cable.rogers.com.63513: Flags [P.], seq 15728:15764, ack 1, win 501, length 36
15:18:47.493309 IP cpe1033bf982cdf-cm1033bf982cdd.cpe.net.cable.rogers.com.63513 > Comp3134.ssh: Flags [.], ack 8592, win 509, length 0
15:18:47.493310 IP cpe1033bf982cdf-cm1033bf982cdd.cpe.net.cable.rogers.com.63513 > Comp3134.ssh: Flags [.], ack 11748, win 508, length 0
15:18:47.493325 IP Comp3134.ssh > cpe1033bf982cdf-cm1033bf982cdd.cpe.net.cable.rogers.com.63513: Flags [P.], seq 15764:18228, ack 1, win 501, length 2464
15:18:47.493389 IP Comp3134.ssh > cpe1033bf982cdf-cm1033bf982cdd.cpe.net.cable.rogers.com.63513: Flags [P.], seq 18228:18400, ack 1, win 501, length 172
15:18:47.493419 IP Comp3134.ssh > cpe1033bf982cdf-cm1033bf982cdd.cpe.net.cable.rogers.com.63513: Flags [P.], seq 18400:18436, ack 1, win 501, length 36
15:18:47.493452 IP Comp3134.ssh > cpe1033bf982cdf-cm1033bf982cdd.cpe.net.cable.rogers.com.63513: Flags [P.], seq 18436:18608, ack 1, win 501, length 172
15:18:47.493494 IP Comp3134.ssh > cpe1033bf982cdf-cm1033bf982cdd.cpe.net.cable.rogers.com.63513: Flags [P.], seq 18608:18832, ack 1, win 501, length 224
15:18:47.493539 IP Comp3134.ssh > cpe1033bf982cdf-cm1033bf982cdd.cpe.net.cable.rogers.com.63513: Flags [P.], seq 18832:19056, ack 1, win 501, length 224
15:18:47.493560 IP Comp3134.ssh > cpe1033bf982cdf-cm1033bf982cdd.cpe.net.cable.rogers.com.63513: Flags [P.], seq 19056:19092, ack 1, win 501, length 36
15:18:47.493586 IP Comp3134.ssh > cpe1033bf982cdf-cm1033bf982cdd.cpe.net.cable.rogers.com.63513: Flags [P.], seq 19092:19280, ack 1, win 501, length 188
15:18:47.493637 IP Comp3134.ssh > cpe1033bf982cdf-cm1033bf982cdd.cpe.net.cable.rogers.com.63513: Flags [P.], seq 19280:19540, ack 1, win 501, length 260
15:18:47.493669 IP Comp3134.ssh > cpe1033bf982cdf-cm1033bf982cdd.cpe.net.cable.rogers.com.63513: Flags [P.], seq 19540:19728, ack 1, win 501, length 188
15:18:47.493695 IP Comp3134.ssh > cpe1033bf982cdf-cm1033bf982cdd.cpe.net.cable.rogers.com.63513: Flags [P.], seq 19728:19764, ack 1, win 501, length 36
15:18:47.493721 IP Comp3134.ssh > cpe1033bf982cdf-cm1033bf982cdd.cpe.net.cable.rogers.com.63513: Flags [P.], seq 19764:19952, ack 1, win 501, length 188
15:18:47.493783 IP Comp3134.ssh > cpe1033bf982cdf-cm1033bf982cdd.cpe.net.cable.rogers.com.63513: Flags [P.], seq 19952:20176, ack 1, win 501, length 224
15:18:47.493799 IP Comp3134.ssh > cpe1033bf982cdf-cm1033bf982cdd.cpe.net.cable.rogers.com.63513: Flags [P.], seq 20176:20212, ack 1, win 501, length 36
15:18:47.493829 IP Comp3134.ssh > cpe1033bf982cdf-cm1033bf982cdd.cpe.net.cable.rogers.com.63513: Flags [P.], seq 20212:20400, ack 1, win 501, length 188
15:18:47.493863 IP Comp3134.ssh > cpe1033bf982cdf-cm1033bf982cdd.cpe.net.cable.rogers.com.63513: Flags [P.], seq 20400:20436, ack 1, win 501, length 36
15:18:47.493911 IP Comp3134.ssh > cpe1033bf982cdf-cm1033bf982cdd.cpe.net.cable.rogers.com.63513: Flags [P.], seq 20436:20624, ack 1, win 501, length 188
15:18:47.493936 IP Comp3134.ssh > cpe1033bf982cdf-cm1033bf982cdd.cpe.net.cable.rogers.com.63513: Flags [P.], seq 20624:20660, ack 1, win 501, length 36
15:18:47.493962 IP Comp3134.ssh > cpe1033bf982cdf-cm1033bf982cdd.cpe.net.cable.rogers.com.63513: Flags [P.], seq 20660:20848, ack 1, win 501, length 188
15:18:47.494014 IP Comp3134.ssh > cpe1033bf982cdf-cm1033bf982cdd.cpe.net.cable.rogers.com.63513: Flags [P.], seq 20848:21108, ack 1, win 501, length 260
15:18:47.494044 IP Comp3134.ssh > cpe1033bf982cdf-cm1033bf982cdd.cpe.net.cable.rogers.com.63513: Flags [P.], seq 21108:21296, ack 1, win 501, length 188
15:18:47.494070 IP Comp3134.ssh > cpe1033bf982cdf-cm1033bf982cdd.cpe.net.cable.rogers.com.63513: Flags [P.], seq 21296:21332, ack 1, win 501, length 36
15:18:47.494102 IP Comp3134.ssh > cpe1033bf982cdf-cm1033bf982cdd.cpe.net.cable.rogers.com.63513: Flags [P.], seq 21332:21520, ack 1, win 501, length 188
15:18:47.494128 IP Comp3134.ssh > cpe1033bf982cdf-cm1033bf982cdd.cpe.net.cable.rogers.com.63513: Flags [P.], seq 21520:21556, ack 1, win 501, length 36
15:18:47.494159 IP Comp3134.ssh > cpe1033bf982cdf-cm1033bf982cdd.cpe.net.cable.rogers.com.63513: Flags [P.], seq 21556:21744, ack 1, win 501, length 188
15:18:47.494183 IP Comp3134.ssh > cpe1033bf982cdf-cm1033bf982cdd.cpe.net.cable.rogers.com.63513: Flags [P.], seq 21744:21780, ack 1, win 501, length 36
15:18:47.494210 IP Comp3134.ssh > cpe1033bf982cdf-cm1033bf982cdd.cpe.net.cable.rogers.com.63513: Flags [P.], seq 21780:21968, ack 1, win 501, length 188
15:18:47.494260 IP Comp3134.ssh > cpe1033bf982cdf-cm1033bf982cdd.cpe.net.cable.rogers.com.63513: Flags [P.], seq 21968:22228, ack 1, win 501, length 260
15:18:47.494296 IP Comp3134.ssh > cpe1033bf982cdf-cm1033bf982cdd.cpe.net.cable.rogers.com.63513: Flags [P.], seq 22228:22416, ack 1, win 501, length 188
15:18:47.494323 IP Comp3134.ssh > cpe1033bf982cdf-cm1033bf982cdd.cpe.net.cable.rogers.com.63513: Flags [P.], seq 22416:22452, ack 1, win 501, length 36
15:18:47.494366 IP Comp3134.ssh > cpe1033bf982cdf-cm1033bf982cdd.cpe.net.cable.rogers.com.63513: Flags [P.], seq 22452:22640, ack 1, win 501, length 188
15:18:47.494389 IP Comp3134.ssh > cpe1033bf982cdf-cm1033bf982cdd.cpe.net.cable.rogers.com.63513: Flags [P.], seq 22640:22676, ack 1, win 501, length 36
15:18:47.494422 IP Comp3134.ssh > cpe1033bf982cdf-cm1033bf982cdd.cpe.net.cable.rogers.com.63513: Flags [P.], seq 22676:22864, ack 1, win 501, length 188
15:18:47.494449 IP Comp3134.ssh > cpe1033bf982cdf-cm1033bf982cdd.cpe.net.cable.rogers.com.63513: Flags [P.], seq 22864:22900, ack 1, win 501, length 36
15:18:47.494480 IP Comp3134.ssh > cpe1033bf982cdf-cm1033bf982cdd.cpe.net.cable.rogers.com.63513: Flags [P.], seq 22900:23088, ack 1, win 501, length 188
15:18:47.507413 IP cpe1033bf982cdf-cm1033bf982cdd.cpe.net.cable.rogers.com.63513 > Comp3134.ssh: Flags [.], ack 14868, win 509, length 0
15:18:47.507413 IP cpe1033bf982cdf-cm1033bf982cdd.cpe.net.cable.rogers.com.63513 > Comp3134.ssh: Flags [.], ack 20400, win 513, length 0
15:18:47.507450 IP Comp3134.ssh > cpe1033bf982cdf-cm1033bf982cdd.cpe.net.cable.rogers.com.63513: Flags [P.], seq 23088:26484, ack 1, win 501, length 3396
15:18:47.507579 IP Comp3134.ssh > cpe1033bf982cdf-cm1033bf982cdd.cpe.net.cable.rogers.com.63513: Flags [P.], seq 26484:26656, ack 1, win 501, length 172
15:18:47.507617 IP Comp3134.ssh > cpe1033bf982cdf-cm1033bf982cdd.cpe.net.cable.rogers.com.63513: Flags [P.], seq 26656:26692, ack 1, win 501, length 36
15:18:47.507654 IP Comp3134.ssh > cpe1033bf982cdf-cm1033bf982cdd.cpe.net.cable.rogers.com.63513: Flags [P.], seq 26692:26864, ack 1, win 501, length 172
15:18:47.507681 IP Comp3134.ssh > cpe1033bf982cdf-cm1033bf982cdd.cpe.net.cable.rogers.com.63513: Flags [P.], seq 26864:26900, ack 1, win 501, length 36
15:18:47.507714 IP Comp3134.ssh > cpe1033bf982cdf-cm1033bf982cdd.cpe.net.cable.rogers.com.63513: Flags [P.], seq 26900:27088, ack 1, win 501, length 188
15:18:47.507739 IP Comp3134.ssh > cpe1033bf982cdf-cm1033bf982cdd.cpe.net.cable.rogers.com.63513: Flags [P.], seq 27088:27124, ack 1, win 501, length 36
15:18:47.507771 IP Comp3134.ssh > cpe1033bf982cdf-cm1033bf982cdd.cpe.net.cable.rogers.com.63513: Flags [P.], seq 27124:27312, ack 1, win 501, length 188
15:18:47.507796 IP Comp3134.ssh > cpe1033bf982cdf-cm1033bf982cdd.cpe.net.cable.rogers.com.63513: Flags [P.], seq 27312:27348, ack 1, win 501, length 36
15:18:47.507828 IP Comp3134.ssh > cpe1033bf982cdf-cm1033bf982cdd.cpe.net.cable.rogers.com.63513: Flags [P.], seq 27348:27536, ack 1, win 501, length 188
15:18:47.507856 IP Comp3134.ssh > cpe1033bf982cdf-cm1033bf982cdd.cpe.net.cable.rogers.com.63513: Flags [P.], seq 27536:27572, ack 1, win 501, length 36
15:18:47.507889 IP Comp3134.ssh > cpe1033bf982cdf-cm1033bf982cdd.cpe.net.cable.rogers.com.63513: Flags [P.], seq 27572:27760, ack 1, win 501, length 188
15:18:47.507914 IP Comp3134.ssh > cpe1033bf982cdf-cm1033bf982cdd.cpe.net.cable.rogers.com.63513: Flags [P.], seq 27760:27796, ack 1, win 501, length 36
15:18:47.507945 IP Comp3134.ssh > cpe1033bf982cdf-cm1033bf982cdd.cpe.net.cable.rogers.com.63513: Flags [P.], seq 27796:27984, ack 1, win 501, length 188
15:18:47.507972 IP Comp3134.ssh > cpe1033bf982cdf-cm1033bf982cdd.cpe.net.cable.rogers.com.63513: Flags [P.], seq 27984:28020, ack 1, win 501, length 36
15:18:47.507999 IP Comp3134.ssh > cpe1033bf982cdf-cm1033bf982cdd.cpe.net.cable.rogers.com.63513: Flags [P.], seq 28020:28208, ack 1, win 501, length 188
15:18:47.508051 IP Comp3134.ssh > cpe1033bf982cdf-cm1033bf982cdd.cpe.net.cable.rogers.com.63513: Flags [P.], seq 28208:28468, ack 1, win 501, length 260
15:18:47.508080 IP Comp3134.ssh > cpe1033bf982cdf-cm1033bf982cdd.cpe.net.cable.rogers.com.63513: Flags [P.], seq 28468:28656, ack 1, win 501, length 188
15:18:47.508104 IP Comp3134.ssh > cpe1033bf982cdf-cm1033bf982cdd.cpe.net.cable.rogers.com.63513: Flags [P.], seq 28656:28692, ack 1, win 501, length 36
15:18:47.508136 IP Comp3134.ssh > cpe1033bf982cdf-cm1033bf982cdd.cpe.net.cable.rogers.com.63513: Flags [P.], seq 28692:28880, ack 1, win 501, length 188
15:18:47.508162 IP Comp3134.ssh > cpe1033bf982cdf-cm1033bf982cdd.cpe.net.cable.rogers.com.63513: Flags [P.], seq 28880:28916, ack 1, win 501, length 36
15:18:47.508194 IP Comp3134.ssh > cpe1033bf982cdf-cm1033bf982cdd.cpe.net.cable.rogers.com.63513: Flags [P.], seq 28916:29104, ack 1, win 501, length 188
15:18:47.508220 IP Comp3134.ssh > cpe1033bf982cdf-cm1033bf982cdd.cpe.net.cable.rogers.com.63513: Flags [P.], seq 29104:29140, ack 1, win 501, length 36
15:18:47.508252 IP Comp3134.ssh > cpe1033bf982cdf-cm1033bf982cdd.cpe.net.cable.rogers.com.63513: Flags [P.], seq 29140:29328, ack 1, win 501, length 188
15:18:47.508276 IP Comp3134.ssh > cpe1033bf982cdf-cm1033bf982cdd.cpe.net.cable.rogers.com.63513: Flags [P.], seq 29328:29364, ack 1, win 501, length 36
15:18:47.508308 IP Comp3134.ssh > cpe1033bf982cdf-cm1033bf982cdd.cpe.net.cable.rogers.com.63513: Flags [P.], seq 29364:29552, ack 1, win 501, length 188
15:18:47.508370 IP Comp3134.ssh > cpe1033bf982cdf-cm1033bf982cdd.cpe.net.cable.rogers.com.63513: Flags [P.], seq 29552:29776, ack 1, win 501, length 224
15:18:47.508419 IP Comp3134.ssh > cpe1033bf982cdf-cm1033bf982cdd.cpe.net.cable.rogers.com.63513: Flags [P.], seq 29776:29812, ack 1, win 501, length 36
15:18:47.508456 IP Comp3134.ssh > cpe1033bf982cdf-cm1033bf982cdd.cpe.net.cable.rogers.com.63513: Flags [P.], seq 29812:30000, ack 1, win 501, length 188
15:18:47.508496 IP Comp3134.ssh > cpe1033bf982cdf-cm1033bf982cdd.cpe.net.cable.rogers.com.63513: Flags [P.], seq 30000:30224, ack 1, win 501, length 224
15:18:47.508536 IP Comp3134.ssh > cpe1033bf982cdf-cm1033bf982cdd.cpe.net.cable.rogers.com.63513: Flags [P.], seq 30224:30448, ack 1, win 501, length 224
15:18:47.508562 IP Comp3134.ssh > cpe1033bf982cdf-cm1033bf982cdd.cpe.net.cable.rogers.com.63513: Flags [P.], seq 30448:30484, ack 1, win 501, length 36
15:18:47.508593 IP Comp3134.ssh > cpe1033bf982cdf-cm1033bf982cdd.cpe.net.cable.rogers.com.63513: Flags [P.], seq 30484:30672, ack 1, win 501, length 188
15:18:47.508633 IP Comp3134.ssh > cpe1033bf982cdf-cm1033bf982cdd.cpe.net.cable.rogers.com.63513: Flags [P.], seq 30672:30708, ack 1, win 501, length 36
15:18:47.508681 IP Comp3134.ssh > cpe1033bf982cdf-cm1033bf982cdd.cpe.net.cable.rogers.com.63513: Flags [P.], seq 30708:30896, ack 1, win 501, length 188
15:18:47.508718 IP Comp3134.ssh > cpe1033bf982cdf-cm1033bf982cdd.cpe.net.cable.rogers.com.63513: Flags [P.], seq 30896:30932, ack 1, win 501, length 36
15:18:47.508764 IP Comp3134.ssh > cpe1033bf982cdf-cm1033bf982cdd.cpe.net.cable.rogers.com.63513: Flags [P.], seq 30932:31120, ack 1, win 501, length 188
15:18:47.508802 IP Comp3134.ssh > cpe1033bf982cdf-cm1033bf982cdd.cpe.net.cable.rogers.com.63513: Flags [P.], seq 31120:31156, ack 1, win 501, length 36
15:18:47.508870 IP Comp3134.ssh > cpe1033bf982cdf-cm1033bf982cdd.cpe.net.cable.rogers.com.63513: Flags [P.], seq 31156:31344, ack 1, win 501, length 188
15:18:47.508901 IP Comp3134.ssh > cpe1033bf982cdf-cm1033bf982cdd.cpe.net.cable.rogers.com.63513: Flags [P.], seq 31344:31380, ack 1, win 501, length 36
15:18:47.508932 IP Comp3134.ssh > cpe1033bf982cdf-cm1033bf982cdd.cpe.net.cable.rogers.com.63513: Flags [P.], seq 31380:31568, ack 1, win 501, length 188
15:18:47.508958 IP Comp3134.ssh > cpe1033bf982cdf-cm1033bf982cdd.cpe.net.cable.rogers.com.63513: Flags [P.], seq 31568:31604, ack 1, win 501, length 36
15:18:47.508988 IP Comp3134.ssh > cpe1033bf982cdf-cm1033bf982cdd.cpe.net.cable.rogers.com.63513: Flags [P.], seq 31604:31792, ack 1, win 501, length 188
15:18:47.509011 IP Comp3134.ssh > cpe1033bf982cdf-cm1033bf982cdd.cpe.net.cable.rogers.com.63513: Flags [P.], seq 31792:31828, ack 1, win 501, length 36
15:18:47.509042 IP Comp3134.ssh > cpe1033bf982cdf-cm1033bf982cdd.cpe.net.cable.rogers.com.63513: Flags [P.], seq 31828:32016, ack 1, win 501, length 188
15:18:47.509066 IP Comp3134.ssh > cpe1033bf982cdf-cm1033bf982cdd.cpe.net.cable.rogers.com.63513: Flags [P.], seq 32016:32052, ack 1, win 501, length 36
15:18:47.509097 IP Comp3134.ssh > cpe1033bf982cdf-cm1033bf982cdd.cpe.net.cable.rogers.com.63513: Flags [P.], seq 32052:32240, ack 1, win 501, length 188
15:18:47.509122 IP Comp3134.ssh > cpe1033bf982cdf-cm1033bf982cdd.cpe.net.cable.rogers.com.63513: Flags [P.], seq 32240:32276, ack 1, win 501, length 36
15:18:47.509152 IP Comp3134.ssh > cpe1033bf982cdf-cm1033bf982cdd.cpe.net.cable.rogers.com.63513: Flags [P.], seq 32276:32464, ack 1, win 501, length 188
15:18:47.509177 IP Comp3134.ssh > cpe1033bf982cdf-cm1033bf982cdd.cpe.net.cable.rogers.com.63513: Flags [P.], seq 32464:32500, ack 1, win 501, length 36
15:18:47.509207 IP Comp3134.ssh > cpe1033bf982cdf-cm1033bf982cdd.cpe.net.cable.rogers.com.63513: Flags [P.], seq 32500:32688, ack 1, win 501, length 188
15:18:47.509254 IP Comp3134.ssh > cpe1033bf982cdf-cm1033bf982cdd.cpe.net.cable.rogers.com.63513: Flags [P.], seq 32688:32912, ack 1, win 501, length 224
15:18:47.509298 IP Comp3134.ssh > cpe1033bf982cdf-cm1033bf982cdd.cpe.net.cable.rogers.com.63513: Flags [P.], seq 32912:33136, ack 1, win 501, length 224
15:18:47.509317 IP Comp3134.ssh > cpe1033bf982cdf-cm1033bf982cdd.cpe.net.cable.rogers.com.63513: Flags [P.], seq 33136:33172, ack 1, win 501, length 36
15:18:47.509364 IP Comp3134.ssh > cpe1033bf982cdf-cm1033bf982cdd.cpe.net.cable.rogers.com.63513: Flags [P.], seq 33172:33360, ack 1, win 501, length 188
15:18:47.509389 IP Comp3134.ssh > cpe1033bf982cdf-cm1033bf982cdd.cpe.net.cable.rogers.com.63513: Flags [P.], seq 33360:33396, ack 1, win 501, length 36
15:18:47.509421 IP Comp3134.ssh > cpe1033bf982cdf-cm1033bf982cdd.cpe.net.cable.rogers.com.63513: Flags [P.], seq 33396:33584, ack 1, win 501, length 188
15:18:47.509447 IP Comp3134.ssh > cpe1033bf982cdf-cm1033bf982cdd.cpe.net.cable.rogers.com.63513: Flags [P.], seq 33584:33620, ack 1, win 501, length 36
15:18:47.509478 IP Comp3134.ssh > cpe1033bf982cdf-cm1033bf982cdd.cpe.net.cable.rogers.com.63513: Flags [P.], seq 33620:33808, ack 1, win 501, length 188
15:18:47.509504 IP Comp3134.ssh > cpe1033bf982cdf-cm1033bf982cdd.cpe.net.cable.rogers.com.63513: Flags [P.], seq 33808:33844, ack 1, win 501, length 36
15:18:47.509536 IP Comp3134.ssh > cpe1033bf982cdf-cm1033bf982cdd.cpe.net.cable.rogers.com.63513: Flags [P.], seq 33844:34032, ack 1, win 501, length 188
15:18:47.509563 IP Comp3134.ssh > cpe1033bf982cdf-cm1033bf982cdd.cpe.net.cable.rogers.com.63513: Flags [P.], seq 34032:34068, ack 1, win 501, length 36
15:18:47.509594 IP Comp3134.ssh > cpe1033bf982cdf-cm1033bf982cdd.cpe.net.cable.rogers.com.63513: Flags [P.], seq 34068:34256, ack 1, win 501, length 188
15:18:47.509619 IP Comp3134.ssh > cpe1033bf982cdf-cm1033bf982cdd.cpe.net.cable.rogers.com.63513: Flags [P.], seq 34256:34292, ack 1, win 501, length 36
15:18:47.509652 IP Comp3134.ssh > cpe1033bf982cdf-cm1033bf982cdd.cpe.net.cable.rogers.com.63513: Flags [P.], seq 34292:34480, ack 1, win 501, length 188
15:18:47.509707 IP Comp3134.ssh > cpe1033bf982cdf-cm1033bf982cdd.cpe.net.cable.rogers.com.63513: Flags [P.], seq 34516:34704, ack 1, win 501, length 188
15:18:47.509776 IP Comp3134.ssh > cpe1033bf982cdf-cm1033bf982cdd.cpe.net.cable.rogers.com.63513: Flags [P.], seq 34740:34928, ack 1, win 501, length 188
15:18:47.516432 IP cpe1033bf982cdf-cm1033bf982cdd.cpe.net.cable.rogers.com.63513 > Comp3134.ssh: Flags [.], ack 23088, win 512, length 0
15:18:47.516460 IP Comp3134.ssh > cpe1033bf982cdf-cm1033bf982cdd.cpe.net.cable.rogers.com.63513: Flags [P.], seq 34964:40476, ack 1, win 501, length 5512
15:18:47.516544 IP Comp3134.ssh > cpe1033bf982cdf-cm1033bf982cdd.cpe.net.cable.rogers.com.63513: Flags [P.], seq 40476:40648, ack 1, win 501, length 172
15:18:47.516576 IP Comp3134.ssh > cpe1033bf982cdf-cm1033bf982cdd.cpe.net.cable.rogers.com.63513: Flags [P.], seq 40648:40684, ack 1, win 501, length 36
15:18:47.516636 IP Comp3134.ssh > cpe1033bf982cdf-cm1033bf982cdd.cpe.net.cable.rogers.com.63513: Flags [P.], seq 40684:40872, ack 1, win 501, length 188
15:18:47.516676 IP Comp3134.ssh > cpe1033bf982cdf-cm1033bf982cdd.cpe.net.cable.rogers.com.63513: Flags [P.], seq 40872:40908, ack 1, win 501, length 36
15:18:47.516735 IP Comp3134.ssh > cpe1033bf982cdf-cm1033bf982cdd.cpe.net.cable.rogers.com.63513: Flags [P.], seq 40908:41248, ack 1, win 501, length 340
15:18:47.516830 IP Comp3134.ssh > cpe1033bf982cdf-cm1033bf982cdd.cpe.net.cable.rogers.com.63513: Flags [P.], seq 41248:41748, ack 1, win 501, length 500
15:18:47.516876 IP Comp3134.ssh > cpe1033bf982cdf-cm1033bf982cdd.cpe.net.cable.rogers.com.63513: Flags [P.], seq 41748:41936, ack 1, win 501, length 188
15:18:47.516912 IP Comp3134.ssh > cpe1033bf982cdf-cm1033bf982cdd.cpe.net.cable.rogers.com.63513: Flags [P.], seq 41936:42124, ack 1, win 501, length 188
15:18:47.516948 IP Comp3134.ssh > cpe1033bf982cdf-cm1033bf982cdd.cpe.net.cable.rogers.com.63513: Flags [P.], seq 42124:42312, ack 1, win 501, length 188
15:18:47.516985 IP Comp3134.ssh > cpe1033bf982cdf-cm1033bf982cdd.cpe.net.cable.rogers.com.63513: Flags [P.], seq 42312:42500, ack 1, win 501, length 188
15:18:47.517022 IP Comp3134.ssh > cpe1033bf982cdf-cm1033bf982cdd.cpe.net.cable.rogers.com.63513: Flags [P.], seq 42500:42688, ack 1, win 501, length 188
15:18:47.517061 IP Comp3134.ssh > cpe1033bf982cdf-cm1033bf982cdd.cpe.net.cable.rogers.com.63513: Flags [P.], seq 42688:42876, ack 1, win 501, length 188
15:18:47.517120 IP Comp3134.ssh > cpe1033bf982cdf-cm1033bf982cdd.cpe.net.cable.rogers.com.63513: Flags [P.], seq 42876:43064, ack 1, win 501, length 188
15:18:47.517180 IP Comp3134.ssh > cpe1033bf982cdf-cm1033bf982cdd.cpe.net.cable.rogers.com.63513: Flags [P.], seq 43064:43252, ack 1, win 501, length 188
15:18:47.517218 IP Comp3134.ssh > cpe1033bf982cdf-cm1033bf982cdd.cpe.net.cable.rogers.com.63513: Flags [P.], seq 43252:43440, ack 1, win 501, length 188
15:18:47.517255 IP Comp3134.ssh > cpe1033bf982cdf-cm1033bf982cdd.cpe.net.cable.rogers.com.63513: Flags [P.], seq 43440:43628, ack 1, win 501, length 188
15:18:47.517293 IP Comp3134.ssh > cpe1033bf982cdf-cm1033bf982cdd.cpe.net.cable.rogers.com.63513: Flags [P.], seq 43628:43816, ack 1, win 501, length 188
15:18:47.517304 IP 218.92.0.133.6488 > Comp3134.ssh: Flags [S], seq 2333573355, win 14600, options [mss 1460,sackOK,TS val 3911572903 ecr 0,nop,wscale 7], length 0
15:18:47.517320 IP Comp3134.ssh > 218.92.0.133.6488: Flags [S.], seq 1654358565, ack 2333573356, win 65160, options [mss 1460,sackOK,TS val 3122839862 ecr 3911571903,nop,wscale 7], length 0
15:18:47.517648 IP Comp3134.41332 > 67.207.67.2.domain: 60530+ [1au] PTR? 133.0.92.218.in-addr.arpa. (54)
15:18:47.517697 IP Comp3134.47825 > 67.207.67.2.domain: 15012+ [1au] PTR? 133.0.92.218.in-addr.arpa. (54)
15:18:47.517749 IP Comp3134.ssh > cpe1033bf982cdf-cm1033bf982cdd.cpe.net.cable.rogers.com.63513: Flags [P.], seq 43816:44004, ack 1, win 501, length 188
15:18:47.517867 IP 67.207.67.2.domain > Comp3134.41332: 60530 NXDomain 0/1/1 (103)
15:18:47.517867 IP 67.207.67.2.domain > Comp3134.47825: 15012 NXDomain 0/1/1 (103)
15:18:47.517932 IP Comp3134.41332 > 67.207.67.2.domain: 60530+ PTR? 133.0.92.218.in-addr.arpa. (43)
15:18:47.517975 IP Comp3134.47825 > 67.207.67.2.domain: 15012+ PTR? 133.0.92.218.in-addr.arpa. (43)
15:18:47.518053 IP 67.207.67.2.domain > Comp3134.41332: 60530 NXDomain 0/1/0 (92)
15:18:47.518084 IP 67.207.67.2.domain > Comp3134.47825: 15012 NXDomain 0/1/0 (92)
15:18:47.518514 IP Comp3134.ssh > cpe1033bf982cdf-cm1033bf982cdd.cpe.net.cable.rogers.com.63513: Flags [P.], seq 44004:44208, ack 1, win 501, length 204
15:18:47.518555 IP Comp3134.ssh > cpe1033bf982cdf-cm1033bf982cdd.cpe.net.cable.rogers.com.63513: Flags [P.], seq 44208:44244, ack 1, win 501, length 36
15:18:47.518594 IP Comp3134.ssh > cpe1033bf982cdf-cm1033bf982cdd.cpe.net.cable.rogers.com.63513: Flags [P.], seq 44244:44472, ack 1, win 501, length 228
15:18:47.518635 IP Comp3134.ssh > cpe1033bf982cdf-cm1033bf982cdd.cpe.net.cable.rogers.com.63513: Flags [P.], seq 44472:44620, ack 1, win 501, length 148
15:18:47.518689 IP Comp3134.ssh > cpe1033bf982cdf-cm1033bf982cdd.cpe.net.cable.rogers.com.63513: Flags [P.], seq 44620:45000, ack 1, win 501, length 380
15:18:47.518742 IP Comp3134.ssh > cpe1033bf982cdf-cm1033bf982cdd.cpe.net.cable.rogers.com.63513: Flags [P.], seq 45000:45324, ack 1, win 501, length 324
15:18:47.518792 IP Comp3134.ssh > cpe1033bf982cdf-cm1033bf982cdd.cpe.net.cable.rogers.com.63513: Flags [P.], seq 45324:45680, ack 1, win 501, length 356
15:18:47.518842 IP Comp3134.ssh > cpe1033bf982cdf-cm1033bf982cdd.cpe.net.cable.rogers.com.63513: Flags [P.], seq 45680:46180, ack 1, win 501, length 500
15:18:47.518897 IP Comp3134.ssh > cpe1033bf982cdf-cm1033bf982cdd.cpe.net.cable.rogers.com.63513: Flags [P.], seq 46180:46832, ack 1, win 501, length 652
15:18:47.518937 IP Comp3134.ssh > cpe1033bf982cdf-cm1033bf982cdd.cpe.net.cable.rogers.com.63513: Flags [P.], seq 46832:47028, ack 1, win 501, length 196
15:18:47.518975 IP Comp3134.ssh > cpe1033bf982cdf-cm1033bf982cdd.cpe.net.cable.rogers.com.63513: Flags [P.], seq 47028:47216, ack 1, win 501, length 188
15:18:47.519012 IP Comp3134.ssh > cpe1033bf982cdf-cm1033bf982cdd.cpe.net.cable.rogers.com.63513: Flags [P.], seq 47216:47404, ack 1, win 501, length 188
15:18:47.519050 IP Comp3134.ssh > cpe1033bf982cdf-cm1033bf982cdd.cpe.net.cable.rogers.com.63513: Flags [P.], seq 47404:47592, ack 1, win 501, length 188
15:18:47.519087 IP Comp3134.ssh > cpe1033bf982cdf-cm1033bf982cdd.cpe.net.cable.rogers.com.63513: Flags [P.], seq 47592:47780, ack 1, win 501, length 188
15:18:47.519124 IP Comp3134.ssh > cpe1033bf982cdf-cm1033bf982cdd.cpe.net.cable.rogers.com.63513: Flags [P.], seq 47780:47968, ack 1, win 501, length 188
15:18:47.519161 IP Comp3134.ssh > cpe1033bf982cdf-cm1033bf982cdd.cpe.net.cable.rogers.com.63513: Flags [P.], seq 47968:48156, ack 1, win 501, length 188
15:18:47.519199 IP Comp3134.ssh > cpe1033bf982cdf-cm1033bf982cdd.cpe.net.cable.rogers.com.63513: Flags [P.], seq 48156:48344, ack 1, win 501, length 188
15:18:47.519236 IP Comp3134.ssh > cpe1033bf982cdf-cm1033bf982cdd.cpe.net.cable.rogers.com.63513: Flags [P.], seq 48344:48532, ack 1, win 501, length 188
15:18:47.527921 IP cpe1033bf982cdf-cm1033bf982cdd.cpe.net.cable.rogers.com.63513 > Comp3134.ssh: Flags [.], ack 32912, win 508, length 0
15:18:47.527964 IP Comp3134.ssh > cpe1033bf982cdf-cm1033bf982cdd.cpe.net.cable.rogers.com.63513: Flags [P.], seq 48532:48720, ack 1, win 501, length 188
15:18:47.527976 IP cpe1033bf982cdf-cm1033bf982cdd.cpe.net.cable.rogers.com.63513 > Comp3134.ssh: Flags [.], ack 44004, win 508, length 0
15:18:47.528067 IP Comp3134.ssh > cpe1033bf982cdf-cm1033bf982cdd.cpe.net.cable.rogers.com.63513: Flags [P.], seq 48720:49188, ack 1, win 501, length 468
15:18:47.528124 IP Comp3134.ssh > cpe1033bf982cdf-cm1033bf982cdd.cpe.net.cable.rogers.com.63513: Flags [P.], seq 49188:49376, ack 1, win 501, length 188
15:18:47.528179 IP Comp3134.ssh > cpe1033bf982cdf-cm1033bf982cdd.cpe.net.cable.rogers.com.63513: Flags [P.], seq 49376:49564, ack 1, win 501, length 188
15:18:47.528217 IP Comp3134.ssh > cpe1033bf982cdf-cm1033bf982cdd.cpe.net.cable.rogers.com.63513: Flags [P.], seq 49564:49752, ack 1, win 501, length 188
15:18:47.528266 IP Comp3134.ssh > cpe1033bf982cdf-cm1033bf982cdd.cpe.net.cable.rogers.com.63513: Flags [P.], seq 49752:49940, ack 1, win 501, length 188
15:18:47.528328 IP Comp3134.ssh > cpe1033bf982cdf-cm1033bf982cdd.cpe.net.cable.rogers.com.63513: Flags [P.], seq 49940:50128, ack 1, win 501, length 188
15:18:47.528426 IP Comp3134.ssh > cpe1033bf982cdf-cm1033bf982cdd.cpe.net.cable.rogers.com.63513: Flags [P.], seq 50128:50316, ack 1, win 501, length 188
15:18:47.528511 IP Comp3134.ssh > cpe1033bf982cdf-cm1033bf982cdd.cpe.net.cable.rogers.com.63513: Flags [P.], seq 50316:50504, ack 1, win 501, length 188
15:18:47.528553 IP Comp3134.ssh > cpe1033bf982cdf-cm1033bf982cdd.cpe.net.cable.rogers.com.63513: Flags [P.], seq 50504:50692, ack 1, win 501, length 188
15:18:47.528592 IP Comp3134.ssh > cpe1033bf982cdf-cm1033bf982cdd.cpe.net.cable.rogers.com.63513: Flags [P.], seq 50692:50880, ack 1, win 501, length 188
15:18:47.528641 IP Comp3134.ssh > cpe1033bf982cdf-cm1033bf982cdd.cpe.net.cable.rogers.com.63513: Flags [P.], seq 50880:51068, ack 1, win 501, length 188
15:18:47.528679 IP Comp3134.ssh > cpe1033bf982cdf-cm1033bf982cdd.cpe.net.cable.rogers.com.63513: Flags [P.], seq 51068:51256, ack 1, win 501, length 188
15:18:47.528717 IP Comp3134.ssh > cpe1033bf982cdf-cm1033bf982cdd.cpe.net.cable.rogers.com.63513: Flags [P.], seq 51256:51444, ack 1, win 501, length 188
15:18:47.528755 IP Comp3134.ssh > cpe1033bf982cdf-cm1033bf982cdd.cpe.net.cable.rogers.com.63513: Flags [P.], seq 51444:51632, ack 1, win 501, length 188
15:18:47.528792 IP Comp3134.ssh > cpe1033bf982cdf-cm1033bf982cdd.cpe.net.cable.rogers.com.63513: Flags [P.], seq 51632:51820, ack 1, win 501, length 188
15:18:47.528841 IP Comp3134.ssh > cpe1033bf982cdf-cm1033bf982cdd.cpe.net.cable.rogers.com.63513: Flags [P.], seq 51820:52008, ack 1, win 501, length 188
15:18:47.528878 IP Comp3134.ssh > cpe1033bf982cdf-cm1033bf982cdd.cpe.net.cable.rogers.com.63513: Flags [P.], seq 52008:52196, ack 1, win 501, length 188
15:18:47.528915 IP Comp3134.ssh > cpe1033bf982cdf-cm1033bf982cdd.cpe.net.cable.rogers.com.63513: Flags [P.], seq 52196:52384, ack 1, win 501, length 188
15:18:47.528951 IP Comp3134.ssh > cpe1033bf982cdf-cm1033bf982cdd.cpe.net.cable.rogers.com.63513: Flags [P.], seq 52384:52572, ack 1, win 501, length 188
15:18:47.528988 IP Comp3134.ssh > cpe1033bf982cdf-cm1033bf982cdd.cpe.net.cable.rogers.com.63513: Flags [P.], seq 52572:52760, ack 1, win 501, length 188
15:18:47.529024 IP Comp3134.ssh > cpe1033bf982cdf-cm1033bf982cdd.cpe.net.cable.rogers.com.63513: Flags [P.], seq 52760:52948, ack 1, win 501, length 188
15:18:47.529060 IP Comp3134.ssh > cpe1033bf982cdf-cm1033bf982cdd.cpe.net.cable.rogers.com.63513: Flags [P.], seq 52948:53136, ack 1, win 501, length 188
15:18:47.529097 IP Comp3134.ssh > cpe1033bf982cdf-cm1033bf982cdd.cpe.net.cable.rogers.com.63513: Flags [P.], seq 53136:53324, ack 1, win 501, length 188
15:18:47.529133 IP Comp3134.ssh > cpe1033bf982cdf-cm1033bf982cdd.cpe.net.cable.rogers.com.63513: Flags [P.], seq 53324:53512, ack 1, win 501, length 188
15:18:47.529170 IP Comp3134.ssh > cpe1033bf982cdf-cm1033bf982cdd.cpe.net.cable.rogers.com.63513: Flags [P.], seq 53512:53700, ack 1, win 501, length 188
15:18:47.529206 IP Comp3134.ssh > cpe1033bf982cdf-cm1033bf982cdd.cpe.net.cable.rogers.com.63513: Flags [P.], seq 53700:53888, ack 1, win 501, length 188
15:18:47.529242 IP Comp3134.ssh > cpe1033bf982cdf-cm1033bf982cdd.cpe.net.cable.rogers.com.63513: Flags [P.], seq 53888:54076, ack 1, win 501, length 188
15:18:47.529278 IP Comp3134.ssh > cpe1033bf982cdf-cm1033bf982cdd.cpe.net.cable.rogers.com.63513: Flags [P.], seq 54076:54264, ack 1, win 501, length 188
15:18:47.529315 IP Comp3134.ssh > cpe1033bf982cdf-cm1033bf982cdd.cpe.net.cable.rogers.com.63513: Flags [P.], seq 54264:54452, ack 1, win 501, length 188
15:18:47.529351 IP Comp3134.ssh > cpe1033bf982cdf-cm1033bf982cdd.cpe.net.cable.rogers.com.63513: Flags [P.], seq 54452:54640, ack 1, win 501, length 188
