15:24:37.918955 IP 143.110.216.40.22 > 99.228.88.180.65054: Flags [P.], seq 5895200:5895364, ack 3061, win 501, length 164
15:24:37.918991 IP 143.110.216.40.22 > 99.228.88.180.65054: Flags [P.], seq 5895364:5895528, ack 3061, win 501, length 164
15:24:37.919026 IP 143.110.216.40.22 > 99.228.88.180.65054: Flags [P.], seq 5895528:5895692, ack 3061, win 501, length 164
15:24:37.919062 IP 143.110.216.40.22 > 99.228.88.180.65054: Flags [P.], seq 5895692:5895856, ack 3061, win 501, length 164
15:24:37.919095 IP 143.110.216.40.22 > 99.228.88.180.65054: Flags [P.], seq 5895856:5896020, ack 3061, win 501, length 164
15:24:37.919133 IP 143.110.216.40.22 > 99.228.88.180.65054: Flags [P.], seq 5896020:5896184, ack 3061, win 501, length 164
15:24:37.919168 IP 143.110.216.40.22 > 99.228.88.180.65054: Flags [P.], seq 5896184:5896348, ack 3061, win 501, length 164
15:24:37.919204 IP 143.110.216.40.22 > 99.228.88.180.65054: Flags [P.], seq 5896348:5896512, ack 3061, win 501, length 164
15:24:37.919237 IP 143.110.216.40.22 > 99.228.88.180.65054: Flags [P.], seq 5896512:5896676, ack 3061, win 501, length 164
15:24:37.919274 IP 143.110.216.40.22 > 99.228.88.180.65054: Flags [P.], seq 5896676:5896840, ack 3061, win 501, length 164
15:24:37.919307 IP 143.110.216.40.22 > 99.228.88.180.65054: Flags [P.], seq 5896840:5897004, ack 3061, win 501, length 164
15:24:37.919340 IP 143.110.216.40.22 > 99.228.88.180.65054: Flags [P.], seq 5897004:5897168, ack 3061, win 501, length 164
15:24:37.919377 IP 143.110.216.40.22 > 99.228.88.180.65054: Flags [P.], seq 5897168:5897332, ack 3061, win 501, length 164
15:24:37.919411 IP 143.110.216.40.22 > 99.228.88.180.65054: Flags [P.], seq 5897332:5897496, ack 3061, win 501, length 164
15:24:37.919448 IP 143.110.216.40.22 > 99.228.88.180.65054: Flags [P.], seq 5897496:5897660, ack 3061, win 501, length 164
15:24:37.919488 IP 143.110.216.40.22 > 99.228.88.180.65054: Flags [P.], seq 5897660:5897824, ack 3061, win 501, length 164
15:24:37.919522 IP 143.110.216.40.22 > 99.228.88.180.65054: Flags [P.], seq 5897824:5897988, ack 3061, win 501, length 164
15:24:37.919556 IP 143.110.216.40.22 > 99.228.88.180.65054: Flags [P.], seq 5897988:5898152, ack 3061, win 501, length 164
15:24:37.919590 IP 143.110.216.40.22 > 99.228.88.180.65054: Flags [P.], seq 5898152:5898316, ack 3061, win 501, length 164
15:24:37.919624 IP 143.110.216.40.22 > 99.228.88.180.65054: Flags [P.], seq 5898316:5898480, ack 3061, win 501, length 164
15:24:37.929569 IP 99.228.88.180.65054 > 143.110.216.40.22: Flags [.], ack 5725536, win 16501, length 0
15:24:37.929642 IP 143.110.216.40.22 > 99.228.88.180.65054: Flags [P.], seq 5898480:5898644, ack 3061, win 501, length 164
15:24:37.929774 IP 143.110.216.40.22 > 99.228.88.180.65054: Flags [P.], seq 5898644:5898912, ack 3061, win 501, length 268
15:24:37.929821 IP 143.110.216.40.22 > 99.228.88.180.65054: Flags [P.], seq 5898912:5899076, ack 3061, win 501, length 164
15:24:37.929860 IP 143.110.216.40.22 > 99.228.88.180.65054: Flags [P.], seq 5899076:5899240, ack 3061, win 501, length 164
15:24:37.929898 IP 143.110.216.40.22 > 99.228.88.180.65054: Flags [P.], seq 5899240:5899404, ack 3061, win 501, length 164
15:24:37.929936 IP 143.110.216.40.22 > 99.228.88.180.65054: Flags [P.], seq 5899404:5899568, ack 3061, win 501, length 164
15:24:37.929974 IP 143.110.216.40.22 > 99.228.88.180.65054: Flags [P.], seq 5899568:5899732, ack 3061, win 501, length 164
15:24:37.930011 IP 143.110.216.40.22 > 99.228.88.180.65054: Flags [P.], seq 5899732:5899896, ack 3061, win 501, length 164
15:24:37.930049 IP 143.110.216.40.22 > 99.228.88.180.65054: Flags [P.], seq 5899896:5900060, ack 3061, win 501, length 164
15:24:37.930087 IP 143.110.216.40.22 > 99.228.88.180.65054: Flags [P.], seq 5900060:5900224, ack 3061, win 501, length 164
15:24:37.930124 IP 143.110.216.40.22 > 99.228.88.180.65054: Flags [P.], seq 5900224:5900388, ack 3061, win 501, length 164
15:24:37.930161 IP 143.110.216.40.22 > 99.228.88.180.65054: Flags [P.], seq 5900388:5900552, ack 3061, win 501, length 164
15:24:37.930199 IP 143.110.216.40.22 > 99.228.88.180.65054: Flags [P.], seq 5900552:5900716, ack 3061, win 501, length 164
15:24:37.930236 IP 143.110.216.40.22 > 99.228.88.180.65054: Flags [P.], seq 5900716:5900880, ack 3061, win 501, length 164
15:24:37.930286 IP 143.110.216.40.22 > 99.228.88.180.65054: Flags [P.], seq 5900880:5901044, ack 3061, win 501, length 164
15:24:37.930322 IP 143.110.216.40.22 > 99.228.88.180.65054: Flags [P.], seq 5901044:5901208, ack 3061, win 501, length 164
15:24:37.930358 IP 143.110.216.40.22 > 99.228.88.180.65054: Flags [P.], seq 5901208:5901372, ack 3061, win 501, length 164
15:24:37.930395 IP 143.110.216.40.22 > 99.228.88.180.65054: Flags [P.], seq 5901372:5901536, ack 3061, win 501, length 164
15:24:37.930431 IP 143.110.216.40.22 > 99.228.88.180.65054: Flags [P.], seq 5901536:5901700, ack 3061, win 501, length 164
15:24:37.930467 IP 143.110.216.40.22 > 99.228.88.180.65054: Flags [P.], seq 5901700:5901864, ack 3061, win 501, length 164
15:24:37.930504 IP 143.110.216.40.22 > 99.228.88.180.65054: Flags [P.], seq 5901864:5902028, ack 3061, win 501, length 164
15:24:37.930540 IP 143.110.216.40.22 > 99.228.88.180.65054: Flags [P.], seq 5902028:5902192, ack 3061, win 501, length 164
15:24:37.930575 IP 143.110.216.40.22 > 99.228.88.180.65054: Flags [P.], seq 5902192:5902356, ack 3061, win 501, length 164
15:24:37.930611 IP 143.110.216.40.22 > 99.228.88.180.65054: Flags [P.], seq 5902356:5902520, ack 3061, win 501, length 164
15:24:37.930646 IP 143.110.216.40.22 > 99.228.88.180.65054: Flags [P.], seq 5902520:5902684, ack 3061, win 501, length 164
15:24:37.930683 IP 143.110.216.40.22 > 99.228.88.180.65054: Flags [P.], seq 5902684:5902848, ack 3061, win 501, length 164
15:24:37.930718 IP 143.110.216.40.22 > 99.228.88.180.65054: Flags [P.], seq 5902848:5903012, ack 3061, win 501, length 164
15:24:37.930755 IP 143.110.216.40.22 > 99.228.88.180.65054: Flags [P.], seq 5903012:5903176, ack 3061, win 501, length 164
15:24:37.930788 IP 143.110.216.40.22 > 99.228.88.180.65054: Flags [P.], seq 5903176:5903340, ack 3061, win 501, length 164
15:24:37.930836 IP 143.110.216.40.22 > 99.228.88.180.65054: Flags [P.], seq 5903340:5903504, ack 3061, win 501, length 164
15:24:37.930867 IP 143.110.216.40.22 > 99.228.88.180.65054: Flags [P.], seq 5903504:5903668, ack 3061, win 501, length 164
15:24:37.930899 IP 143.110.216.40.22 > 99.228.88.180.65054: Flags [P.], seq 5903668:5903832, ack 3061, win 501, length 164
15:24:37.930949 IP 143.110.216.40.22 > 99.228.88.180.65054: Flags [P.], seq 5903832:5903996, ack 3061, win 501, length 164
15:24:37.930985 IP 143.110.216.40.22 > 99.228.88.180.65054: Flags [P.], seq 5903996:5904160, ack 3061, win 501, length 164
15:24:37.931021 IP 143.110.216.40.22 > 99.228.88.180.65054: Flags [P.], seq 5904160:5904324, ack 3061, win 501, length 164
15:24:37.931054 IP 143.110.216.40.22 > 99.228.88.180.65054: Flags [P.], seq 5904324:5904488, ack 3061, win 501, length 164
15:24:37.931090 IP 143.110.216.40.22 > 99.228.88.180.65054: Flags [P.], seq 5904488:5904652, ack 3061, win 501, length 164
15:24:37.931123 IP 143.110.216.40.22 > 99.228.88.180.65054: Flags [P.], seq 5904652:5904816, ack 3061, win 501, length 164
15:24:37.931159 IP 143.110.216.40.22 > 99.228.88.180.65054: Flags [P.], seq 5904816:5904980, ack 3061, win 501, length 164
15:24:37.931195 IP 143.110.216.40.22 > 99.228.88.180.65054: Flags [P.], seq 5904980:5905144, ack 3061, win 501, length 164
15:24:37.931228 IP 143.110.216.40.22 > 99.228.88.180.65054: Flags [P.], seq 5905144:5905308, ack 3061, win 501, length 164
15:24:37.931264 IP 143.110.216.40.22 > 99.228.88.180.65054: Flags [P.], seq 5905308:5905472, ack 3061, win 501, length 164
15:24:37.931298 IP 143.110.216.40.22 > 99.228.88.180.65054: Flags [P.], seq 5905472:5905636, ack 3061, win 501, length 164
15:24:37.931334 IP 143.110.216.40.22 > 99.228.88.180.65054: Flags [P.], seq 5905636:5905800, ack 3061, win 501, length 164
15:24:37.931367 IP 143.110.216.40.22 > 99.228.88.180.65054: Flags [P.], seq 5905800:5905964, ack 3061, win 501, length 164
15:24:37.931403 IP 143.110.216.40.22 > 99.228.88.180.65054: Flags [P.], seq 5905964:5906128, ack 3061, win 501, length 164
15:24:37.931436 IP 143.110.216.40.22 > 99.228.88.180.65054: Flags [P.], seq 5906128:5906292, ack 3061, win 501, length 164
15:24:37.931472 IP 143.110.216.40.22 > 99.228.88.180.65054: Flags [P.], seq 5906292:5906456, ack 3061, win 501, length 164
15:24:37.931507 IP 143.110.216.40.22 > 99.228.88.180.65054: Flags [P.], seq 5906456:5906620, ack 3061, win 501, length 164
15:24:37.931543 IP 143.110.216.40.22 > 99.228.88.180.65054: Flags [P.], seq 5906620:5906784, ack 3061, win 501, length 164
15:24:37.931576 IP 143.110.216.40.22 > 99.228.88.180.65054: Flags [P.], seq 5906784:5906948, ack 3061, win 501, length 164
15:24:37.931610 IP 143.110.216.40.22 > 99.228.88.180.65054: Flags [P.], seq 5906948:5907112, ack 3061, win 501, length 164
15:24:37.931647 IP 143.110.216.40.22 > 99.228.88.180.65054: Flags [P.], seq 5907112:5907276, ack 3061, win 501, length 164
15:24:37.931680 IP 143.110.216.40.22 > 99.228.88.180.65054: Flags [P.], seq 5907276:5907440, ack 3061, win 501, length 164
15:24:37.931716 IP 143.110.216.40.22 > 99.228.88.180.65054: Flags [P.], seq 5907440:5907604, ack 3061, win 501, length 164
15:24:37.931749 IP 143.110.216.40.22 > 99.228.88.180.65054: Flags [P.], seq 5907604:5907768, ack 3061, win 501, length 164
15:24:37.931785 IP 143.110.216.40.22 > 99.228.88.180.65054: Flags [P.], seq 5907768:5907932, ack 3061, win 501, length 164
15:24:37.931818 IP 143.110.216.40.22 > 99.228.88.180.65054: Flags [P.], seq 5907932:5908096, ack 3061, win 501, length 164
15:24:37.931854 IP 143.110.216.40.22 > 99.228.88.180.65054: Flags [P.], seq 5908096:5908260, ack 3061, win 501, length 164
15:24:37.931889 IP 143.110.216.40.22 > 99.228.88.180.65054: Flags [P.], seq 5908260:5908424, ack 3061, win 501, length 164
15:24:37.931925 IP 143.110.216.40.22 > 99.228.88.180.65054: Flags [P.], seq 5908424:5908588, ack 3061, win 501, length 164
15:24:37.931959 IP 143.110.216.40.22 > 99.228.88.180.65054: Flags [P.], seq 5908588:5908752, ack 3061, win 501, length 164
15:24:37.932005 IP 143.110.216.40.22 > 99.228.88.180.65054: Flags [P.], seq 5908752:5908916, ack 3061, win 501, length 164
15:24:37.932054 IP 143.110.216.40.22 > 99.228.88.180.65054: Flags [P.], seq 5908916:5909080, ack 3061, win 501, length 164
15:24:37.932104 IP 143.110.216.40.22 > 99.228.88.180.65054: Flags [P.], seq 5909080:5909244, ack 3061, win 501, length 164
15:24:37.932135 IP 143.110.216.40.22 > 99.228.88.180.65054: Flags [P.], seq 5909244:5909408, ack 3061, win 501, length 164
15:24:37.932166 IP 143.110.216.40.22 > 99.228.88.180.65054: Flags [P.], seq 5909408:5909572, ack 3061, win 501, length 164
15:24:37.932198 IP 143.110.216.40.22 > 99.228.88.180.65054: Flags [P.], seq 5909572:5909736, ack 3061, win 501, length 164
15:24:37.932229 IP 143.110.216.40.22 > 99.228.88.180.65054: Flags [P.], seq 5909736:5909900, ack 3061, win 501, length 164
15:24:37.932260 IP 143.110.216.40.22 > 99.228.88.180.65054: Flags [P.], seq 5909900:5910064, ack 3061, win 501, length 164
15:24:37.932291 IP 143.110.216.40.22 > 99.228.88.180.65054: Flags [P.], seq 5910064:5910228, ack 3061, win 501, length 164
15:24:37.932324 IP 143.110.216.40.22 > 99.228.88.180.65054: Flags [P.], seq 5910228:5910392, ack 3061, win 501, length 164
15:24:37.932357 IP 143.110.216.40.22 > 99.228.88.180.65054: Flags [P.], seq 5910392:5910556, ack 3061, win 501, length 164
15:24:37.932387 IP 143.110.216.40.22 > 99.228.88.180.65054: Flags [P.], seq 5910556:5910720, ack 3061, win 501, length 164
15:24:37.932421 IP 143.110.216.40.22 > 99.228.88.180.65054: Flags [P.], seq 5910720:5910884, ack 3061, win 501, length 164
15:24:37.932451 IP 143.110.216.40.22 > 99.228.88.180.65054: Flags [P.], seq 5910884:5911048, ack 3061, win 501, length 164
15:24:37.932484 IP 143.110.216.40.22 > 99.228.88.180.65054: Flags [P.], seq 5911048:5911212, ack 3061, win 501, length 164
15:24:37.932515 IP 143.110.216.40.22 > 99.228.88.180.65054: Flags [P.], seq 5911212:5911376, ack 3061, win 501, length 164
15:24:37.932548 IP 143.110.216.40.22 > 99.228.88.180.65054: Flags [P.], seq 5911376:5911540, ack 3061, win 501, length 164
15:24:37.932579 IP 143.110.216.40.22 > 99.228.88.180.65054: Flags [P.], seq 5911540:5911704, ack 3061, win 501, length 164
15:24:37.932622 IP 143.110.216.40.22 > 99.228.88.180.65054: Flags [P.], seq 5911704:5911868, ack 3061, win 501, length 164
15:24:37.932674 IP 143.110.216.40.22 > 99.228.88.180.65054: Flags [P.], seq 5911868:5912032, ack 3061, win 501, length 164
15:24:37.932710 IP 143.110.216.40.22 > 99.228.88.180.65054: Flags [P.], seq 5912032:5912196, ack 3061, win 501, length 164
15:24:37.932746 IP 143.110.216.40.22 > 99.228.88.180.65054: Flags [P.], seq 5912196:5912360, ack 3061, win 501, length 164
15:24:37.932779 IP 143.110.216.40.22 > 99.228.88.180.65054: Flags [P.], seq 5912360:5912524, ack 3061, win 501, length 164
15:24:37.932815 IP 143.110.216.40.22 > 99.228.88.180.65054: Flags [P.], seq 5912524:5912688, ack 3061, win 501, length 164
15:24:37.932848 IP 143.110.216.40.22 > 99.228.88.180.65054: Flags [P.], seq 5912688:5912852, ack 3061, win 501, length 164
15:24:37.932884 IP 143.110.216.40.22 > 99.228.88.180.65054: Flags [P.], seq 5912852:5913016, ack 3061, win 501, length 164
15:24:37.932917 IP 143.110.216.40.22 > 99.228.88.180.65054: Flags [P.], seq 5913016:5913180, ack 3061, win 501, length 164
15:24:37.932952 IP 143.110.216.40.22 > 99.228.88.180.65054: Flags [P.], seq 5913180:5913344, ack 3061, win 501, length 164
15:24:37.932985 IP 143.110.216.40.22 > 99.228.88.180.65054: Flags [P.], seq 5913344:5913508, ack 3061, win 501, length 164
15:24:37.933020 IP 143.110.216.40.22 > 99.228.88.180.65054: Flags [P.], seq 5913508:5913672, ack 3061, win 501, length 164
15:24:37.933056 IP 143.110.216.40.22 > 99.228.88.180.65054: Flags [P.], seq 5913672:5913836, ack 3061, win 501, length 164
15:24:37.933093 IP 143.110.216.40.22 > 99.228.88.180.65054: Flags [P.], seq 5913836:5914000, ack 3061, win 501, length 164
15:24:37.933130 IP 143.110.216.40.22 > 99.228.88.180.65054: Flags [P.], seq 5914000:5914164, ack 3061, win 501, length 164
15:24:37.933166 IP 143.110.216.40.22 > 99.228.88.180.65054: Flags [P.], seq 5914164:5914328, ack 3061, win 501, length 164
15:24:37.933201 IP 143.110.216.40.22 > 99.228.88.180.65054: Flags [P.], seq 5914328:5914492, ack 3061, win 501, length 164
15:24:37.933236 IP 143.110.216.40.22 > 99.228.88.180.65054: Flags [P.], seq 5914492:5914656, ack 3061, win 501, length 164
15:24:37.933274 IP 143.110.216.40.22 > 99.228.88.180.65054: Flags [P.], seq 5914656:5914820, ack 3061, win 501, length 164
15:24:37.933307 IP 143.110.216.40.22 > 99.228.88.180.65054: Flags [P.], seq 5914820:5914984, ack 3061, win 501, length 164
15:24:37.933340 IP 143.110.216.40.22 > 99.228.88.180.65054: Flags [P.], seq 5914984:5915148, ack 3061, win 501, length 164
15:24:37.933375 IP 143.110.216.40.22 > 99.228.88.180.65054: Flags [P.], seq 5915148:5915312, ack 3061, win 501, length 164
15:24:37.933408 IP 143.110.216.40.22 > 99.228.88.180.65054: Flags [P.], seq 5915312:5915476, ack 3061, win 501, length 164
15:24:37.933444 IP 143.110.216.40.22 > 99.228.88.180.65054: Flags [P.], seq 5915476:5915640, ack 3061, win 501, length 164
15:24:37.933480 IP 143.110.216.40.22 > 99.228.88.180.65054: Flags [P.], seq 5915640:5915804, ack 3061, win 501, length 164
15:24:37.933516 IP 143.110.216.40.22 > 99.228.88.180.65054: Flags [P.], seq 5915804:5915968, ack 3061, win 501, length 164
15:24:37.933549 IP 143.110.216.40.22 > 99.228.88.180.65054: Flags [P.], seq 5915968:5916132, ack 3061, win 501, length 164
15:24:37.933584 IP 143.110.216.40.22 > 99.228.88.180.65054: Flags [P.], seq 5916132:5916296, ack 3061, win 501, length 164
15:24:37.933618 IP 143.110.216.40.22 > 99.228.88.180.65054: Flags [P.], seq 5916296:5916460, ack 3061, win 501, length 164
15:24:37.933653 IP 143.110.216.40.22 > 99.228.88.180.65054: Flags [P.], seq 5916460:5916624, ack 3061, win 501, length 164
15:24:37.933687 IP 143.110.216.40.22 > 99.228.88.180.65054: Flags [P.], seq 5916624:5916788, ack 3061, win 501, length 164
15:24:37.933721 IP 143.110.216.40.22 > 99.228.88.180.65054: Flags [P.], seq 5916788:5916952, ack 3061, win 501, length 164
15:24:37.933758 IP 143.110.216.40.22 > 99.228.88.180.65054: Flags [P.], seq 5916952:5917116, ack 3061, win 501, length 164
15:24:37.933802 IP 143.110.216.40.22 > 99.228.88.180.65054: Flags [P.], seq 5917116:5917280, ack 3061, win 501, length 164
15:24:37.933839 IP 143.110.216.40.22 > 99.228.88.180.65054: Flags [P.], seq 5917280:5917444, ack 3061, win 501, length 164
15:24:37.933874 IP 143.110.216.40.22 > 99.228.88.180.65054: Flags [P.], seq 5917444:5917608, ack 3061, win 501, length 164
15:24:37.933911 IP 143.110.216.40.22 > 99.228.88.180.65054: Flags [P.], seq 5917608:5917772, ack 3061, win 501, length 164
15:24:37.933944 IP 143.110.216.40.22 > 99.228.88.180.65054: Flags [P.], seq 5917772:5917936, ack 3061, win 501, length 164
15:24:37.933977 IP 143.110.216.40.22 > 99.228.88.180.65054: Flags [P.], seq 5917936:5918100, ack 3061, win 501, length 164
15:24:37.934013 IP 143.110.216.40.22 > 99.228.88.180.65054: Flags [P.], seq 5918100:5918264, ack 3061, win 501, length 164
15:24:37.934049 IP 143.110.216.40.22 > 99.228.88.180.65054: Flags [P.], seq 5918264:5918428, ack 3061, win 501, length 164
15:24:37.934087 IP 143.110.216.40.22 > 99.228.88.180.65054: Flags [P.], seq 5918428:5918592, ack 3061, win 501, length 164
15:24:37.934127 IP 143.110.216.40.22 > 99.228.88.180.65054: Flags [P.], seq 5918592:5918756, ack 3061, win 501, length 164
15:24:37.934163 IP 143.110.216.40.22 > 99.228.88.180.65054: Flags [P.], seq 5918756:5918920, ack 3061, win 501, length 164
15:24:37.934196 IP 143.110.216.40.22 > 99.228.88.180.65054: Flags [P.], seq 5918920:5919084, ack 3061, win 501, length 164
15:24:37.934229 IP 143.110.216.40.22 > 99.228.88.180.65054: Flags [P.], seq 5919084:5919248, ack 3061, win 501, length 164
15:24:37.934265 IP 143.110.216.40.22 > 99.228.88.180.65054: Flags [P.], seq 5919248:5919412, ack 3061, win 501, length 164
15:24:37.934298 IP 143.110.216.40.22 > 99.228.88.180.65054: Flags [P.], seq 5919412:5919576, ack 3061, win 501, length 164
15:24:37.935639 IP 99.228.88.180.65054 > 143.110.216.40.22: Flags [.], ack 5725864, win 16499, length 0
15:24:37.935656 IP 143.110.216.40.22 > 99.228.88.180.65054: Flags [P.], seq 5919576:5919740, ack 3061, win 501, length 164
15:24:37.935749 IP 143.110.216.40.22 > 99.228.88.180.65054: Flags [P.], seq 5919740:5920008, ack 3061, win 501, length 268
15:24:37.943524 IP 99.228.88.180.65054 > 143.110.216.40.22: Flags [.], ack 5727504, win 16504, length 0
15:24:37.943566 IP 143.110.216.40.22 > 99.228.88.180.65054: Flags [P.], seq 5920008:5920172, ack 3061, win 501, length 164
15:24:37.943713 IP 143.110.216.40.22 > 99.228.88.180.65054: Flags [P.], seq 5920172:5920440, ack 3061, win 501, length 268
15:24:37.943766 IP 143.110.216.40.22 > 99.228.88.180.65054: Flags [P.], seq 5920440:5920604, ack 3061, win 501, length 164
15:24:37.943806 IP 143.110.216.40.22 > 99.228.88.180.65054: Flags [P.], seq 5920604:5920768, ack 3061, win 501, length 164
15:24:37.943845 IP 143.110.216.40.22 > 99.228.88.180.65054: Flags [P.], seq 5920768:5920932, ack 3061, win 501, length 164
15:24:37.943884 IP 143.110.216.40.22 > 99.228.88.180.65054: Flags [P.], seq 5920932:5921096, ack 3061, win 501, length 164
15:24:37.943922 IP 143.110.216.40.22 > 99.228.88.180.65054: Flags [P.], seq 5921096:5921260, ack 3061, win 501, length 164
15:24:37.943960 IP 143.110.216.40.22 > 99.228.88.180.65054: Flags [P.], seq 5921260:5921424, ack 3061, win 501, length 164
15:24:37.944000 IP 143.110.216.40.22 > 99.228.88.180.65054: Flags [P.], seq 5921424:5921588, ack 3061, win 501, length 164
15:24:37.944038 IP 143.110.216.40.22 > 99.228.88.180.65054: Flags [P.], seq 5921588:5921752, ack 3061, win 501, length 164
15:24:37.949037 IP 99.228.88.180.65054 > 143.110.216.40.22: Flags [.], ack 5733244, win 16501, length 0
15:24:37.949070 IP 143.110.216.40.22 > 99.228.88.180.65054: Flags [P.], seq 5921752:5921916, ack 3061, win 501, length 164
15:24:37.949171 IP 143.110.216.40.22 > 99.228.88.180.65054: Flags [P.], seq 5921916:5922184, ack 3061, win 501, length 268
15:24:37.949217 IP 143.110.216.40.22 > 99.228.88.180.65054: Flags [P.], seq 5922184:5922348, ack 3061, win 501, length 164
15:24:37.949255 IP 143.110.216.40.22 > 99.228.88.180.65054: Flags [P.], seq 5922348:5922512, ack 3061, win 501, length 164
15:24:37.949293 IP 143.110.216.40.22 > 99.228.88.180.65054: Flags [P.], seq 5922512:5922676, ack 3061, win 501, length 164
15:24:37.949342 IP 143.110.216.40.22 > 99.228.88.180.65054: Flags [P.], seq 5922676:5922840, ack 3061, win 501, length 164
15:24:37.949390 IP 143.110.216.40.22 > 99.228.88.180.65054: Flags [P.], seq 5922840:5923004, ack 3061, win 501, length 164
15:24:37.949440 IP 143.110.216.40.22 > 99.228.88.180.65054: Flags [P.], seq 5923004:5923168, ack 3061, win 501, length 164
15:24:37.949480 IP 143.110.216.40.22 > 99.228.88.180.65054: Flags [P.], seq 5923168:5923332, ack 3061, win 501, length 164
15:24:37.949517 IP 143.110.216.40.22 > 99.228.88.180.65054: Flags [P.], seq 5923332:5923496, ack 3061, win 501, length 164
15:24:37.949554 IP 143.110.216.40.22 > 99.228.88.180.65054: Flags [P.], seq 5923496:5923660, ack 3061, win 501, length 164
15:24:37.949590 IP 143.110.216.40.22 > 99.228.88.180.65054: Flags [P.], seq 5923660:5923824, ack 3061, win 501, length 164
15:24:37.949626 IP 143.110.216.40.22 > 99.228.88.180.65054: Flags [P.], seq 5923824:5923988, ack 3061, win 501, length 164
15:24:37.949663 IP 143.110.216.40.22 > 99.228.88.180.65054: Flags [P.], seq 5923988:5924152, ack 3061, win 501, length 164
15:24:37.949707 IP 143.110.216.40.22 > 99.228.88.180.65054: Flags [P.], seq 5924152:5924316, ack 3061, win 501, length 164
15:24:37.949759 IP 143.110.216.40.22 > 99.228.88.180.65054: Flags [P.], seq 5924316:5924480, ack 3061, win 501, length 164
15:24:37.949807 IP 143.110.216.40.22 > 99.228.88.180.65054: Flags [P.], seq 5924480:5924644, ack 3061, win 501, length 164
15:24:37.949842 IP 143.110.216.40.22 > 99.228.88.180.65054: Flags [P.], seq 5924644:5924808, ack 3061, win 501, length 164
15:24:37.949877 IP 143.110.216.40.22 > 99.228.88.180.65054: Flags [P.], seq 5924808:5924972, ack 3061, win 501, length 164
15:24:37.949911 IP 143.110.216.40.22 > 99.228.88.180.65054: Flags [P.], seq 5924972:5925136, ack 3061, win 501, length 164
15:24:37.949955 IP 143.110.216.40.22 > 99.228.88.180.65054: Flags [P.], seq 5925136:5925300, ack 3061, win 501, length 164
15:24:37.950004 IP 143.110.216.40.22 > 99.228.88.180.65054: Flags [P.], seq 5925300:5925464, ack 3061, win 501, length 164
15:24:37.950052 IP 143.110.216.40.22 > 99.228.88.180.65054: Flags [P.], seq 5925464:5925628, ack 3061, win 501, length 164
15:24:37.950098 IP 143.110.216.40.22 > 99.228.88.180.65054: Flags [P.], seq 5925628:5925792, ack 3061, win 501, length 164
15:24:37.950143 IP 143.110.216.40.22 > 99.228.88.180.65054: Flags [P.], seq 5925792:5925956, ack 3061, win 501, length 164
15:24:37.950191 IP 143.110.216.40.22 > 99.228.88.180.65054: Flags [P.], seq 5925956:5926120, ack 3061, win 501, length 164
15:24:37.950235 IP 143.110.216.40.22 > 99.228.88.180.65054: Flags [P.], seq 5926120:5926284, ack 3061, win 501, length 164
15:24:37.950273 IP 143.110.216.40.22 > 99.228.88.180.65054: Flags [P.], seq 5926284:5926448, ack 3061, win 501, length 164
15:24:37.950309 IP 143.110.216.40.22 > 99.228.88.180.65054: Flags [P.], seq 5926448:5926612, ack 3061, win 501, length 164
15:24:37.950345 IP 143.110.216.40.22 > 99.228.88.180.65054: Flags [P.], seq 5926612:5926776, ack 3061, win 501, length 164
15:24:37.950379 IP 143.110.216.40.22 > 99.228.88.180.65054: Flags [P.], seq 5926776:5926940, ack 3061, win 501, length 164
15:24:37.950415 IP 143.110.216.40.22 > 99.228.88.180.65054: Flags [P.], seq 5926940:5927104, ack 3061, win 501, length 164
15:24:37.950449 IP 143.110.216.40.22 > 99.228.88.180.65054: Flags [P.], seq 5927104:5927268, ack 3061, win 501, length 164
15:24:37.950486 IP 143.110.216.40.22 > 99.228.88.180.65054: Flags [P.], seq 5927268:5927432, ack 3061, win 501, length 164
15:24:37.950519 IP 143.110.216.40.22 > 99.228.88.180.65054: Flags [P.], seq 5927432:5927596, ack 3061, win 501, length 164
15:24:37.955819 IP 99.228.88.180.65054 > 143.110.216.40.22: Flags [.], ack 5742756, win 16501, length 0
15:24:37.955849 IP 143.110.216.40.22 > 99.228.88.180.65054: Flags [P.], seq 5927596:5927760, ack 3061, win 501, length 164
15:24:37.955913 IP 143.110.216.40.22 > 99.228.88.180.65054: Flags [P.], seq 5927760:5928028, ack 3061, win 501, length 268
15:24:37.955954 IP 143.110.216.40.22 > 99.228.88.180.65054: Flags [P.], seq 5928028:5928192, ack 3061, win 501, length 164
15:24:37.955990 IP 143.110.216.40.22 > 99.228.88.180.65054: Flags [P.], seq 5928192:5928356, ack 3061, win 501, length 164
15:24:37.956026 IP 143.110.216.40.22 > 99.228.88.180.65054: Flags [P.], seq 5928356:5928520, ack 3061, win 501, length 164
15:24:37.956063 IP 143.110.216.40.22 > 99.228.88.180.65054: Flags [P.], seq 5928520:5928684, ack 3061, win 501, length 164
15:24:37.956099 IP 143.110.216.40.22 > 99.228.88.180.65054: Flags [P.], seq 5928684:5928848, ack 3061, win 501, length 164
15:24:37.956135 IP 143.110.216.40.22 > 99.228.88.180.65054: Flags [P.], seq 5928848:5929012, ack 3061, win 501, length 164
15:24:37.956173 IP 143.110.216.40.22 > 99.228.88.180.65054: Flags [P.], seq 5929012:5929176, ack 3061, win 501, length 164
15:24:37.956218 IP 143.110.216.40.22 > 99.228.88.180.65054: Flags [P.], seq 5929176:5929340, ack 3061, win 501, length 164
15:24:37.956252 IP 143.110.216.40.22 > 99.228.88.180.65054: Flags [P.], seq 5929340:5929504, ack 3061, win 501, length 164
15:24:37.956289 IP 143.110.216.40.22 > 99.228.88.180.65054: Flags [P.], seq 5929504:5929668, ack 3061, win 501, length 164
15:24:37.956322 IP 143.110.216.40.22 > 99.228.88.180.65054: Flags [P.], seq 5929668:5929832, ack 3061, win 501, length 164
15:24:37.956358 IP 143.110.216.40.22 > 99.228.88.180.65054: Flags [P.], seq 5929832:5929996, ack 3061, win 501, length 164
15:24:37.956395 IP 143.110.216.40.22 > 99.228.88.180.65054: Flags [P.], seq 5929996:5930160, ack 3061, win 501, length 164
15:24:37.956431 IP 143.110.216.40.22 > 99.228.88.180.65054: Flags [P.], seq 5930160:5930324, ack 3061, win 501, length 164
15:24:37.956477 IP 143.110.216.40.22 > 99.228.88.180.65054: Flags [P.], seq 5930324:5930488, ack 3061, win 501, length 164
15:24:37.956513 IP 143.110.216.40.22 > 99.228.88.180.65054: Flags [P.], seq 5930488:5930652, ack 3061, win 501, length 164
15:24:37.956550 IP 143.110.216.40.22 > 99.228.88.180.65054: Flags [P.], seq 5930652:5930816, ack 3061, win 501, length 164
15:24:37.956584 IP 143.110.216.40.22 > 99.228.88.180.65054: Flags [P.], seq 5930816:5930980, ack 3061, win 501, length 164
15:24:37.956632 IP 143.110.216.40.22 > 99.228.88.180.65054: Flags [P.], seq 5930980:5931144, ack 3061, win 501, length 164
15:24:37.956684 IP 143.110.216.40.22 > 99.228.88.180.65054: Flags [P.], seq 5931144:5931308, ack 3061, win 501, length 164
15:24:37.956732 IP 143.110.216.40.22 > 99.228.88.180.65054: Flags [P.], seq 5931308:5931472, ack 3061, win 501, length 164
15:24:37.956769 IP 143.110.216.40.22 > 99.228.88.180.65054: Flags [P.], seq 5931472:5931636, ack 3061, win 501, length 164
15:24:37.956805 IP 143.110.216.40.22 > 99.228.88.180.65054: Flags [P.], seq 5931636:5931800, ack 3061, win 501, length 164
15:24:37.956841 IP 143.110.216.40.22 > 99.228.88.180.65054: Flags [P.], seq 5931800:5931964, ack 3061, win 501, length 164
15:24:37.956876 IP 143.110.216.40.22 > 99.228.88.180.65054: Flags [P.], seq 5931964:5932128, ack 3061, win 501, length 164
15:24:37.956912 IP 143.110.216.40.22 > 99.228.88.180.65054: Flags [P.], seq 5932128:5932292, ack 3061, win 501, length 164
15:24:37.956945 IP 143.110.216.40.22 > 99.228.88.180.65054: Flags [P.], seq 5932292:5932456, ack 3061, win 501, length 164
15:24:37.956982 IP 143.110.216.40.22 > 99.228.88.180.65054: Flags [P.], seq 5932456:5932620, ack 3061, win 501, length 164
15:24:37.957016 IP 143.110.216.40.22 > 99.228.88.180.65054: Flags [P.], seq 5932620:5932784, ack 3061, win 501, length 164
15:24:37.957052 IP 143.110.216.40.22 > 99.228.88.180.65054: Flags [P.], seq 5932784:5932948, ack 3061, win 501, length 164
15:24:37.957102 IP 143.110.216.40.22 > 99.228.88.180.65054: Flags [P.], seq 5932948:5933112, ack 3061, win 501, length 164
15:24:37.957137 IP 143.110.216.40.22 > 99.228.88.180.65054: Flags [P.], seq 5933112:5933276, ack 3061, win 501, length 164
15:24:37.957171 IP 143.110.216.40.22 > 99.228.88.180.65054: Flags [P.], seq 5933276:5933440, ack 3061, win 501, length 164
15:24:37.957205 IP 143.110.216.40.22 > 99.228.88.180.65054: Flags [P.], seq 5933440:5933604, ack 3061, win 501, length 164
15:24:37.957239 IP 143.110.216.40.22 > 99.228.88.180.65054: Flags [P.], seq 5933604:5933768, ack 3061, win 501, length 164
15:24:37.957276 IP 143.110.216.40.22 > 99.228.88.180.65054: Flags [P.], seq 5933768:5933932, ack 3061, win 501, length 164
15:24:37.957311 IP 143.110.216.40.22 > 99.228.88.180.65054: Flags [P.], seq 5933932:5934096, ack 3061, win 501, length 164
15:24:37.957347 IP 143.110.216.40.22 > 99.228.88.180.65054: Flags [P.], seq 5934096:5934260, ack 3061, win 501, length 164
15:24:37.957382 IP 143.110.216.40.22 > 99.228.88.180.65054: Flags [P.], seq 5934260:5934424, ack 3061, win 501, length 164
15:24:37.957419 IP 143.110.216.40.22 > 99.228.88.180.65054: Flags [P.], seq 5934424:5934588, ack 3061, win 501, length 164
15:24:37.957453 IP 143.110.216.40.22 > 99.228.88.180.65054: Flags [P.], seq 5934588:5934752, ack 3061, win 501, length 164
15:24:37.957490 IP 143.110.216.40.22 > 99.228.88.180.65054: Flags [P.], seq 5934752:5934916, ack 3061, win 501, length 164
15:24:37.957533 IP 143.110.216.40.22 > 99.228.88.180.65054: Flags [P.], seq 5934916:5935080, ack 3061, win 501, length 164
15:24:37.957581 IP 143.110.216.40.22 > 99.228.88.180.65054: Flags [P.], seq 5935080:5935244, ack 3061, win 501, length 164
15:24:37.957630 IP 143.110.216.40.22 > 99.228.88.180.65054: Flags [P.], seq 5935244:5935408, ack 3061, win 501, length 164
15:24:37.957669 IP 143.110.216.40.22 > 99.228.88.180.65054: Flags [P.], seq 5935408:5935572, ack 3061, win 501, length 164
15:24:37.957707 IP 143.110.216.40.22 > 99.228.88.180.65054: Flags [P.], seq 5935572:5935736, ack 3061, win 501, length 164
15:24:37.957742 IP 143.110.216.40.22 > 99.228.88.180.65054: Flags [P.], seq 5935736:5935900, ack 3061, win 501, length 164
15:24:37.957789 IP 143.110.216.40.22 > 99.228.88.180.65054: Flags [P.], seq 5935900:5936064, ack 3061, win 501, length 164
15:24:37.957824 IP 143.110.216.40.22 > 99.228.88.180.65054: Flags [P.], seq 5936064:5936228, ack 3061, win 501, length 164
15:24:37.957864 IP 143.110.216.40.22 > 99.228.88.180.65054: Flags [P.], seq 5936228:5936392, ack 3061, win 501, length 164
15:24:37.957902 IP 143.110.216.40.22 > 99.228.88.180.65054: Flags [P.], seq 5936392:5936556, ack 3061, win 501, length 164
15:24:37.957948 IP 143.110.216.40.22 > 99.228.88.180.65054: Flags [P.], seq 5936556:5936720, ack 3061, win 501, length 164
15:24:37.957984 IP 143.110.216.40.22 > 99.228.88.180.65054: Flags [P.], seq 5936720:5936884, ack 3061, win 501, length 164
15:24:37.958020 IP 143.110.216.40.22 > 99.228.88.180.65054: Flags [P.], seq 5936884:5937048, ack 3061, win 501, length 164
15:24:37.958055 IP 143.110.216.40.22 > 99.228.88.180.65054: Flags [P.], seq 5937048:5937212, ack 3061, win 501, length 164
15:24:37.962181 IP 99.228.88.180.65054 > 143.110.216.40.22: Flags [.], ack 5760468, win 16504, length 0
15:24:37.962240 IP 143.110.216.40.22 > 99.228.88.180.65054: Flags [P.], seq 5937212:5937376, ack 3061, win 501, length 164
15:24:37.962262 IP 99.228.88.180.65054 > 143.110.216.40.22: Flags [.], ack 5778284, win 16501, length 0
15:24:37.962366 IP 143.110.216.40.22 > 99.228.88.180.65054: Flags [P.], seq 5937376:5937748, ack 3061, win 501, length 372
15:24:37.962409 IP 143.110.216.40.22 > 99.228.88.180.65054: Flags [P.], seq 5937748:5937912, ack 3061, win 501, length 164
15:24:37.962444 IP 143.110.216.40.22 > 99.228.88.180.65054: Flags [P.], seq 5937912:5938076, ack 3061, win 501, length 164
15:24:37.962482 IP 143.110.216.40.22 > 99.228.88.180.65054: Flags [P.], seq 5938076:5938240, ack 3061, win 501, length 164
15:24:37.962518 IP 143.110.216.40.22 > 99.228.88.180.65054: Flags [P.], seq 5938240:5938404, ack 3061, win 501, length 164
15:24:37.962555 IP 143.110.216.40.22 > 99.228.88.180.65054: Flags [P.], seq 5938404:5938568, ack 3061, win 501, length 164
15:24:37.962591 IP 143.110.216.40.22 > 99.228.88.180.65054: Flags [P.], seq 5938568:5938732, ack 3061, win 501, length 164
15:24:37.962636 IP 143.110.216.40.22 > 99.228.88.180.65054: Flags [P.], seq 5938732:5938896, ack 3061, win 501, length 164
15:24:37.962684 IP 143.110.216.40.22 > 99.228.88.180.65054: Flags [P.], seq 5938896:5939060, ack 3061, win 501, length 164
15:24:37.962734 IP 143.110.216.40.22 > 99.228.88.180.65054: Flags [P.], seq 5939060:5939224, ack 3061, win 501, length 164
15:24:37.962790 IP 143.110.216.40.22 > 99.228.88.180.65054: Flags [P.], seq 5939224:5939388, ack 3061, win 501, length 164
15:24:37.962832 IP 143.110.216.40.22 > 99.228.88.180.65054: Flags [P.], seq 5939388:5939552, ack 3061, win 501, length 164
15:24:37.962882 IP 143.110.216.40.22 > 99.228.88.180.65054: Flags [P.], seq 5939552:5939716, ack 3061, win 501, length 164
15:24:37.962943 IP 143.110.216.40.22 > 99.228.88.180.65054: Flags [P.], seq 5939716:5939880, ack 3061, win 501, length 164
15:24:37.962983 IP 143.110.216.40.22 > 99.228.88.180.65054: Flags [P.], seq 5939880:5940044, ack 3061, win 501, length 164
15:24:37.963020 IP 143.110.216.40.22 > 99.228.88.180.65054: Flags [P.], seq 5940044:5940208, ack 3061, win 501, length 164
15:24:37.963070 IP 143.110.216.40.22 > 99.228.88.180.65054: Flags [P.], seq 5940208:5940372, ack 3061, win 501, length 164
15:24:37.963121 IP 143.110.216.40.22 > 99.228.88.180.65054: Flags [P.], seq 5940372:5940536, ack 3061, win 501, length 164
15:24:37.963156 IP 143.110.216.40.22 > 99.228.88.180.65054: Flags [P.], seq 5940536:5940700, ack 3061, win 501, length 164
15:24:37.963191 IP 143.110.216.40.22 > 99.228.88.180.65054: Flags [P.], seq 5940700:5940864, ack 3061, win 501, length 164
15:24:37.963226 IP 143.110.216.40.22 > 99.228.88.180.65054: Flags [P.], seq 5940864:5941028, ack 3061, win 501, length 164
15:24:37.963260 IP 143.110.216.40.22 > 99.228.88.180.65054: Flags [P.], seq 5941028:5941192, ack 3061, win 501, length 164
15:24:37.963294 IP 143.110.216.40.22 > 99.228.88.180.65054: Flags [P.], seq 5941192:5941356, ack 3061, win 501, length 164
15:24:37.963328 IP 143.110.216.40.22 > 99.228.88.180.65054: Flags [P.], seq 5941356:5941520, ack 3061, win 501, length 164
15:24:37.963365 IP 143.110.216.40.22 > 99.228.88.180.65054: Flags [P.], seq 5941520:5941684, ack 3061, win 501, length 164
15:24:37.963402 IP 143.110.216.40.22 > 99.228.88.180.65054: Flags [P.], seq 5941684:5941848, ack 3061, win 501, length 164
15:24:37.963448 IP 143.110.216.40.22 > 99.228.88.180.65054: Flags [P.], seq 5941848:5942012, ack 3061, win 501, length 164
15:24:37.963497 IP 143.110.216.40.22 > 99.228.88.180.65054: Flags [P.], seq 5942012:5942176, ack 3061, win 501, length 164
15:24:37.963543 IP 143.110.216.40.22 > 99.228.88.180.65054: Flags [P.], seq 5942176:5942340, ack 3061, win 501, length 164
15:24:37.963583 IP 143.110.216.40.22 > 99.228.88.180.65054: Flags [P.], seq 5942340:5942504, ack 3061, win 501, length 164
15:24:37.963618 IP 143.110.216.40.22 > 99.228.88.180.65054: Flags [P.], seq 5942504:5942668, ack 3061, win 501, length 164
15:24:37.963655 IP 143.110.216.40.22 > 99.228.88.180.65054: Flags [P.], seq 5942668:5942832, ack 3061, win 501, length 164
15:24:37.963690 IP 143.110.216.40.22 > 99.228.88.180.65054: Flags [P.], seq 5942832:5942996, ack 3061, win 501, length 164
15:24:37.963726 IP 143.110.216.40.22 > 99.228.88.180.65054: Flags [P.], seq 5942996:5943160, ack 3061, win 501, length 164
15:24:37.963760 IP 143.110.216.40.22 > 99.228.88.180.65054: Flags [P.], seq 5943160:5943324, ack 3061, win 501, length 164
15:24:37.963798 IP 143.110.216.40.22 > 99.228.88.180.65054: Flags [P.], seq 5943324:5943488, ack 3061, win 501, length 164
15:24:37.963833 IP 143.110.216.40.22 > 99.228.88.180.65054: Flags [P.], seq 5943488:5943652, ack 3061, win 501, length 164
15:24:37.963869 IP 143.110.216.40.22 > 99.228.88.180.65054: Flags [P.], seq 5943652:5943816, ack 3061, win 501, length 164
15:24:37.963906 IP 143.110.216.40.22 > 99.228.88.180.65054: Flags [P.], seq 5943816:5943980, ack 3061, win 501, length 164
15:24:37.963940 IP 143.110.216.40.22 > 99.228.88.180.65054: Flags [P.], seq 5943980:5944144, ack 3061, win 501, length 164
15:24:37.963975 IP 143.110.216.40.22 > 99.228.88.180.65054: Flags [P.], seq 5944144:5944308, ack 3061, win 501, length 164
15:24:37.964012 IP 143.110.216.40.22 > 99.228.88.180.65054: Flags [P.], seq 5944308:5944472, ack 3061, win 501, length 164
15:24:37.964048 IP 143.110.216.40.22 > 99.228.88.180.65054: Flags [P.], seq 5944472:5944636, ack 3061, win 501, length 164
15:24:37.964091 IP 143.110.216.40.22 > 99.228.88.180.65054: Flags [P.], seq 5944636:5944800, ack 3061, win 501, length 164
15:24:37.964134 IP 143.110.216.40.22 > 99.228.88.180.65054: Flags [P.], seq 5944800:5944964, ack 3061, win 501, length 164
15:24:37.964169 IP 143.110.216.40.22 > 99.228.88.180.65054: Flags [P.], seq 5944964:5945128, ack 3061, win 501, length 164
15:24:37.964203 IP 143.110.216.40.22 > 99.228.88.180.65054: Flags [P.], seq 5945128:5945292, ack 3061, win 501, length 164
15:24:37.964241 IP 143.110.216.40.22 > 99.228.88.180.65054: Flags [P.], seq 5945292:5945456, ack 3061, win 501, length 164
15:24:37.964275 IP 143.110.216.40.22 > 99.228.88.180.65054: Flags [P.], seq 5945456:5945620, ack 3061, win 501, length 164
15:24:37.964312 IP 143.110.216.40.22 > 99.228.88.180.65054: Flags [P.], seq 5945620:5945784, ack 3061, win 501, length 164
15:24:37.964346 IP 143.110.216.40.22 > 99.228.88.180.65054: Flags [P.], seq 5945784:5945948, ack 3061, win 501, length 164
15:24:37.964381 IP 143.110.216.40.22 > 99.228.88.180.65054: Flags [P.], seq 5945948:5946112, ack 3061, win 501, length 164
15:24:37.964418 IP 143.110.216.40.22 > 99.228.88.180.65054: Flags [P.], seq 5946112:5946276, ack 3061, win 501, length 164
15:24:37.964453 IP 143.110.216.40.22 > 99.228.88.180.65054: Flags [P.], seq 5946276:5946440, ack 3061, win 501, length 164
15:24:37.964490 IP 143.110.216.40.22 > 99.228.88.180.65054: Flags [P.], seq 5946440:5946604, ack 3061, win 501, length 164
15:24:37.964524 IP 143.110.216.40.22 > 99.228.88.180.65054: Flags [P.], seq 5946604:5946768, ack 3061, win 501, length 164
15:24:37.964561 IP 143.110.216.40.22 > 99.228.88.180.65054: Flags [P.], seq 5946768:5946932, ack 3061, win 501, length 164
15:24:37.964595 IP 143.110.216.40.22 > 99.228.88.180.65054: Flags [P.], seq 5946932:5947096, ack 3061, win 501, length 164
15:24:37.964642 IP 143.110.216.40.22 > 99.228.88.180.65054: Flags [P.], seq 5947096:5947260, ack 3061, win 501, length 164
15:24:37.964680 IP 143.110.216.40.22 > 99.228.88.180.65054: Flags [P.], seq 5947260:5947424, ack 3061, win 501, length 164
15:24:37.964714 IP 143.110.216.40.22 > 99.228.88.180.65054: Flags [P.], seq 5947424:5947588, ack 3061, win 501, length 164
15:24:37.964751 IP 143.110.216.40.22 > 99.228.88.180.65054: Flags [P.], seq 5947588:5947752, ack 3061, win 501, length 164
15:24:37.964785 IP 143.110.216.40.22 > 99.228.88.180.65054: Flags [P.], seq 5947752:5947916, ack 3061, win 501, length 164
15:24:37.964835 IP 143.110.216.40.22 > 99.228.88.180.65054: Flags [P.], seq 5947916:5948080, ack 3061, win 501, length 164
15:24:37.964871 IP 143.110.216.40.22 > 99.228.88.180.65054: Flags [P.], seq 5948080:5948244, ack 3061, win 501, length 164
